logs/calib_no_uname.txt
[12/28/2021-10:07:24] [V] [TRT] *************** Autotuning Reformat:Float(3072,1024,32,1) -> Int8(3072,1024,32,1) ***************
[12/28/2021-10:07:24] [V] [TRT] --------------- Timing Runner: Optimizer Reformat (Reformat)
[12/28/2021-10:07:24] [V] [TRT] Setting a default quantization params because quantization data is missing for 
[12/28/2021-10:07:24] [V] [TRT] Tactic: 1002 Time: 0.039916
[12/28/2021-10:07:24] [V] [TRT] Setting a default quantization params because quantization data is missing for 
[12/28/2021-10:07:24] [V] [TRT] Tactic: 0 Time: 0.00546
[12/28/2021-10:07:24] [V] [TRT] Fastest Tactic: 0 Time: 0.00546
[12/28/2021-10:07:24] [V] [TRT] *************** Autotuning format combination: Int8(3072,1024,32,1) -> Int8(128,64:32,8,1) ***************
[12/28/2021-10:07:24] [V] [TRT] --------------- Timing Runner: Conv_2 + Relu_5 + MaxPool_8 (ConvActPool)
[12/28/2021-10:07:24] [V] [TRT] Tactic: 1000 Time: 0.014764
[12/28/2021-10:07:24] [V] [TRT] Tactic: 1100 Time: 0.014616
[12/28/2021-10:07:24] [V] [TRT] Tactic: 1110 Time: 0.015808
[12/28/2021-10:07:24] [V] [TRT] Tactic: 1111 Time: 0.014604
[12/28/2021-10:07:24] [V] [TRT] Tactic: 1112 Time: 0.018052
[12/28/2021-10:07:24] [V] [TRT] Tactic: 1120 Time: 0.015908
[12/28/2021-10:07:24] [V] [TRT] Tactic: 1121 Time: 0.014868
[12/28/2021-10:07:24] [V] [TRT] Tactic: 1122 Time: 0.018168
[12/28/2021-10:07:24] [V] [TRT] Tactic: 1130 Time: 0.015992
[12/28/2021-10:07:24] [V] [TRT] Tactic: 1131 Time: 0.0146
[12/28/2021-10:07:24] [V] [TRT] Tactic: 1132 Time: 0.018128
[12/28/2021-10:07:24] [V] [TRT] Tactic: 1140 Time: 0.016064
[12/28/2021-10:07:24] [V] [TRT] Tactic: 1141 Time: 0.014868
[12/28/2021-10:07:24] [V] [TRT] Tactic: 1142 Time: 0.018272
[12/28/2021-10:07:24] [V] [TRT] Fastest Tactic: 1131 Time: 0.0146
[12/28/2021-10:07:24] [V] [TRT] >>>>>>>>>>>>>>> Chose Runner Type: ConvActPool Tactic: 1131
[12/28/2021-10:07:24] [V] [TRT] *************** Autotuning Reformat:Int8(128,64:32,8,1) -> Float(4096,64,8,1) ***************
[12/28/2021-10:07:24] [V] [TRT] --------------- Timing Runner: Optimizer Reformat (Reformat)
[12/28/2021-10:07:24] [V] [TRT] Setting a default quantization params because quantization data is missing for 
[12/28/2021-10:07:24] [V] [TRT] Tactic: 1002 Time: 0.007944
[12/28/2021-10:07:24] [V] [TRT] Setting a default quantization params because quantization data is missing for 
[12/28/2021-10:07:24] [V] [TRT] Tactic: 0 Time: 0.006272
[12/28/2021-10:07:24] [V] [TRT] Fastest Tactic: 0 Time: 0.006272
[12/28/2021-10:07:24] [V] [TRT] *************** Autotuning Reformat:Int8(128,64:32,8,1) -> Float(4096,1,512,64) ***************
[12/28/2021-10:07:24] [V] [TRT] --------------- Timing Runner: Optimizer Reformat (Reformat)
[12/28/2021-10:07:24] [V] [TRT] Setting a default quantization params because quantization data is missing for 
[12/28/2021-10:07:24] [V] [TRT] Tactic: 1002 Time: 0.007644
[12/28/2021-10:07:24] [V] [TRT] Setting a default quantization params because quantization data is missing for 
[12/28/2021-10:07:24] [V] [TRT] Tactic: 0 Time: 0.006296
[12/28/2021-10:07:24] [V] [TRT] Fastest Tactic: 0 Time: 0.006296
[12/28/2021-10:07:24] [V] [TRT] *************** Autotuning Reformat:Int8(128,64:32,8,1) -> Float(1024,1:4,128,16) ***************
[12/28/2021-10:07:24] [V] [TRT] --------------- Timing Runner: Optimizer Reformat (Reformat)
[12/28/2021-10:07:24] [V] [TRT] Setting a default quantization params because quantization data is missing for 
[12/28/2021-10:07:24] [V] [TRT] Tactic: 1002 Time: 0.008796
[12/28/2021-10:07:24] [V] [TRT] Setting a default quantization params because quantization data is missing for 
[12/28/2021-10:07:24] [V] [TRT] Tactic: 0 Time: 0.006632
[12/28/2021-10:07:24] [V] [TRT] Fastest Tactic: 0 Time: 0.006632
[12/28/2021-10:07:24] [V] [TRT] *************** Autotuning Reformat:Int8(128,64:32,8,1) -> Float(128,64:32,8,1) ***************
[12/28/2021-10:07:24] [V] [TRT] --------------- Timing Runner: Optimizer Reformat (Reformat)
[12/28/2021-10:07:24] [V] [TRT] Setting a default quantization params because quantization data is missing for 
[12/28/2021-10:07:24] [V] [TRT] Tactic: 1002 Time: 0.00828
[12/28/2021-10:07:24] [V] [TRT] Setting a default quantization params because quantization data is missing for 
[12/28/2021-10:07:24] [V] [TRT] Tactic: 0 Time: 0.009992
[12/28/2021-10:07:24] [V] [TRT] Fastest Tactic: 1002 Time: 0.00828
[12/28/2021-10:07:24] [V] [TRT] *************** Autotuning Reformat:Int8(128,64:32,8,1) -> Int8(1024,64:4,8,1) ***************
[12/28/2021-10:07:24] [V] [TRT] --------------- Timing Runner: Optimizer Reformat (Reformat)
[12/28/2021-10:07:24] [V] [TRT] Setting a default quantization params because quantization data is missing for 
[12/28/2021-10:07:24] [V] [TRT] Tactic: 1002 Time: 0.00748
[12/28/2021-10:07:24] [V] [TRT] Setting a default quantization params because quantization data is missing for 
[12/28/2021-10:07:24] [V] [TRT] Tactic: 0 Time: 0.005088
[12/28/2021-10:07:24] [V] [TRT] Setting a default quantization params because quantization data is missing for 
[12/28/2021-10:07:24] [V] [TRT] Tactic: 1 Time: 0.005556
[12/28/2021-10:07:24] [V] [TRT] Fastest Tactic: 0 Time: 0.005088
[12/28/2021-10:07:24] [V] [TRT] *************** Autotuning Reformat:Float(4096,64,8,1) -> Float(4096,1,512,64) ***************
[12/28/2021-10:07:24] [V] [TRT] --------------- Timing Runner: Optimizer Reformat (Reformat)
[12/28/2021-10:07:24] [V] [TRT] Setting a default quantization params because quantization data is missing for 
[12/28/2021-10:07:24] [V] [TRT] Tactic: 1002 Time: 0.008616
[12/28/2021-10:07:24] [V] [TRT] Setting a default quantization params because quantization data is missing for 
[12/28/2021-10:07:24] [V] [TRT] Tactic: 0 Time: 0.006304
[12/28/2021-10:07:24] [V] [TRT] Fastest Tactic: 0 Time: 0.006304
[12/28/2021-10:07:24] [V] [TRT] *************** Autotuning Reformat:Float(4096,64,8,1) -> Float(1024,1:4,128,16) ***************
[12/28/2021-10:07:24] [V] [TRT] --------------- Timing Runner: Optimizer Reformat (Reformat)
[12/28/2021-10:07:24] [V] [TRT] Setting a default quantization params because quantization data is missing for 
[12/28/2021-10:07:24] [V] [TRT] Tactic: 1002 Time: 0.008756
[12/28/2021-10:07:24] [V] [TRT] Setting a default quantization params because quantization data is missing for 
[12/28/2021-10:07:24] [V] [TRT] Tactic: 0 Time: 0.006352
[12/28/2021-10:07:24] [V] [TRT] Fastest Tactic: 0 Time: 0.006352
[12/28/2021-10:07:24] [V] [TRT] *************** Autotuning Reformat:Float(4096,64,8,1) -> Int8(1024,64:4,8,1) ***************
[12/28/2021-10:07:24] [V] [TRT] --------------- Timing Runner: Optimizer Reformat (Reformat)
[12/28/2021-10:07:24] [V] [TRT] Setting a default quantization params because quantization data is missing for 
[12/28/2021-10:07:24] [V] [TRT] Tactic: 1002 Time: 0.007496
[12/28/2021-10:07:24] [V] [TRT] Setting a default quantization params because quantization data is missing for 
[12/28/2021-10:07:24] [V] [TRT] Tactic: 0 Time: 0.005052
[12/28/2021-10:07:24] [V] [TRT] Fastest Tactic: 0 Time: 0.005052
[12/28/2021-10:07:24] [V] [TRT] *************** Autotuning Reformat:Float(4096,64,8,1) -> Int8(128,64:32,8,1) ***************
[12/28/2021-10:07:24] [V] [TRT] --------------- Timing Runner: Optimizer Reformat (Reformat)
[12/28/2021-10:07:24] [V] [TRT] Setting a default quantization params because quantization data is missing for 
[12/28/2021-10:07:24] [V] [TRT] Tactic: 1002 Time: 0.007548
[12/28/2021-10:07:24] [V] [TRT] Setting a default quantization params because quantization data is missing for 
[12/28/2021-10:07:24] [V] [TRT] Tactic: 0 Time: 0.007776
[12/28/2021-10:07:24] [V] [TRT] Fastest Tactic: 1002 Time: 0.007548
[12/28/2021-10:07:24] [V] [TRT] *************** Autotuning Reformat:Float(4096,1,512,64) -> Float(4096,64,8,1) ***************
[12/28/2021-10:07:24] [V] [TRT] --------------- Timing Runner: Optimizer Reformat (Reformat)
[12/28/2021-10:07:24] [V] [TRT] Setting a default quantization params because quantization data is missing for 
[12/28/2021-10:07:24] [V] [TRT] Tactic: 1002 Time: 0.008736
[12/28/2021-10:07:24] [V] [TRT] Setting a default quantization params because quantization data is missing for 
[12/28/2021-10:07:24] [V] [TRT] Tactic: 0 Time: 0.006372
[12/28/2021-10:07:24] [V] [TRT] Fastest Tactic: 0 Time: 0.006372
[12/28/2021-10:07:24] [V] [TRT] *************** Autotuning Reformat:Float(4096,1,512,64) -> Float(1024,1:4,128,16) ***************
[12/28/2021-10:07:24] [V] [TRT] --------------- Timing Runner: Optimizer Reformat (Reformat)
[12/28/2021-10:07:24] [V] [TRT] Setting a default quantization params because quantization data is missing for 
[12/28/2021-10:07:24] [V] [TRT] Tactic: 1002 Time: 0.00778
[12/28/2021-10:07:24] [V] [TRT] Setting a default quantization params because quantization data is missing for 
[12/28/2021-10:07:24] [V] [TRT] Tactic: 0 Time: 0.00612
[12/28/2021-10:07:24] [V] [TRT] Fastest Tactic: 0 Time: 0.00612
[12/28/2021-10:07:24] [V] [TRT] *************** Autotuning Reformat:Float(4096,1,512,64) -> Int8(1024,64:4,8,1) ***************
[12/28/2021-10:07:24] [V] [TRT] --------------- Timing Runner: Optimizer Reformat (Reformat)
[12/28/2021-10:07:24] [V] [TRT] Setting a default quantization params because quantization data is missing for 
[12/28/2021-10:07:24] [V] [TRT] Tactic: 1002 Time: 0.0077
[12/28/2021-10:07:24] [V] [TRT] Setting a default quantization params because quantization data is missing for 
[12/28/2021-10:07:24] [V] [TRT] Tactic: 0 Time: 0.006612
[12/28/2021-10:07:24] [V] [TRT] Fastest Tactic: 0 Time: 0.006612
[12/28/2021-10:07:24] [V] [TRT] *************** Autotuning Reformat:Float(4096,1,512,64) -> Int8(128,64:32,8,1) ***************
[12/28/2021-10:07:24] [V] [TRT] --------------- Timing Runner: Optimizer Reformat (Reformat)
[12/28/2021-10:07:24] [V] [TRT] Setting a default quantization params because quantization data is missing for 
[12/28/2021-10:07:24] [V] [TRT] Tactic: 1002 Time: 0.007616
[12/28/2021-10:07:24] [V] [TRT] Setting a default quantization params because quantization data is missing for 
[12/28/2021-10:07:24] [V] [TRT] Tactic: 0 Time: 0.008404
[12/28/2021-10:07:24] [V] [TRT] Fastest Tactic: 1002 Time: 0.007616
[12/28/2021-10:07:24] [V] [TRT] *************** Autotuning Reformat:Float(1024,1:4,128,16) -> Float(4096,64,8,1) ***************
[12/28/2021-10:07:24] [V] [TRT] --------------- Timing Runner: Optimizer Reformat (Reformat)
[12/28/2021-10:07:24] [V] [TRT] Setting a default quantization params because quantization data is missing for 
[12/28/2021-10:07:24] [V] [TRT] Tactic: 1002 Time: 0.00876
[12/28/2021-10:07:24] [V] [TRT] Setting a default quantization params because quantization data is missing for 
[12/28/2021-10:07:24] [V] [TRT] Tactic: 0 Time: 0.006356
[12/28/2021-10:07:24] [V] [TRT] Fastest Tactic: 0 Time: 0.006356
[12/28/2021-10:07:24] [V] [TRT] *************** Autotuning Reformat:Float(1024,1:4,128,16) -> Float(4096,1,512,64) ***************
[12/28/2021-10:07:24] [V] [TRT] --------------- Timing Runner: Optimizer Reformat (Reformat)
[12/28/2021-10:07:24] [V] [TRT] Setting a default quantization params because quantization data is missing for 
[12/28/2021-10:07:24] [V] [TRT] Tactic: 1002 Time: 0.007648
[12/28/2021-10:07:24] [V] [TRT] Setting a default quantization params because quantization data is missing for 
[12/28/2021-10:07:24] [V] [TRT] Tactic: 0 Time: 0.006132
[12/28/2021-10:07:24] [V] [TRT] Fastest Tactic: 0 Time: 0.006132
[12/28/2021-10:07:24] [V] [TRT] *************** Autotuning Reformat:Float(1024,1:4,128,16) -> Int8(1024,64:4,8,1) ***************
[12/28/2021-10:07:24] [V] [TRT] --------------- Timing Runner: Optimizer Reformat (Reformat)
[12/28/2021-10:07:24] [V] [TRT] Setting a default quantization params because quantization data is missing for 
[12/28/2021-10:07:24] [V] [TRT] Tactic: 1002 Time: 0.008716
[12/28/2021-10:07:24] [V] [TRT] Setting a default quantization params because quantization data is missing for 
[12/28/2021-10:07:24] [V] [TRT] Tactic: 0 Time: 0.006728
[12/28/2021-10:07:24] [V] [TRT] Fastest Tactic: 0 Time: 0.006728
[12/28/2021-10:07:24] [V] [TRT] *************** Autotuning Reformat:Float(1024,1:4,128,16) -> Int8(128,64:32,8,1) ***************
[12/28/2021-10:07:24] [V] [TRT] --------------- Timing Runner: Optimizer Reformat (Reformat)
[12/28/2021-10:07:24] [V] [TRT] Setting a default quantization params because quantization data is missing for 
[12/28/2021-10:07:24] [V] [TRT] Tactic: 1002 Time: 0.008816
[12/28/2021-10:07:24] [V] [TRT] Setting a default quantization params because quantization data is missing for 
[12/28/2021-10:07:24] [V] [TRT] Tactic: 0 Time: 0.008344
[12/28/2021-10:07:24] [V] [TRT] Fastest Tactic: 0 Time: 0.008344
[12/28/2021-10:07:24] [V] [TRT] *************** Autotuning Reformat:Float(128,64:32,8,1) -> Float(4096,64,8,1) ***************
[12/28/2021-10:07:24] [V] [TRT] --------------- Timing Runner: Optimizer Reformat (Reformat)
[12/28/2021-10:07:24] [V] [TRT] Setting a default quantization params because quantization data is missing for 
[12/28/2021-10:07:24] [V] [TRT] Tactic: 1002 Time: 0.008756
[12/28/2021-10:07:24] [V] [TRT] Setting a default quantization params because quantization data is missing for 
[12/28/2021-10:07:24] [V] [TRT] Tactic: 0 Time: 0.006476
[12/28/2021-10:07:24] [V] [TRT] Fastest Tactic: 0 Time: 0.006476
[12/28/2021-10:07:24] [V] [TRT] *************** Autotuning Reformat:Float(128,64:32,8,1) -> Float(4096,1,512,64) ***************
[12/28/2021-10:07:24] [V] [TRT] --------------- Timing Runner: Optimizer Reformat (Reformat)
[12/28/2021-10:07:24] [V] [TRT] Setting a default quantization params because quantization data is missing for 
[12/28/2021-10:07:24] [V] [TRT] Tactic: 1002 Time: 0.00862
[12/28/2021-10:07:24] [V] [TRT] Setting a default quantization params because quantization data is missing for 
[12/28/2021-10:07:24] [V] [TRT] Tactic: 0 Time: 0.006204
[12/28/2021-10:07:24] [V] [TRT] Fastest Tactic: 0 Time: 0.006204
[12/28/2021-10:07:24] [V] [TRT] *************** Autotuning Reformat:Float(128,64:32,8,1) -> Float(1024,1:4,128,16) ***************
[12/28/2021-10:07:24] [V] [TRT] --------------- Timing Runner: Optimizer Reformat (Reformat)
[12/28/2021-10:07:24] [V] [TRT] Setting a default quantization params because quantization data is missing for 
[12/28/2021-10:07:24] [V] [TRT] Tactic: 1002 Time: 0.007516
[12/28/2021-10:07:24] [V] [TRT] Setting a default quantization params because quantization data is missing for 
[12/28/2021-10:07:24] [V] [TRT] Tactic: 0 Time: 0.006268
[12/28/2021-10:07:24] [V] [TRT] Fastest Tactic: 0 Time: 0.006268
[12/28/2021-10:07:24] [V] [TRT] *************** Autotuning Reformat:Float(128,64:32,8,1) -> Int8(1024,64:4,8,1) ***************
[12/28/2021-10:07:24] [V] [TRT] --------------- Timing Runner: Optimizer Reformat (Reformat)
[12/28/2021-10:07:24] [V] [TRT] Setting a default quantization params because quantization data is missing for 
[12/28/2021-10:07:24] [V] [TRT] Tactic: 1002 Time: 0.007916
[12/28/2021-10:07:24] [V] [TRT] Setting a default quantization params because quantization data is missing for 
[12/28/2021-10:07:24] [V] [TRT] Tactic: 0 Time: 0.0066
[12/28/2021-10:07:24] [V] [TRT] Fastest Tactic: 0 Time: 0.0066
[12/28/2021-10:07:24] [V] [TRT] *************** Autotuning Reformat:Float(128,64:32,8,1) -> Int8(128,64:32,8,1) ***************
[12/28/2021-10:07:24] [V] [TRT] --------------- Timing Runner: Optimizer Reformat (Reformat)
[12/28/2021-10:07:24] [V] [TRT] Setting a default quantization params because quantization data is missing for 
[12/28/2021-10:07:24] [V] [TRT] Tactic: 1002 Time: 0.008076
[12/28/2021-10:07:24] [V] [TRT] Setting a default quantization params because quantization data is missing for 
[12/28/2021-10:07:24] [V] [TRT] Tactic: 0 Time: 0.008272
[12/28/2021-10:07:24] [V] [TRT] Fastest Tactic: 1002 Time: 0.008076
[12/28/2021-10:07:24] [V] [TRT] *************** Autotuning Reformat:Int8(1024,64:4,8,1) -> Float(4096,64,8,1) ***************
[12/28/2021-10:07:24] [V] [TRT] --------------- Timing Runner: Optimizer Reformat (Reformat)
[12/28/2021-10:07:24] [V] [TRT] Setting a default quantization params because quantization data is missing for 
[12/28/2021-10:07:24] [V] [TRT] Tactic: 1002 Time: 0.008008
[12/28/2021-10:07:24] [V] [TRT] Setting a default quantization params because quantization data is missing for 
[12/28/2021-10:07:24] [V] [TRT] Tactic: 0 Time: 0.005368
[12/28/2021-10:07:24] [V] [TRT] Fastest Tactic: 0 Time: 0.005368
[12/28/2021-10:07:24] [V] [TRT] *************** Autotuning Reformat:Int8(1024,64:4,8,1) -> Float(4096,1,512,64) ***************
[12/28/2021-10:07:24] [V] [TRT] --------------- Timing Runner: Optimizer Reformat (Reformat)
[12/28/2021-10:07:24] [V] [TRT] Setting a default quantization params because quantization data is missing for 
[12/28/2021-10:07:24] [V] [TRT] Tactic: 1002 Time: 0.008428
[12/28/2021-10:07:24] [V] [TRT] Setting a default quantization params because quantization data is missing for 
[12/28/2021-10:07:24] [V] [TRT] Tactic: 0 Time: 0.00656
[12/28/2021-10:07:24] [V] [TRT] Fastest Tactic: 0 Time: 0.00656
[12/28/2021-10:07:24] [V] [TRT] *************** Autotuning Reformat:Int8(1024,64:4,8,1) -> Float(1024,1:4,128,16) ***************
[12/28/2021-10:07:24] [V] [TRT] --------------- Timing Runner: Optimizer Reformat (Reformat)
[12/28/2021-10:07:24] [V] [TRT] Setting a default quantization params because quantization data is missing for 
[12/28/2021-10:07:24] [V] [TRT] Tactic: 1002 Time: 0.008952
[12/28/2021-10:07:24] [V] [TRT] Setting a default quantization params because quantization data is missing for 
[12/28/2021-10:07:24] [V] [TRT] Tactic: 0 Time: 0.0067
[12/28/2021-10:07:24] [V] [TRT] Fastest Tactic: 0 Time: 0.0067
[12/28/2021-10:07:24] [V] [TRT] *************** Autotuning Reformat:Int8(1024,64:4,8,1) -> Int8(128,64:32,8,1) ***************
[12/28/2021-10:07:24] [V] [TRT] --------------- Timing Runner: Optimizer Reformat (Reformat)
[12/28/2021-10:07:24] [V] [TRT] Setting a default quantization params because quantization data is missing for 
[12/28/2021-10:07:24] [V] [TRT] Tactic: 1002 Time: 0.007572
[12/28/2021-10:07:24] [V] [TRT] Setting a default quantization params because quantization data is missing for 
[12/28/2021-10:07:24] [V] [TRT] Tactic: 0 Time: 0.00556
[12/28/2021-10:07:24] [V] [TRT] Fastest Tactic: 0 Time: 0.00556
[12/28/2021-10:07:24] [V] [TRT] *************** Autotuning Reformat:Int8(128,64:32,8,1) -> Float(4096,64,8,1) ***************
[12/28/2021-10:07:24] [V] [TRT] --------------- Timing Runner: Optimizer Reformat (Reformat)
[12/28/2021-10:07:24] [V] [TRT] Setting a default quantization params because quantization data is missing for 
[12/28/2021-10:07:24] [V] [TRT] Tactic: 1002 Time: 0.00798
[12/28/2021-10:07:24] [V] [TRT] Setting a default quantization params because quantization data is missing for 
[12/28/2021-10:07:24] [V] [TRT] Tactic: 0 Time: 0.006492
[12/28/2021-10:07:24] [V] [TRT] Fastest Tactic: 0 Time: 0.006492
[12/28/2021-10:07:24] [V] [TRT] *************** Autotuning Reformat:Int8(128,64:32,8,1) -> Float(4096,1,512,64) ***************
[12/28/2021-10:07:24] [V] [TRT] --------------- Timing Runner: Optimizer Reformat (Reformat)
[12/28/2021-10:07:24] [V] [TRT] Setting a default quantization params because quantization data is missing for 
[12/28/2021-10:07:24] [V] [TRT] Tactic: 1002 Time: 0.007828
[12/28/2021-10:07:24] [V] [TRT] Setting a default quantization params because quantization data is missing for 
[12/28/2021-10:07:24] [V] [TRT] Tactic: 0 Time: 0.006556
[12/28/2021-10:07:24] [V] [TRT] Fastest Tactic: 0 Time: 0.006556
[12/28/2021-10:07:24] [V] [TRT] *************** Autotuning Reformat:Int8(128,64:32,8,1) -> Float(1024,1:4,128,16) ***************
[12/28/2021-10:07:24] [V] [TRT] --------------- Timing Runner: Optimizer Reformat (Reformat)
[12/28/2021-10:07:24] [V] [TRT] Setting a default quantization params because quantization data is missing for 
[12/28/2021-10:07:24] [V] [TRT] Tactic: 1002 Time: 0.008912
[12/28/2021-10:07:24] [V] [TRT] Setting a default quantization params because quantization data is missing for 
[12/28/2021-10:07:24] [V] [TRT] Tactic: 0 Time: 0.00678
[12/28/2021-10:07:24] [V] [TRT] Fastest Tactic: 0 Time: 0.00678
[12/28/2021-10:07:24] [V] [TRT] *************** Autotuning Reformat:Int8(128,64:32,8,1) -> Int8(1024,64:4,8,1) ***************
[12/28/2021-10:07:24] [V] [TRT] --------------- Timing Runner: Optimizer Reformat (Reformat)
[12/28/2021-10:07:24] [V] [TRT] Setting a default quantization params because quantization data is missing for 
[12/28/2021-10:07:24] [V] [TRT] Tactic: 1002 Time: 0.007368
[12/28/2021-10:07:24] [V] [TRT] Setting a default quantization params because quantization data is missing for 
[12/28/2021-10:07:24] [V] [TRT] Tactic: 0 Time: 0.004976
[12/28/2021-10:07:24] [V] [TRT] Setting a default quantization params because quantization data is missing for 
[12/28/2021-10:07:24] [V] [TRT] Tactic: 1 Time: 0.005572
[12/28/2021-10:07:24] [V] [TRT] Fastest Tactic: 0 Time: 0.004976
[12/28/2021-10:07:24] [V] [TRT] *************** Autotuning format combination: Float(4096,64,8,1) -> Float(4096,64,8,1) ***************
[12/28/2021-10:07:24] [V] [TRT] --------------- Timing Runner: Conv_11 + Relu_14 (CudaDepthwiseConvolution)
[12/28/2021-10:07:24] [V] [TRT] CudaDepthwiseConvolution has no valid tactics for this config, skipping
[12/28/2021-10:07:24] [V] [TRT] --------------- Timing Runner: Conv_11 + Relu_14 (FusedConvActConvolution)
[12/28/2021-10:07:24] [V] [TRT] FusedConvActConvolution has no valid tactics for this config, skipping
[12/28/2021-10:07:25] [V] [TRT] --------------- Timing Runner: Conv_11 + Relu_14 (CudnnConvolution)
[12/28/2021-10:07:25] [V] [TRT] Tactic: 0 Time: 0.035544
[12/28/2021-10:07:25] [V] [TRT] Tactic: 1 Time: 0.06852
[12/28/2021-10:07:25] [V] [TRT] Tactic: 2 Time: 0.067948
[12/28/2021-10:07:25] [V] [TRT] Tactic: 4 Time: 0.047364
[12/28/2021-10:07:25] [V] [TRT] Tactic: 5 skipped. Scratch requested: 35651584, available: 16777216
[12/28/2021-10:07:25] [V] [TRT] Tactic: 6 Time: 0.027336
[12/28/2021-10:07:25] [V] [TRT] Tactic: 56 Time: 0.035884
[12/28/2021-10:07:25] [V] [TRT] Tactic: 57 Time: 0.071716
[12/28/2021-10:07:25] [V] [TRT] Tactic: 58 Time: 0.067616
[12/28/2021-10:07:25] [V] [TRT] Tactic: 60 Time: 0.047664
[12/28/2021-10:07:25] [V] [TRT] Tactic: 61 skipped. Scratch requested: 35651584, available: 16777216
[12/28/2021-10:07:25] [V] [TRT] Tactic: 62 Time: 0.027284
[12/28/2021-10:07:25] [V] [TRT] Tactic: 112 Time: 0.035756
[12/28/2021-10:07:25] [V] [TRT] Tactic: 113 Time: 0.228024
[12/28/2021-10:07:25] [V] [TRT] Tactic: 114 Time: 0.06794
[12/28/2021-10:07:25] [V] [TRT] Tactic: 116 Time: 0.047776
[12/28/2021-10:07:25] [V] [TRT] Tactic: 117 skipped. Scratch requested: 35651584, available: 16777216
[12/28/2021-10:07:25] [V] [TRT] Tactic: 118 Time: 0.027344
[12/28/2021-10:07:25] [I] [TRT] Some tactics do not have sufficient workspace memory to run. Increasing workspace size may increase performance, please check verbose output.
[12/28/2021-10:07:25] [V] [TRT] Fastest Tactic: 62 Time: 0.027284
[12/28/2021-10:07:25] [V] [TRT] --------------- Timing Runner: Conv_11 + Relu_14 (CaskConvolution)
[12/28/2021-10:07:25] [V] [TRT] Conv_11 + Relu_14 Set Tactic Name: ampere_scudnn_128x64_relu_small_nn_v1 Tactic: 4549827808004681195
[12/28/2021-10:07:25] [V] [TRT] Tactic: 4549827808004681195 Time: 0.063076
[12/28/2021-10:07:25] [V] [TRT] Conv_11 + Relu_14 Set Tactic Name: ampere_scudnn_128x128_relu_small_nn_v1 Tactic: 5779835512569528575
[12/28/2021-10:07:25] [V] [TRT] Tactic: 5779835512569528575 Time: 0.079892
[12/28/2021-10:07:25] [V] [TRT] Conv_11 + Relu_14 Set Tactic Name: ampere_scudnn_128x128_relu_xregs_large_nn_v1 Tactic: 6053873026024413720
[12/28/2021-10:07:25] [V] [TRT] Tactic: 6053873026024413720 Time: 0.089404
[12/28/2021-10:07:25] [V] [TRT] Conv_11 + Relu_14 Set Tactic Name: ampere_scudnn_128x64_relu_xregs_large_nn_v1 Tactic: 6767548733843469815
[12/28/2021-10:07:25] [V] [TRT] Tactic: 6767548733843469815 Time: 0.069228
[12/28/2021-10:07:25] [V] [TRT] Conv_11 + Relu_14 Set Tactic Name: ampere_scudnn_128x32_relu_small_nn_v1 Tactic: -6313876406580483184
[12/28/2021-10:07:25] [V] [TRT] Tactic: -6313876406580483184 Time: 0.075608
[12/28/2021-10:07:25] [V] [TRT] Conv_11 + Relu_14 Set Tactic Name: ampere_scudnn_128x128_relu_medium_nn_v1 Tactic: -1123676555321336786
[12/28/2021-10:07:25] [V] [TRT] Tactic: -1123676555321336786 Time: 0.087784
[12/28/2021-10:07:25] [V] [TRT] Conv_11 + Relu_14 Set Tactic Name: ampere_scudnn_128x64_relu_medium_nn_v1 Tactic: -701551393537224327
[12/28/2021-10:07:25] [V] [TRT] Tactic: -701551393537224327 Time: 0.076976
[12/28/2021-10:07:25] [V] [TRT] Fastest Tactic: 4549827808004681195 Time: 0.063076
[12/28/2021-10:07:25] [V] [TRT] >>>>>>>>>>>>>>> Chose Runner Type: CudnnConvolution Tactic: 62
[12/28/2021-10:07:25] [V] [TRT] *************** Autotuning format combination: Float(4096,1,512,64) -> Float(4096,1,512,64) ***************
[12/28/2021-10:07:25] [V] [TRT] --------------- Timing Runner: Conv_11 + Relu_14 (CudnnConvolution)
[12/28/2021-10:07:25] [V] [TRT] CudnnConvolution has no valid tactics for this config, skipping
[12/28/2021-10:07:25] [V] [TRT] --------------- Timing Runner: Conv_11 + Relu_14 (CaskConvolution)
[12/28/2021-10:07:25] [V] [TRT] Conv_11 + Relu_14 Set Tactic Name: ampere_scudnn_128x64_sliced1x2_ldg4_relu_exp_small_nhwc_tn_v1 Tactic: 2860655430572478466
[12/28/2021-10:07:25] [V] [TRT] Tactic: 2860655430572478466 Time: 0.049108
[12/28/2021-10:07:25] [V] [TRT] Conv_11 + Relu_14 Set Tactic Name: ampere_scudnn_128x32_sliced1x4_ldg4_relu_exp_medium_nhwc_tn_v1 Tactic: 4474630279712975759
[12/28/2021-10:07:25] [V] [TRT] Tactic: 4474630279712975759 Time: 0.030604
[12/28/2021-10:07:25] [V] [TRT] Conv_11 + Relu_14 Set Tactic Name: ampere_scudnn_128x32_sliced1x4_ldg4_relu_exp_small_nhwc_tn_v1 Tactic: 4479823862704990365
[12/28/2021-10:07:25] [V] [TRT] Tactic: 4479823862704990365 Time: 0.029932
[12/28/2021-10:07:25] [V] [TRT] Conv_11 + Relu_14 Set Tactic Name: ampere_scudnn_128x64_sliced1x2_ldg4_relu_exp_medium_nhwc_tn_v1 Tactic: 4696204239951173149
[12/28/2021-10:07:25] [V] [TRT] Tactic: 4696204239951173149 Time: 0.050012
[12/28/2021-10:07:25] [V] [TRT] Conv_11 + Relu_14 Set Tactic Name: ampere_scudnn_128x128_relu_exp_small_nhwc_tn_v1 Tactic: 5778138195697110003
[12/28/2021-10:07:25] [V] [TRT] Tactic: 5778138195697110003 Time: 0.079344
[12/28/2021-10:07:25] [V] [TRT] Conv_11 + Relu_14 Set Tactic Name: ampere_scudnn_128x128_ldg4_relu_exp_large_nhwc_tn_v1 Tactic: 7155825427510256858
[12/28/2021-10:07:25] [V] [TRT] Tactic: 7155825427510256858 Time: 0.079692
[12/28/2021-10:07:25] [V] [TRT] Conv_11 + Relu_14 Set Tactic Name: ampere_scudnn_128x128_ldg4_relu_exp_medium_nhwc_tn_v1 Tactic: 8918020581761223752
[12/28/2021-10:07:25] [V] [TRT] Tactic: 8918020581761223752 Time: 0.078064
[12/28/2021-10:07:25] [V] [TRT] Conv_11 + Relu_14 Set Tactic Name: ampere_scudnn_128x64_sliced1x2_ldg4_relu_exp_large_nhwc_tn_v1 Tactic: -4756382386362004279
[12/28/2021-10:07:25] [V] [TRT] Tactic: -4756382386362004279 Time: 0.04918
[12/28/2021-10:07:25] [V] [TRT] Conv_11 + Relu_14 Set Tactic Name: ampere_scudnn_128x128_relu_exp_large_nhwc_tn_v1 Tactic: -3855385237722507464
[12/28/2021-10:07:25] [V] [TRT] Tactic: -3855385237722507464 Time: 0.080696
[12/28/2021-10:07:25] [V] [TRT] Conv_11 + Relu_14 Set Tactic Name: ampere_scudnn_128x128_relu_exp_medium_nhwc_tn_v1 Tactic: -2809379259463049391
[12/28/2021-10:07:25] [V] [TRT] Tactic: -2809379259463049391 Time: 0.07936
[12/28/2021-10:07:25] [V] [TRT] Conv_11 + Relu_14 Set Tactic Name: ampere_scudnn_128x128_ldg4_relu_exp_small_nhwc_tn_v1 Tactic: -504296718212024303
[12/28/2021-10:07:25] [V] [TRT] Tactic: -504296718212024303 Time: 0.076944
[12/28/2021-10:07:25] [V] [TRT] Fastest Tactic: 4479823862704990365 Time: 0.029932
[12/28/2021-10:07:25] [V] [TRT] >>>>>>>>>>>>>>> Chose Runner Type: CaskConvolution Tactic: 4479823862704990365
[12/28/2021-10:07:25] [V] [TRT] *************** Autotuning format combination: Float(1024,1:4,128,16) -> Float(1024,1:4,128,16) ***************
[12/28/2021-10:07:25] [V] [TRT] --------------- Timing Runner: Conv_11 + Relu_14 (CudnnConvolution)
[12/28/2021-10:07:25] [V] [TRT] CudnnConvolution has no valid tactics for this config, skipping
[12/28/2021-10:07:25] [V] [TRT] --------------- Timing Runner: Conv_11 + Relu_14 (CaskConvolution)
[12/28/2021-10:07:25] [V] [TRT] Conv_11 + Relu_14 Set Tactic Name: ampere_scudnn_128x64_sliced1x2_ldg4_relu_exp_small_nhwc_tn_v1 Tactic: 2860655430572478466
[12/28/2021-10:07:25] [V] [TRT] Tactic: 2860655430572478466 Time: 0.049304
[12/28/2021-10:07:25] [V] [TRT] Conv_11 + Relu_14 Set Tactic Name: ampere_scudnn_128x32_sliced1x4_ldg4_relu_exp_medium_nhwc_tn_v1 Tactic: 4474630279712975759
[12/28/2021-10:07:25] [V] [TRT] Tactic: 4474630279712975759 Time: 0.030552
[12/28/2021-10:07:25] [V] [TRT] Conv_11 + Relu_14 Set Tactic Name: ampere_scudnn_128x32_sliced1x4_ldg4_relu_exp_small_nhwc_tn_v1 Tactic: 4479823862704990365
[12/28/2021-10:07:25] [V] [TRT] Tactic: 4479823862704990365 Time: 0.029908
[12/28/2021-10:07:25] [V] [TRT] Conv_11 + Relu_14 Set Tactic Name: ampere_scudnn_128x64_sliced1x2_ldg4_relu_exp_medium_nhwc_tn_v1 Tactic: 4696204239951173149
[12/28/2021-10:07:25] [V] [TRT] Tactic: 4696204239951173149 Time: 0.050068
[12/28/2021-10:07:25] [V] [TRT] Conv_11 + Relu_14 Set Tactic Name: ampere_scudnn_128x128_relu_exp_small_nhwc_tn_v1 Tactic: 5778138195697110003
[12/28/2021-10:07:25] [V] [TRT] Tactic: 5778138195697110003 Time: 0.079128
[12/28/2021-10:07:25] [V] [TRT] Conv_11 + Relu_14 Set Tactic Name: ampere_scudnn_128x128_ldg4_relu_exp_large_nhwc_tn_v1 Tactic: 7155825427510256858
[12/28/2021-10:07:25] [V] [TRT] Tactic: 7155825427510256858 Time: 0.07962
[12/28/2021-10:07:25] [V] [TRT] Conv_11 + Relu_14 Set Tactic Name: sm80_xmma_fprop_implicit_gemm_indexed_f32f32_tf32f32_f32_nhwckrsc_nhwc_tilesize128x128x16_stage4_warpsize2x2x1_g1_tensor16x8x8 Tactic: 7342025736444949634
[12/28/2021-10:07:25] [V] [TRT] Tactic: 7342025736444949634 Time: 0.054776
[12/28/2021-10:07:25] [V] [TRT] Conv_11 + Relu_14 Set Tactic Name: ampere_scudnn_128x128_ldg4_relu_exp_medium_nhwc_tn_v1 Tactic: 8918020581761223752
[12/28/2021-10:07:25] [V] [TRT] Tactic: 8918020581761223752 Time: 0.078088
[12/28/2021-10:07:25] [V] [TRT] Conv_11 + Relu_14 Set Tactic Name: sm80_xmma_fprop_implicit_gemm_f32f32_tf32f32_f32_nhwckrsc_nhwc_tilesize128x128x16_stage4_warpsize2x2x1_g1_tensor16x8x8_t1r3s3 Tactic: -7377458734869418330
[12/28/2021-10:07:25] [V] [TRT] Tactic: -7377458734869418330 Time: 0.054148
[12/28/2021-10:07:25] [V] [TRT] Conv_11 + Relu_14 Set Tactic Name: sm80_xmma_fprop_implicit_gemm_f32f32_tf32f32_f32_nhwckrsc_nhwc_tilesize128x128x16_stage4_warpsize2x2x1_g1_tensor16x8x8 Tactic: -5457304872213719461
[12/28/2021-10:07:25] [V] [TRT] Tactic: -5457304872213719461 Time: 0.054624
[12/28/2021-10:07:25] [V] [TRT] Conv_11 + Relu_14 Set Tactic Name: ampere_scudnn_128x64_sliced1x2_ldg4_relu_exp_large_nhwc_tn_v1 Tactic: -4756382386362004279
[12/28/2021-10:07:25] [V] [TRT] Tactic: -4756382386362004279 Time: 0.049168
[12/28/2021-10:07:25] [V] [TRT] Conv_11 + Relu_14 Set Tactic Name: ampere_scudnn_128x128_relu_exp_large_nhwc_tn_v1 Tactic: -3855385237722507464
[12/28/2021-10:07:25] [V] [TRT] Tactic: -3855385237722507464 Time: 0.080516
[12/28/2021-10:07:25] [V] [TRT] Conv_11 + Relu_14 Set Tactic Name: ampere_scudnn_128x128_relu_exp_medium_nhwc_tn_v1 Tactic: -2809379259463049391
[12/28/2021-10:07:25] [V] [TRT] Tactic: -2809379259463049391 Time: 0.07932
[12/28/2021-10:07:25] [V] [TRT] Conv_11 + Relu_14 Set Tactic Name: ampere_scudnn_128x128_ldg4_relu_exp_small_nhwc_tn_v1 Tactic: -504296718212024303
[12/28/2021-10:07:25] [V] [TRT] Tactic: -504296718212024303 Time: 0.0769
[12/28/2021-10:07:25] [V] [TRT] Fastest Tactic: 4479823862704990365 Time: 0.029908
[12/28/2021-10:07:25] [V] [TRT] >>>>>>>>>>>>>>> Chose Runner Type: CaskConvolution Tactic: 4479823862704990365
[12/28/2021-10:07:25] [V] [TRT] *************** Autotuning format combination: Int8(1024,64:4,8,1) -> Float(4096,64,8,1) ***************
[12/28/2021-10:07:25] [V] [TRT] --------------- Timing Runner: Conv_11 + Relu_14 (CudaDepthwiseConvolution)
[12/28/2021-10:07:25] [V] [TRT] CudaDepthwiseConvolution has no valid tactics for this config, skipping
[12/28/2021-10:07:25] [V] [TRT] --------------- Timing Runner: Conv_11 + Relu_14 (CaskConvolution)
[12/28/2021-10:07:25] [V] [TRT] Conv_11 + Relu_14 Set Tactic Name: ampere_fp32_icudnn_int8x4_128x128_relu_xregs_large_nn_v1 Tactic: 1332468635798226953
[12/28/2021-10:07:25] [V] [TRT] Tactic: 1332468635798226953 Time: 0.035252
[12/28/2021-10:07:25] [V] [TRT] Conv_11 + Relu_14 Set Tactic Name: ampere_fp32_icudnn_int8x4_128x128_relu_small_nn_v1 Tactic: 1508480131241957639
[12/28/2021-10:07:25] [V] [TRT] Tactic: 1508480131241957639 Time: 0.033396
[12/28/2021-10:07:25] [V] [TRT] Conv_11 + Relu_14 Set Tactic Name: ampere_fp32_icudnn_int8x4_128x64_relu_xregs_large_nn_v1 Tactic: 1947019689364377201
[12/28/2021-10:07:25] [V] [TRT] Tactic: 1947019689364377201 Time: 0.025312
[12/28/2021-10:07:25] [V] [TRT] Conv_11 + Relu_14 Set Tactic Name: ampere_fp32_icudnn_int8x4_128x128_relu_medium_nn_v1 Tactic: 3239257003214966313
[12/28/2021-10:07:25] [V] [TRT] Tactic: 3239257003214966313 Time: 0.035004
[12/28/2021-10:07:25] [V] [TRT] Conv_11 + Relu_14 Set Tactic Name: ampere_fp32_icudnn_int8x4_128x32_relu_xregs_small_nn_v1 Tactic: 5592640619112287921
[12/28/2021-10:07:25] [V] [TRT] Tactic: 5592640619112287921 Time: 0.022408
[12/28/2021-10:07:25] [V] [TRT] Conv_11 + Relu_14 Set Tactic Name: ampere_fp32_icudnn_int8x4_128x64_relu_small_nn_v1 Tactic: 7621465827583909090
[12/28/2021-10:07:25] [V] [TRT] Tactic: 7621465827583909090 Time: 0.023524
[12/28/2021-10:07:25] [V] [TRT] Conv_11 + Relu_14 Set Tactic Name: ampere_fp32_icudnn_int8x4_128x64_relu_medium_nn_v1 Tactic: -5576936487443445631
[12/28/2021-10:07:25] [V] [TRT] Tactic: -5576936487443445631 Time: 0.027168
[12/28/2021-10:07:25] [V] [TRT] Conv_11 + Relu_14 Set Tactic Name: ampere_fp32_icudnn_int8x4_128x32_relu_medium_nn_v1 Tactic: -2297737319934264721
[12/28/2021-10:07:25] [V] [TRT] Tactic: -2297737319934264721 Time: 0.030888
[12/28/2021-10:07:25] [V] [TRT] Conv_11 + Relu_14 Set Tactic Name: ampere_fp32_icudnn_int8x4_128x32_relu_xregs_medium_nn_v1 Tactic: -1425085658556684465
[12/28/2021-10:07:25] [V] [TRT] Tactic: -1425085658556684465 Time: 0.029028
[12/28/2021-10:07:25] [V] [TRT] Conv_11 + Relu_14 Set Tactic Name: ampere_fp32_icudnn_int8x4_128x32_relu_small_nn_v1 Tactic: -108011214168778087
[12/28/2021-10:07:25] [V] [TRT] Tactic: -108011214168778087 Time: 0.026032
[12/28/2021-10:07:25] [V] [TRT] Fastest Tactic: 5592640619112287921 Time: 0.022408
[12/28/2021-10:07:25] [V] [TRT] >>>>>>>>>>>>>>> Chose Runner Type: CaskConvolution Tactic: 5592640619112287921
[12/28/2021-10:07:25] [V] [TRT] *************** Autotuning format combination: Int8(1024,64:4,8,1) -> Int8(1024,64:4,8,1) ***************
[12/28/2021-10:07:25] [V] [TRT] --------------- Timing Runner: Conv_11 + Relu_14 (CudaDepthwiseConvolution)
[12/28/2021-10:07:25] [V] [TRT] CudaDepthwiseConvolution has no valid tactics for this config, skipping
[12/28/2021-10:07:25] [V] [TRT] --------------- Timing Runner: Conv_11 + Relu_14 (FusedConvActConvolution)
[12/28/2021-10:07:25] [V] [TRT] FusedConvActConvolution has no valid tactics for this config, skipping
[12/28/2021-10:07:25] [V] [TRT] --------------- Timing Runner: Conv_11 + Relu_14 (CaskConvolution)
[12/28/2021-10:07:25] [V] [TRT] Conv_11 + Relu_14 Set Tactic Name: ampere_int8x4_icudnn_int8x4_128x32_relu_medium_nn_v1 Tactic: 175853789719975416
[12/28/2021-10:07:25] [V] [TRT] Tactic: 175853789719975416 Time: 0.028776
[12/28/2021-10:07:25] [V] [TRT] Conv_11 + Relu_14 Set Tactic Name: ampere_int8x4_icudnn_int8x4_128x32_relu_xregs_medium_nn_v1 Tactic: 2171150287007712632
[12/28/2021-10:07:25] [V] [TRT] Tactic: 2171150287007712632 Time: 0.027104
[12/28/2021-10:07:25] [V] [TRT] Conv_11 + Relu_14 Set Tactic Name: ampere_int8x4_icudnn_int8x4_128x64_relu_small_nn_v1 Tactic: 2234457234705232274
[12/28/2021-10:07:25] [V] [TRT] Tactic: 2234457234705232274 Time: 0.02116
[12/28/2021-10:07:25] [V] [TRT] Conv_11 + Relu_14 Set Tactic Name: ampere_int8x4_icudnn_int8x4_128x64_relu_medium_nn_v1 Tactic: 5834048089706882838
[12/28/2021-10:07:25] [V] [TRT] Tactic: 5834048089706882838 Time: 0.024828
[12/28/2021-10:07:25] [V] [TRT] Conv_11 + Relu_14 Set Tactic Name: ampere_int8x4_icudnn_int8x4_128x32_relu_small_nn_v1 Tactic: -8626990807754934295
[12/28/2021-10:07:25] [V] [TRT] Tactic: -8626990807754934295 Time: 0.024032
[12/28/2021-10:07:25] [V] [TRT] Conv_11 + Relu_14 Set Tactic Name: ampere_int8x4_icudnn_int8x4_128x32_relu_xregs_small_nn_v1 Tactic: -7303593854972602201
[12/28/2021-10:07:25] [V] [TRT] Tactic: -7303593854972602201 Time: 0.020472
[12/28/2021-10:07:25] [V] [TRT] Conv_11 + Relu_14 Set Tactic Name: ampere_int8x4_icudnn_int8x4_128x128_relu_medium_nn_v1 Tactic: -6585664687867083638
[12/28/2021-10:07:25] [V] [TRT] Tactic: -6585664687867083638 Time: 0.032364
[12/28/2021-10:07:25] [V] [TRT] Conv_11 + Relu_14 Set Tactic Name: ampere_int8x4_icudnn_int8x4_128x64_relu_xregs_large_nn_v1 Tactic: -3730012925709297561
[12/28/2021-10:07:25] [V] [TRT] Tactic: -3730012925709297561 Time: 0.023136
[12/28/2021-10:07:25] [V] [TRT] Conv_11 + Relu_14 Set Tactic Name: ampere_int8x4_icudnn_int8x4_128x128_relu_xregs_large_nn_v1 Tactic: -2277259417488004546
[12/28/2021-10:07:25] [V] [TRT] Tactic: -2277259417488004546 Time: 0.032584
[12/28/2021-10:07:25] [V] [TRT] Conv_11 + Relu_14 Set Tactic Name: ampere_int8x4_icudnn_int8x4_128x128_relu_small_nn_v1 Tactic: -683636008127039856
[12/28/2021-10:07:25] [V] [TRT] Tactic: -683636008127039856 Time: 0.030812
[12/28/2021-10:07:25] [V] [TRT] Fastest Tactic: -7303593854972602201 Time: 0.020472
[12/28/2021-10:07:25] [V] [TRT] >>>>>>>>>>>>>>> Chose Runner Type: CaskConvolution Tactic: -7303593854972602201
[12/28/2021-10:07:25] [V] [TRT] *************** Autotuning format combination: Int8(1024,64:4,8,1) -> Int8(128,64:32,8,1) ***************
[12/28/2021-10:07:25] [V] [TRT] --------------- Timing Runner: Conv_11 + Relu_14 (CaskConvolution)
[12/28/2021-10:07:25] [V] [TRT] Conv_11 + Relu_14 Set Tactic Name: ampere_int8x4_icudnn_int8x4_128x64_relu_xregs_large_c32_nn_v1 Tactic: 984309058095623735
[12/28/2021-10:07:25] [V] [TRT] Tactic: 984309058095623735 Time: 0.022904
[12/28/2021-10:07:25] [V] [TRT] Conv_11 + Relu_14 Set Tactic Name: ampere_int8x4_icudnn_int8x4_128x32_relu_small_c32_nn_v1 Tactic: 1100922622480907544
[12/28/2021-10:07:25] [V] [TRT] Tactic: 1100922622480907544 Time: 0.02384
[12/28/2021-10:07:25] [V] [TRT] Conv_11 + Relu_14 Set Tactic Name: ampere_int8x4_icudnn_int8x4_128x128_relu_xregs_large_c32_nn_v1 Tactic: 3238312825609165543
[12/28/2021-10:07:25] [V] [TRT] Tactic: 3238312825609165543 Time: 0.032456
[12/28/2021-10:07:25] [V] [TRT] Conv_11 + Relu_14 Set Tactic Name: ampere_int8x4_icudnn_int8x4_128x64_relu_medium_c32_nn_v1 Tactic: 3606311198834416176
[12/28/2021-10:07:25] [V] [TRT] Tactic: 3606311198834416176 Time: 0.024684
[12/28/2021-10:07:25] [V] [TRT] Conv_11 + Relu_14 Set Tactic Name: ampere_int8x4_icudnn_int8x4_128x128_relu_small_c32_nn_v1 Tactic: 4325765560739862899
[12/28/2021-10:07:25] [V] [TRT] Tactic: 4325765560739862899 Time: 0.030584
[12/28/2021-10:07:25] [V] [TRT] Conv_11 + Relu_14 Set Tactic Name: ampere_int8x4_icudnn_int8x4_128x128_relu_medium_c32_nn_v1 Tactic: -4255737803793506479
[12/28/2021-10:07:25] [V] [TRT] Tactic: -4255737803793506479 Time: 0.032052
[12/28/2021-10:07:25] [V] [TRT] Conv_11 + Relu_14 Set Tactic Name: ampere_int8x4_icudnn_int8x4_128x32_relu_xregs_small_c32_nn_v1 Tactic: -3958182351168863467
[12/28/2021-10:07:25] [V] [TRT] Tactic: -3958182351168863467 Time: 0.02022
[12/28/2021-10:07:25] [V] [TRT] Conv_11 + Relu_14 Set Tactic Name: ampere_int8x4_icudnn_int8x4_128x32_relu_xregs_medium_c32_nn_v1 Tactic: -3111968753064955248
[12/28/2021-10:07:25] [V] [TRT] Tactic: -3111968753064955248 Time: 0.026712
[12/28/2021-10:07:25] [V] [TRT] Conv_11 + Relu_14 Set Tactic Name: ampere_int8x4_icudnn_int8x4_128x32_relu_medium_c32_nn_v1 Tactic: -1492575840277333548
[12/28/2021-10:07:25] [V] [TRT] Tactic: -1492575840277333548 Time: 0.028636
[12/28/2021-10:07:25] [V] [TRT] Conv_11 + Relu_14 Set Tactic Name: ampere_int8x4_icudnn_int8x4_128x64_relu_small_c32_nn_v1 Tactic: -868495160148524802
[12/28/2021-10:07:25] [V] [TRT] Tactic: -868495160148524802 Time: 0.020944
[12/28/2021-10:07:25] [V] [TRT] Fastest Tactic: -3958182351168863467 Time: 0.02022
[12/28/2021-10:07:25] [V] [TRT] >>>>>>>>>>>>>>> Chose Runner Type: CaskConvolution Tactic: -3958182351168863467
[12/28/2021-10:07:25] [V] [TRT] *************** Autotuning format combination: Int8(128,64:32,8,1) -> Float(128,64:32,8,1) ***************
[12/28/2021-10:07:25] [V] [TRT] --------------- Timing Runner: Conv_11 + Relu_14 (CaskConvolution)
[12/28/2021-10:07:25] [V] [TRT] Conv_11 + Relu_14 Set Tactic Name: sm80_xmma_fprop_implicit_gemm_interleaved_i8f32_i8i32_f32_nchw_vect_c_32kcrs_vect_c_32_nchw_vect_c_32_tilesize256x64x64_stage4_warpsize4x1x1_g1_tensor16x8x32_t1r3s3 Tactic: 1011019097971850911
[12/28/2021-10:07:25] [V] [TRT] Tactic: 1011019097971850911 Time: 0.0153
[12/28/2021-10:07:25] [V] [TRT] Conv_11 + Relu_14 Set Tactic Name: sm80_xmma_fprop_implicit_gemm_interleaved_i8f32_i8i32_f32_nchw_vect_c_32kcrs_vect_c_32_nchw_vect_c_32_tilesize64x128x64_stage6_warpsize2x2x1_g1_tensor16x8x32_t1r3s3 Tactic: 1071114551801767124
[12/28/2021-10:07:26] [V] [TRT] Tactic: 1071114551801767124 Time: 0.01008
[12/28/2021-10:07:26] [V] [TRT] Conv_11 + Relu_14 Set Tactic Name: sm80_xmma_fprop_implicit_gemm_interleaved_i8f32_i8i32_f32_nchw_vect_c_32kcrs_vect_c_32_nchw_vect_c_32_tilesize32x64x64_stage6_warpsize2x2x1_g1_tensor16x8x32 Tactic: 2623576043214044314
[12/28/2021-10:07:26] [V] [TRT] Tactic: 2623576043214044314 Time: 0.009236
[12/28/2021-10:07:26] [V] [TRT] Conv_11 + Relu_14 Set Tactic Name: sm80_xmma_fprop_implicit_gemm_interleaved_i8f32_i8i32_f32_nchw_vect_c_32kcrs_vect_c_32_nchw_vect_c_32_tilesize64x64x64_stage6_warpsize2x2x1_g1_tensor16x8x32_t1r3s3 Tactic: 3281631721811475881
[12/28/2021-10:07:26] [V] [TRT] Tactic: 3281631721811475881 Time: 0.0091
[12/28/2021-10:07:26] [V] [TRT] Conv_11 + Relu_14 Set Tactic Name: sm80_xmma_fprop_implicit_gemm_interleaved_i8f32_i8i32_f32_nchw_vect_c_32kcrs_vect_c_32_nchw_vect_c_32_tilesize64x32x64_stage6_warpsize2x1x1_g1_tensor16x8x32 Tactic: 4551754795416974366
[12/28/2021-10:07:26] [V] [TRT] Tactic: 4551754795416974366 Time: 0.008788
[12/28/2021-10:07:26] [V] [TRT] Conv_11 + Relu_14 Set Tactic Name: sm80_xmma_fprop_implicit_gemm_interleaved_i8f32_i8i32_f32_nchw_vect_c_32kcrs_vect_c_32_nchw_vect_c_32_tilesize32x32x64_stage6_warpsize2x1x1_g1_tensor16x8x32 Tactic: 4925112190271421402
[12/28/2021-10:07:26] [V] [TRT] Tactic: 4925112190271421402 Time: 0.009416
[12/28/2021-10:07:26] [V] [TRT] Conv_11 + Relu_14 Set Tactic Name: ampere_fp32_i8816cudnn_int8_256x128_ldg16_relu_medium_nt_v1 Tactic: 5012796702462679112
[12/28/2021-10:07:26] [V] [TRT] Tactic: 5012796702462679112 Time: 0.020724
[12/28/2021-10:07:26] [V] [TRT] Conv_11 + Relu_14 Set Tactic Name: sm80_xmma_fprop_implicit_gemm_interleaved_i8f32_i8i32_f32_nchw_vect_c_32kcrs_vect_c_32_nchw_vect_c_32_tilesize32x64x64_stage6_warpsize2x2x1_g1_tensor16x8x32_t1r3s3 Tactic: 5041593333398049019
[12/28/2021-10:07:26] [V] [TRT] Tactic: 5041593333398049019 Time: 0.008648
[12/28/2021-10:07:26] [V] [TRT] Conv_11 + Relu_14 Set Tactic Name: sm80_xmma_fprop_implicit_gemm_interleaved_i8f32_i8i32_f32_nchw_vect_c_32kcrs_vect_c_32_nchw_vect_c_32_tilesize256x128x64_stage4_warpsize4x2x1_g1_tensor16x8x32_t1r3s3 Tactic: 5166018662410176512
[12/28/2021-10:07:26] [V] [TRT] Tactic: 5166018662410176512 Time: 0.021144
[12/28/2021-10:07:26] [V] [TRT] Conv_11 + Relu_14 Set Tactic Name: sm80_xmma_fprop_implicit_gemm_interleaved_i8f32_i8i32_f32_nchw_vect_c_32kcrs_vect_c_32_nchw_vect_c_32_tilesize128x128x64_stage4_warpsize2x2x1_g1_tensor16x8x32_t1r3s3 Tactic: 6191867932654611882
[12/28/2021-10:07:26] [V] [TRT] Tactic: 6191867932654611882 Time: 0.01312
[12/28/2021-10:07:26] [V] [TRT] Conv_11 + Relu_14 Set Tactic Name: ampere_fp32_i8816cudnn_int8_128x128_ldg16_relu_medium_nt_v1 Tactic: 6556170942941957134
[12/28/2021-10:07:26] [V] [TRT] Tactic: 6556170942941957134 Time: 0.01542
[12/28/2021-10:07:26] [V] [TRT] Conv_11 + Relu_14 Set Tactic Name: sm80_xmma_fprop_implicit_gemm_interleaved_i8f32_i8i32_f32_nchw_vect_c_32kcrs_vect_c_32_nchw_vect_c_32_tilesize64x64x64_stage6_warpsize2x2x1_g1_tensor16x8x32 Tactic: 6852868042694587230
[12/28/2021-10:07:26] [V] [TRT] Tactic: 6852868042694587230 Time: 0.009252
[12/28/2021-10:07:26] [V] [TRT] Conv_11 + Relu_14 Set Tactic Name: sm80_xmma_fprop_implicit_gemm_interleaved_i8f32_i8i32_f32_nchw_vect_c_32kcrs_vect_c_32_nchw_vect_c_32_tilesize128x256x64_stage4_warpsize2x4x1_g1_tensor16x8x32 Tactic: 8399092794516815300
[12/28/2021-10:07:26] [V] [TRT] Tactic: 8399092794516815300 Time: 0.019516
[12/28/2021-10:07:26] [V] [TRT] Conv_11 + Relu_14 Set Tactic Name: sm80_xmma_fprop_implicit_gemm_interleaved_i8f32_i8i32_f32_nchw_vect_c_32kcrs_vect_c_32_nchw_vect_c_32_tilesize64x128x64_stage6_warpsize2x2x1_g1_tensor16x8x32 Tactic: -9132922677633967263
[12/28/2021-10:07:26] [V] [TRT] Tactic: -9132922677633967263 Time: 0.010396
[12/28/2021-10:07:26] [V] [TRT] Conv_11 + Relu_14 Set Tactic Name: ampere_fp32_i8816cudnn_int8_128x128_ldg16_relu_small_nt_v1 Tactic: -7988637803896331454
[12/28/2021-10:07:26] [V] [TRT] Tactic: -7988637803896331454 Time: 0.014536
[12/28/2021-10:07:26] [V] [TRT] Conv_11 + Relu_14 Set Tactic Name: ampere_fp32_i8816cudnn_int8_256x64_ldg16_relu_large_nt_v1 Tactic: -7865001268126363229
[12/28/2021-10:07:26] [V] [TRT] Tactic: -7865001268126363229 Time: 0.017308
[12/28/2021-10:07:26] [V] [TRT] Conv_11 + Relu_14 Set Tactic Name: ampere_fp32_i8816cudnn_int8_256x64_ldg16_relu_singleBuffer_small_nt_v1 Tactic: -7606074703023778034
[12/28/2021-10:07:26] [V] [TRT] Tactic: -7606074703023778034 Time: 0.014852
[12/28/2021-10:07:26] [V] [TRT] Conv_11 + Relu_14 Set Tactic Name: sm80_xmma_fprop_implicit_gemm_interleaved_i8f32_i8i32_f32_nchw_vect_c_32kcrs_vect_c_32_nchw_vect_c_32_tilesize256x64x64_stage4_warpsize4x1x1_g1_tensor16x8x32 Tactic: -7413564913826321357
[12/28/2021-10:07:26] [V] [TRT] Tactic: -7413564913826321357 Time: 0.01544
[12/28/2021-10:07:26] [V] [TRT] Conv_11 + Relu_14 Set Tactic Name: ampere_fp32_i8816cudnn_int8_256x128_ldg16_relu_small_nt_v1 Tactic: -7282232519526877434
[12/28/2021-10:07:26] [V] [TRT] Tactic: -7282232519526877434 Time: 0.02026
[12/28/2021-10:07:26] [V] [TRT] Conv_11 + Relu_14 Set Tactic Name: sm80_xmma_fprop_implicit_gemm_interleaved_i8f32_i8i32_f32_nchw_vect_c_32kcrs_vect_c_32_nchw_vect_c_32_tilesize128x64x64_stage6_warpsize2x2x1_g1_tensor16x8x32_t1r3s3 Tactic: -5942379529065248478
[12/28/2021-10:07:26] [V] [TRT] Tactic: -5942379529065248478 Time: 0.01056
[12/28/2021-10:07:26] [V] [TRT] Conv_11 + Relu_14 Set Tactic Name: ampere_fp32_i8816cudnn_int8_256x64_ldg16_relu_singleBuffer_medium_nt_v1 Tactic: -5603587790314027122
[12/28/2021-10:07:26] [V] [TRT] Tactic: -5603587790314027122 Time: 0.01658
[12/28/2021-10:07:26] [V] [TRT] Conv_11 + Relu_14 Set Tactic Name: sm80_xmma_fprop_implicit_gemm_interleaved_i8f32_i8i32_f32_nchw_vect_c_32kcrs_vect_c_32_nchw_vect_c_32_tilesize256x128x64_stage4_warpsize4x2x1_g1_tensor16x8x32 Tactic: -5334776871777565833
[12/28/2021-10:07:26] [V] [TRT] Tactic: -5334776871777565833 Time: 0.021648
[12/28/2021-10:07:26] [V] [TRT] Conv_11 + Relu_14 Set Tactic Name: sm80_xmma_fprop_implicit_gemm_interleaved_i8f32_i8i32_f32_nchw_vect_c_32kcrs_vect_c_32_nchw_vect_c_32_tilesize128x128x64_stage4_warpsize2x2x1_g1_tensor16x8x32 Tactic: -5157868397078537095
[12/28/2021-10:07:26] [V] [TRT] Tactic: -5157868397078537095 Time: 0.013544
[12/28/2021-10:07:26] [V] [TRT] Conv_11 + Relu_14 Set Tactic Name: sm80_xmma_fprop_implicit_gemm_interleaved_i8f32_i8i32_f32_nchw_vect_c_32kcrs_vect_c_32_nchw_vect_c_32_tilesize64x32x64_stage6_warpsize2x1x1_g1_tensor16x8x32_t1r3s3 Tactic: -5100834417027499764
[12/28/2021-10:07:26] [V] [TRT] Tactic: -5100834417027499764 Time: 0.008652
[12/28/2021-10:07:26] [V] [TRT] Conv_11 + Relu_14 Set Tactic Name: sm80_xmma_fprop_implicit_gemm_interleaved_i8f32_i8i32_f32_nchw_vect_c_32kcrs_vect_c_32_nchw_vect_c_32_tilesize32x32x64_stage6_warpsize2x1x1_g1_tensor16x8x32_t1r3s3 Tactic: -3365360067423513506
[12/28/2021-10:07:26] [V] [TRT] Tactic: -3365360067423513506 Time: 0.008932
[12/28/2021-10:07:26] [V] [TRT] Conv_11 + Relu_14 Set Tactic Name: ampere_fp32_i8816cudnn_int8_256x128_ldg16_relu_large_nt_v1 Tactic: -2194148180068068313
[12/28/2021-10:07:26] [V] [TRT] Tactic: -2194148180068068313 Time: 0.020712
[12/28/2021-10:07:26] [V] [TRT] Conv_11 + Relu_14 Set Tactic Name: sm80_xmma_fprop_implicit_gemm_interleaved_i8f32_i8i32_f32_nchw_vect_c_32kcrs_vect_c_32_nchw_vect_c_32_tilesize128x64x64_stage6_warpsize2x2x1_g1_tensor16x8x32 Tactic: -1782593837177056527
[12/28/2021-10:07:26] [V] [TRT] Tactic: -1782593837177056527 Time: 0.011152
[12/28/2021-10:07:26] [V] [TRT] Conv_11 + Relu_14 Set Tactic Name: ampere_fp32_i8816cudnn_int8_256x64_ldg16_relu_small_nt_v1 Tactic: -1610768292520086910
[12/28/2021-10:07:26] [V] [TRT] Tactic: -1610768292520086910 Time: 0.015568
[12/28/2021-10:07:26] [V] [TRT] Conv_11 + Relu_14 Set Tactic Name: sm80_xmma_fprop_implicit_gemm_interleaved_i8f32_i8i32_f32_nchw_vect_c_32kcrs_vect_c_32_nchw_vect_c_32_tilesize128x256x64_stage4_warpsize2x4x1_g1_tensor16x8x32_t1r3s3 Tactic: -1573035963956198975
[12/28/2021-10:07:26] [V] [TRT] Tactic: -1573035963956198975 Time: 0.019036
[12/28/2021-10:07:26] [V] [TRT] Conv_11 + Relu_14 Set Tactic Name: ampere_fp32_i8816cudnn_int8_128x128_ldg16_relu_large_nt_v1 Tactic: -1558762241666006941
[12/28/2021-10:07:26] [V] [TRT] Tactic: -1558762241666006941 Time: 0.015804
[12/28/2021-10:07:26] [V] [TRT] Conv_11 + Relu_14 Set Tactic Name: ampere_fp32_i8816cudnn_int8_256x64_ldg16_relu_singleBuffer_large_nt_v1 Tactic: -1365353082499976145
[12/28/2021-10:07:26] [V] [TRT] Tactic: -1365353082499976145 Time: 0.016896
[12/28/2021-10:07:26] [V] [TRT] Conv_11 + Relu_14 Set Tactic Name: ampere_fp32_i8816cudnn_int8_256x64_ldg16_relu_medium_nt_v1 Tactic: -621838502160440068
[12/28/2021-10:07:26] [V] [TRT] Tactic: -621838502160440068 Time: 0.016824
[12/28/2021-10:07:26] [V] [TRT] Fastest Tactic: 5041593333398049019 Time: 0.008648
[12/28/2021-10:07:26] [V] [TRT] >>>>>>>>>>>>>>> Chose Runner Type: CaskConvolution Tactic: 5041593333398049019
[12/28/2021-10:07:26] [V] [TRT] *************** Autotuning format combination: Int8(128,64:32,8,1) -> Int8(128,64:32,8,1) ***************
[12/28/2021-10:07:26] [V] [TRT] --------------- Timing Runner: Conv_11 + Relu_14 (CudaGroupConvolution)
[12/28/2021-10:07:26] [V] [TRT] CudaGroupConvolution has no valid tactics for this config, skipping
[12/28/2021-10:07:26] [V] [TRT] --------------- Timing Runner: Conv_11 + Relu_14 (CudaDepthwiseConvolution)
[12/28/2021-10:07:26] [V] [TRT] CudaDepthwiseConvolution has no valid tactics for this config, skipping
[12/28/2021-10:07:26] [V] [TRT] --------------- Timing Runner: Conv_11 + Relu_14 (FusedConvActConvolution)
[12/28/2021-10:07:26] [V] [TRT] FusedConvActConvolution has no valid tactics for this config, skipping
[12/28/2021-10:07:26] [V] [TRT] --------------- Timing Runner: Conv_11 + Relu_14 (CaskConvolution)
[12/28/2021-10:07:26] [V] [TRT] Conv_11 + Relu_14 Set Tactic Name: sm80_xmma_fprop_implicit_gemm_interleaved_i8i8_i8i32_f32_nchw_vect_c_32kcrs_vect_c_32_nchw_vect_c_32_tilesize64x32x64_stage6_warpsize2x1x1_g1_tensor16x8x32_epifadd Tactic: 177040020707947851
[12/28/2021-10:07:26] [V] [TRT] Tactic: 177040020707947851 Time: 0.008496
[12/28/2021-10:07:26] [V] [TRT] Conv_11 + Relu_14 Set Tactic Name: sm80_xmma_fprop_implicit_gemm_interleaved_i8i8_i8i32_f32_nchw_vect_c_32kcrs_vect_c_32_nchw_vect_c_32_tilesize32x64x64_stage6_warpsize2x2x1_g1_tensor16x8x32_epifadd Tactic: 1550399266192842845
[12/28/2021-10:07:26] [V] [TRT] Tactic: 1550399266192842845 Time: 0.008928
[12/28/2021-10:07:26] [V] [TRT] Conv_11 + Relu_14 Set Tactic Name: sm80_xmma_fprop_implicit_gemm_interleaved_i8i8_i8i32_f32_nchw_vect_c_32kcrs_vect_c_32_nchw_vect_c_32_tilesize256x32x64_stage4_warpsize4x1x1_g1_tensor16x8x32_t1r3s3_epifadd Tactic: 1572887561103143487
[12/28/2021-10:07:26] [V] [TRT] Tactic: 1572887561103143487 Time: 0.009972
[12/28/2021-10:07:26] [V] [TRT] Conv_11 + Relu_14 Set Tactic Name: sm80_xmma_fprop_implicit_gemm_interleaved_i8i8_i8i32_f32_nchw_vect_c_32kcrs_vect_c_32_nchw_vect_c_32_tilesize256x64x64_stage4_warpsize4x1x1_g1_tensor16x8x32 Tactic: 2325023763229477890
[12/28/2021-10:07:26] [V] [TRT] Tactic: 2325023763229477890 Time: 0.01322
[12/28/2021-10:07:26] [V] [TRT] Conv_11 + Relu_14 Set Tactic Name: ampere_int8_i8816cudnn_int8_128x128_ldg16_relu_medium_nt_v1 Tactic: 2985940154541537814
[12/28/2021-10:07:26] [V] [TRT] Tactic: 2985940154541537814 Time: 0.015328
[12/28/2021-10:07:26] [V] [TRT] Conv_11 + Relu_14 Set Tactic Name: sm80_xmma_fprop_implicit_gemm_interleaved_i8i8_i8i32_f32_nchw_vect_c_32kcrs_vect_c_32_nchw_vect_c_32_tilesize32x32x64_stage6_warpsize2x1x1_g1_tensor16x8x32_t1r3s3_epifadd Tactic: 3284282970967328046
[12/28/2021-10:07:26] [V] [TRT] Tactic: 3284282970967328046 Time: 0.008388
[12/28/2021-10:07:26] [V] [TRT] Conv_11 + Relu_14 Set Tactic Name: sm80_xmma_fprop_implicit_gemm_interleaved_i8i8_i8i32_f32_nchw_vect_c_32kcrs_vect_c_32_nchw_vect_c_32_tilesize64x32x64_stage6_warpsize2x1x1_g1_tensor16x8x32_t1r3s3 Tactic: 3401614690060226673
[12/28/2021-10:07:26] [V] [TRT] Tactic: 3401614690060226673 Time: 0.008248
[12/28/2021-10:07:26] [V] [TRT] Conv_11 + Relu_14 Set Tactic Name: sm80_xmma_fprop_implicit_gemm_interleaved_i8i8_i8i32_f32_nchw_vect_c_32kcrs_vect_c_32_nchw_vect_c_32_tilesize64x64x64_stage6_warpsize2x2x1_g1_tensor16x8x32_t1r3s3_epifadd Tactic: 3512426920013359699
[12/28/2021-10:07:26] [V] [TRT] Tactic: 3512426920013359699 Time: 0.008352
[12/28/2021-10:07:26] [V] [TRT] Conv_11 + Relu_14 Set Tactic Name: ampere_int8_i8816cudnn_int8_256x128_ldg16_relu_medium_nt_v1 Tactic: 3899284354987683408
[12/28/2021-10:07:26] [V] [TRT] Tactic: 3899284354987683408 Time: 0.021212
[12/28/2021-10:07:26] [V] [TRT] Conv_11 + Relu_14 Set Tactic Name: sm80_xmma_fprop_implicit_gemm_interleaved_i8i8_i8i32_f32_nchw_vect_c_32kcrs_vect_c_32_nchw_vect_c_32_tilesize64x128x64_stage6_warpsize2x2x1_g1_tensor16x8x32 Tactic: 4042202769383439184
[12/28/2021-10:07:26] [V] [TRT] Tactic: 4042202769383439184 Time: 0.009908
[12/28/2021-10:07:26] [V] [TRT] Conv_11 + Relu_14 Set Tactic Name: ampere_int8_i8816cudnn_int8_256x64_ldg16_relu_large_nt_v1 Tactic: 4182625619810185112
[12/28/2021-10:07:26] [V] [TRT] Tactic: 4182625619810185112 Time: 0.017076
[12/28/2021-10:07:26] [V] [TRT] Conv_11 + Relu_14 Set Tactic Name: sm80_xmma_fprop_implicit_gemm_interleaved_i8i8_i8i32_f32_nchw_vect_c_32kcrs_vect_c_32_nchw_vect_c_32_tilesize256x32x64_stage4_warpsize4x1x1_g1_tensor16x8x32_epifadd Tactic: 4259547356717612415
[12/28/2021-10:07:26] [V] [TRT] Tactic: 4259547356717612415 Time: 0.010372
[12/28/2021-10:07:26] [V] [TRT] Conv_11 + Relu_14 Set Tactic Name: ampere_int8_i8816cudnn_int8_256x64_ldg16_relu_small_nt_v1 Tactic: 4717285412741024953
[12/28/2021-10:07:26] [V] [TRT] Tactic: 4717285412741024953 Time: 0.015436
[12/28/2021-10:07:26] [V] [TRT] Conv_11 + Relu_14 Set Tactic Name: sm80_xmma_fprop_implicit_gemm_interleaved_i8i8_i8i32_f32_nchw_vect_c_32kcrs_vect_c_32_nchw_vect_c_32_tilesize128x256x64_stage4_warpsize2x4x1_g1_tensor16x8x32 Tactic: 4734519122557206480
[12/28/2021-10:07:26] [V] [TRT] Tactic: 4734519122557206480 Time: 0.019264
[12/28/2021-10:07:26] [V] [TRT] Conv_11 + Relu_14 Set Tactic Name: sm80_xmma_fprop_implicit_gemm_interleaved_i8i8_i8i32_f32_nchw_vect_c_32kcrs_vect_c_32_nchw_vect_c_32_tilesize128x256x64_stage4_warpsize2x4x1_g1_tensor16x8x32_epifadd Tactic: 5121596860264626879
[12/28/2021-10:07:26] [V] [TRT] Tactic: 5121596860264626879 Time: 0.019364
[12/28/2021-10:07:26] [V] [TRT] Conv_11 + Relu_14 Set Tactic Name: sm80_xmma_fprop_implicit_gemm_interleaved_i8i8_i8i32_f32_nchw_vect_c_32kcrs_vect_c_32_nchw_vect_c_32_tilesize32x32x64_stage6_warpsize2x1x1_g1_tensor16x8x32_t1r3s3 Tactic: 5136656982162849059
[12/28/2021-10:07:26] [V] [TRT] Tactic: 5136656982162849059 Time: 0.008344
[12/28/2021-10:07:26] [V] [TRT] Conv_11 + Relu_14 Set Tactic Name: sm80_xmma_fprop_implicit_gemm_interleaved_i8i8_i8i32_f32_nchw_vect_c_32kcrs_vect_c_32_nchw_vect_c_32_tilesize64x128x64_stage6_warpsize2x2x1_g1_tensor16x8x32_epifadd Tactic: 5158259316594207439
[12/28/2021-10:07:26] [V] [TRT] Tactic: 5158259316594207439 Time: 0.009996
[12/28/2021-10:07:26] [V] [TRT] Conv_11 + Relu_14 Set Tactic Name: sm80_xmma_fprop_implicit_gemm_interleaved_i8i8_i8i32_f32_nchw_vect_c_32kcrs_vect_c_32_nchw_vect_c_32_tilesize256x64x64_stage4_warpsize4x1x1_g1_tensor16x8x32_t1r3s3_epifadd Tactic: 5966973378912044513
[12/28/2021-10:07:26] [V] [TRT] Tactic: 5966973378912044513 Time: 0.012952
[12/28/2021-10:07:26] [V] [TRT] Conv_11 + Relu_14 Set Tactic Name: sm80_xmma_fprop_implicit_gemm_interleaved_i8i8_i8i32_f32_nchw_vect_c_32kcrs_vect_c_32_nchw_vect_c_32_tilesize256x32x64_stage4_warpsize4x1x1_g1_tensor16x8x32_t1r3s3 Tactic: 6004789655466615912
[12/28/2021-10:07:26] [V] [TRT] Tactic: 6004789655466615912 Time: 0.00996
[12/28/2021-10:07:26] [V] [TRT] Conv_11 + Relu_14 Set Tactic Name: sm80_xmma_fprop_implicit_gemm_interleaved_i8i8_i8i32_f32_nchw_vect_c_32kcrs_vect_c_32_nchw_vect_c_32_tilesize128x256x64_stage4_warpsize2x4x1_g1_tensor16x8x32_t1r3s3 Tactic: 6146901278630392829
[12/28/2021-10:07:26] [V] [TRT] Tactic: 6146901278630392829 Time: 0.018812
[12/28/2021-10:07:26] [V] [TRT] Conv_11 + Relu_14 Set Tactic Name: sm80_xmma_fprop_implicit_gemm_interleaved_i8i8_i8i32_f32_nchw_vect_c_32kcrs_vect_c_32_nchw_vect_c_32_tilesize256x128x64_stage4_warpsize4x2x1_g1_tensor16x8x32_epifadd Tactic: 6434020722187266170
[12/28/2021-10:07:26] [V] [TRT] Tactic: 6434020722187266170 Time: 0.019604
[12/28/2021-10:07:26] [V] [TRT] Conv_11 + Relu_14 Set Tactic Name: sm80_xmma_fprop_implicit_gemm_interleaved_i8i8_i8i32_f32_nchw_vect_c_32kcrs_vect_c_32_nchw_vect_c_32_tilesize128x64x64_stage6_warpsize2x2x1_g1_tensor16x8x32 Tactic: 6781129591847482048
[12/28/2021-10:07:26] [V] [TRT] Tactic: 6781129591847482048 Time: 0.010136
[12/28/2021-10:07:26] [V] [TRT] Conv_11 + Relu_14 Set Tactic Name: sm80_xmma_fprop_implicit_gemm_interleaved_i8i8_i8i32_f32_nchw_vect_c_32kcrs_vect_c_32_nchw_vect_c_32_tilesize32x64x64_stage6_warpsize2x2x1_g1_tensor16x8x32_t1r3s3_epifadd Tactic: 7191893591576074000
[12/28/2021-10:07:26] [V] [TRT] Tactic: 7191893591576074000 Time: 0.008508
[12/28/2021-10:07:26] [V] [TRT] Conv_11 + Relu_14 Set Tactic Name: sm80_xmma_fprop_implicit_gemm_interleaved_i8i8_i8i32_f32_nchw_vect_c_32kcrs_vect_c_32_nchw_vect_c_32_tilesize64x128x64_stage6_warpsize2x2x1_g1_tensor16x8x32_t1r3s3_epifadd Tactic: 7438984192263206338
[12/28/2021-10:07:26] [V] [TRT] Tactic: 7438984192263206338 Time: 0.009608
[12/28/2021-10:07:26] [V] [TRT] Conv_11 + Relu_14 Set Tactic Name: sm80_xmma_fprop_implicit_gemm_interleaved_i8i8_i8i32_f32_nchw_vect_c_32kcrs_vect_c_32_nchw_vect_c_32_tilesize128x128x64_stage4_warpsize2x2x1_g1_tensor16x8x32_epifadd Tactic: 7504901284678552178
[12/28/2021-10:07:26] [V] [TRT] Tactic: 7504901284678552178 Time: 0.012956
[12/28/2021-10:07:26] [V] [TRT] Conv_11 + Relu_14 Set Tactic Name: sm80_xmma_fprop_implicit_gemm_interleaved_i8i8_i8i32_f32_nchw_vect_c_32kcrs_vect_c_32_nchw_vect_c_32_tilesize128x64x64_stage6_warpsize2x2x1_g1_tensor16x8x32_t1r3s3 Tactic: 8096257414008860171
[12/28/2021-10:07:26] [V] [TRT] Tactic: 8096257414008860171 Time: 0.009736
[12/28/2021-10:07:26] [V] [TRT] Conv_11 + Relu_14 Set Tactic Name: sm80_xmma_fprop_implicit_gemm_interleaved_i8i8_i8i32_f32_nchw_vect_c_32kcrs_vect_c_32_nchw_vect_c_32_tilesize64x32x64_stage6_warpsize2x1x1_g1_tensor16x8x32_t1r3s3_epifadd Tactic: 9143438935315839085
[12/28/2021-10:07:26] [V] [TRT] Tactic: 9143438935315839085 Time: 0.008388
[12/28/2021-10:07:26] [V] [TRT] Conv_11 + Relu_14 Set Tactic Name: sm80_xmma_fprop_implicit_gemm_interleaved_i8i8_i8i32_f32_nchw_vect_c_32kcrs_vect_c_32_nchw_vect_c_32_tilesize256x128x64_stage4_warpsize4x2x1_g1_tensor16x8x32 Tactic: -9165697322068360861
[12/28/2021-10:07:26] [V] [TRT] Tactic: -9165697322068360861 Time: 0.0195
[12/28/2021-10:07:26] [V] [TRT] Conv_11 + Relu_14 Set Tactic Name: ampere_int8_i8816cudnn_int8_256x64_ldg16_relu_singleBuffer_small_nt_v1 Tactic: -9118785798277698619
[12/28/2021-10:07:26] [V] [TRT] Tactic: -9118785798277698619 Time: 0.014748
[12/28/2021-10:07:26] [V] [TRT] Conv_11 + Relu_14 Set Tactic Name: sm80_xmma_fprop_implicit_gemm_interleaved_i8i8_i8i32_f32_nchw_vect_c_32kcrs_vect_c_32_nchw_vect_c_32_tilesize128x128x64_stage4_warpsize2x2x1_g1_tensor16x8x32 Tactic: -8263994888336646547
[12/28/2021-10:07:26] [V] [TRT] Tactic: -8263994888336646547 Time: 0.01298
[12/28/2021-10:07:26] [V] [TRT] Conv_11 + Relu_14 Set Tactic Name: sm80_xmma_fprop_implicit_gemm_interleaved_i8i8_i8i32_f32_nchw_vect_c_32kcrs_vect_c_32_nchw_vect_c_32_tilesize32x64x64_stage6_warpsize2x2x1_g1_tensor16x8x32 Tactic: -8205948405243401049
[12/28/2021-10:07:26] [V] [TRT] Tactic: -8205948405243401049 Time: 0.008772
[12/28/2021-10:07:26] [V] [TRT] Conv_11 + Relu_14 Set Tactic Name: sm80_xmma_fprop_implicit_gemm_interleaved_i8i8_i8i32_f32_nchw_vect_c_32kcrs_vect_c_32_nchw_vect_c_32_tilesize128x64x64_stage6_warpsize2x2x1_g1_tensor16x8x32_t1r3s3_epifadd Tactic: -7992068592656168418
[12/28/2021-10:07:26] [V] [TRT] Tactic: -7992068592656168418 Time: 0.009708
[12/28/2021-10:07:26] [V] [TRT] Conv_11 + Relu_14 Set Tactic Name: sm80_xmma_fprop_implicit_gemm_interleaved_i8i8_i8i32_f32_nchw_vect_c_32kcrs_vect_c_32_nchw_vect_c_32_tilesize256x64x64_stage4_warpsize4x1x1_g1_tensor16x8x32_epifadd Tactic: -7842775553137511386
[12/28/2021-10:07:26] [V] [TRT] Tactic: -7842775553137511386 Time: 0.013164
[12/28/2021-10:07:26] [V] [TRT] Conv_11 + Relu_14 Set Tactic Name: sm80_xmma_fprop_implicit_gemm_interleaved_i8i8_i8i32_f32_nchw_vect_c_32kcrs_vect_c_32_nchw_vect_c_32_tilesize64x32x64_stage6_warpsize2x1x1_g1_tensor16x8x32 Tactic: -7683887278997527517
[12/28/2021-10:07:26] [V] [TRT] Tactic: -7683887278997527517 Time: 0.008712
[12/28/2021-10:07:26] [V] [TRT] Conv_11 + Relu_14 Set Tactic Name: ampere_int8_i8816cudnn_int8_128x128_ldg16_relu_small_nt_v1 Tactic: -6400348606759295499
[12/28/2021-10:07:26] [V] [TRT] Tactic: -6400348606759295499 Time: 0.014648
[12/28/2021-10:07:26] [V] [TRT] Conv_11 + Relu_14 Set Tactic Name: ampere_int8_i8816cudnn_int8_256x128_ldg16_relu_small_nt_v1 Tactic: -5980889159865208399
[12/28/2021-10:07:26] [V] [TRT] Tactic: -5980889159865208399 Time: 0.020892
[12/28/2021-10:07:26] [V] [TRT] Conv_11 + Relu_14 Set Tactic Name: ampere_int8_i8816cudnn_int8_256x64_ldg16_relu_singleBuffer_medium_nt_v1 Tactic: -5766140806760372989
[12/28/2021-10:07:26] [V] [TRT] Tactic: -5766140806760372989 Time: 0.01636
[12/28/2021-10:07:26] [V] [TRT] Conv_11 + Relu_14 Set Tactic Name: sm80_xmma_fprop_implicit_gemm_interleaved_i8i8_i8i32_f32_nchw_vect_c_32kcrs_vect_c_32_nchw_vect_c_32_tilesize128x128x64_stage4_warpsize2x2x1_g1_tensor16x8x32_t1r3s3_epifadd Tactic: -5709079507616090666
[12/28/2021-10:07:26] [V] [TRT] Tactic: -5709079507616090666 Time: 0.012568
[12/28/2021-10:07:26] [V] [TRT] Conv_11 + Relu_14 Set Tactic Name: sm80_xmma_fprop_implicit_gemm_interleaved_i8i8_i8i32_f32_nchw_vect_c_32kcrs_vect_c_32_nchw_vect_c_32_tilesize128x256x64_stage4_warpsize2x4x1_g1_tensor16x8x32_t1r3s3_epifadd Tactic: -5698636014239116282
[12/28/2021-10:07:26] [V] [TRT] Tactic: -5698636014239116282 Time: 0.018804
[12/28/2021-10:07:26] [V] [TRT] Conv_11 + Relu_14 Set Tactic Name: sm80_xmma_fprop_implicit_gemm_interleaved_i8i8_i8i32_f32_nchw_vect_c_32kcrs_vect_c_32_nchw_vect_c_32_tilesize64x64x64_stage6_warpsize2x2x1_g1_tensor16x8x32_t1r3s3 Tactic: -4933563390723451692
