logs/calib_with_name.txt
[12/29/2021-03:46:43] [V] [TRT] *************** Autotuning Reformat:Float(3072,1024,32,1) -> Int8(3072,1024,32,1) ***************
[12/29/2021-03:46:43] [V] [TRT] --------------- Timing Runner: Optimizer Reformat (Reformat)
[12/29/2021-03:46:43] [V] [TRT] Setting a default quantization params because quantization data is missing for 
[12/29/2021-03:46:43] [V] [TRT] Tactic: 1002 Time: 0.039832
[12/29/2021-03:46:43] [V] [TRT] Setting a default quantization params because quantization data is missing for 
[12/29/2021-03:46:43] [V] [TRT] Tactic: 0 Time: 0.005504
[12/29/2021-03:46:43] [V] [TRT] Fastest Tactic: 0 Time: 0.005504
[12/29/2021-03:46:43] [V] [TRT] *************** Autotuning format combination: Int8(3072,1024,32,1) -> Int8(128,64:32,8,1) ***************
[12/29/2021-03:46:43] [V] [TRT] --------------- Timing Runner: Conv_2 + Relu_5 + MaxPool_8 (ConvActPool)
[12/29/2021-03:46:43] [V] [TRT] Tactic: 1000 Time: 0.014876
[12/29/2021-03:46:43] [V] [TRT] Tactic: 1100 Time: 0.014732
[12/29/2021-03:46:43] [V] [TRT] Tactic: 1110 Time: 0.015796
[12/29/2021-03:46:43] [V] [TRT] Tactic: 1111 Time: 0.014676
[12/29/2021-03:46:43] [V] [TRT] Tactic: 1112 Time: 0.017992
[12/29/2021-03:46:43] [V] [TRT] Tactic: 1120 Time: 0.01602
[12/29/2021-03:46:43] [V] [TRT] Tactic: 1121 Time: 0.01486
[12/29/2021-03:46:43] [V] [TRT] Tactic: 1122 Time: 0.01818
[12/29/2021-03:46:43] [V] [TRT] Tactic: 1130 Time: 0.015792
[12/29/2021-03:46:43] [V] [TRT] Tactic: 1131 Time: 0.014596
[12/29/2021-03:46:43] [V] [TRT] Tactic: 1132 Time: 0.018
[12/29/2021-03:46:43] [V] [TRT] Tactic: 1140 Time: 0.01602
[12/29/2021-03:46:43] [V] [TRT] Tactic: 1141 Time: 0.014728
[12/29/2021-03:46:43] [V] [TRT] Tactic: 1142 Time: 0.0182
[12/29/2021-03:46:43] [V] [TRT] Fastest Tactic: 1131 Time: 0.014596
[12/29/2021-03:46:43] [V] [TRT] >>>>>>>>>>>>>>> Chose Runner Type: ConvActPool Tactic: 1131
[12/29/2021-03:46:43] [V] [TRT] *************** Autotuning Reformat:Int8(128,64:32,8,1) -> Float(4096,64,8,1) ***************
[12/29/2021-03:46:43] [V] [TRT] --------------- Timing Runner: Optimizer Reformat (Reformat)
[12/29/2021-03:46:43] [V] [TRT] Setting a default quantization params because quantization data is missing for 
[12/29/2021-03:46:43] [V] [TRT] Tactic: 1002 Time: 0.007724
[12/29/2021-03:46:43] [V] [TRT] Setting a default quantization params because quantization data is missing for 
[12/29/2021-03:46:43] [V] [TRT] Tactic: 0 Time: 0.00608
[12/29/2021-03:46:43] [V] [TRT] Fastest Tactic: 0 Time: 0.00608
[12/29/2021-03:46:43] [V] [TRT] *************** Autotuning Reformat:Int8(128,64:32,8,1) -> Float(4096,1,512,64) ***************
[12/29/2021-03:46:43] [V] [TRT] --------------- Timing Runner: Optimizer Reformat (Reformat)
[12/29/2021-03:46:43] [V] [TRT] Setting a default quantization params because quantization data is missing for 
[12/29/2021-03:46:43] [V] [TRT] Tactic: 1002 Time: 0.007564
[12/29/2021-03:46:43] [V] [TRT] Setting a default quantization params because quantization data is missing for 
[12/29/2021-03:46:43] [V] [TRT] Tactic: 0 Time: 0.006112
[12/29/2021-03:46:43] [V] [TRT] Fastest Tactic: 0 Time: 0.006112
[12/29/2021-03:46:43] [V] [TRT] *************** Autotuning Reformat:Int8(128,64:32,8,1) -> Float(1024,1:4,128,16) ***************
[12/29/2021-03:46:43] [V] [TRT] --------------- Timing Runner: Optimizer Reformat (Reformat)
[12/29/2021-03:46:43] [V] [TRT] Setting a default quantization params because quantization data is missing for 
[12/29/2021-03:46:43] [V] [TRT] Tactic: 1002 Time: 0.00864
[12/29/2021-03:46:43] [V] [TRT] Setting a default quantization params because quantization data is missing for 
[12/29/2021-03:46:43] [V] [TRT] Tactic: 0 Time: 0.00654
[12/29/2021-03:46:43] [V] [TRT] Fastest Tactic: 0 Time: 0.00654
[12/29/2021-03:46:43] [V] [TRT] *************** Autotuning Reformat:Int8(128,64:32,8,1) -> Float(128,64:32,8,1) ***************
[12/29/2021-03:46:43] [V] [TRT] --------------- Timing Runner: Optimizer Reformat (Reformat)
[12/29/2021-03:46:43] [V] [TRT] Setting a default quantization params because quantization data is missing for 
[12/29/2021-03:46:43] [V] [TRT] Tactic: 1002 Time: 0.007864
[12/29/2021-03:46:43] [V] [TRT] Setting a default quantization params because quantization data is missing for 
[12/29/2021-03:46:43] [V] [TRT] Tactic: 0 Time: 0.00966
[12/29/2021-03:46:43] [V] [TRT] Fastest Tactic: 1002 Time: 0.007864
[12/29/2021-03:46:43] [V] [TRT] *************** Autotuning Reformat:Int8(128,64:32,8,1) -> Int8(1024,64:4,8,1) ***************
[12/29/2021-03:46:43] [V] [TRT] --------------- Timing Runner: Optimizer Reformat (Reformat)
[12/29/2021-03:46:43] [V] [TRT] Setting a default quantization params because quantization data is missing for 
[12/29/2021-03:46:43] [V] [TRT] Tactic: 1002 Time: 0.007052
[12/29/2021-03:46:43] [V] [TRT] Setting a default quantization params because quantization data is missing for 
[12/29/2021-03:46:43] [V] [TRT] Tactic: 0 Time: 0.004724
[12/29/2021-03:46:43] [V] [TRT] Setting a default quantization params because quantization data is missing for 
[12/29/2021-03:46:43] [V] [TRT] Tactic: 1 Time: 0.00522
[12/29/2021-03:46:43] [V] [TRT] Fastest Tactic: 0 Time: 0.004724
[12/29/2021-03:46:43] [V] [TRT] *************** Autotuning Reformat:Float(4096,64,8,1) -> Float(4096,1,512,64) ***************
[12/29/2021-03:46:43] [V] [TRT] --------------- Timing Runner: Optimizer Reformat (Reformat)
[12/29/2021-03:46:43] [V] [TRT] Setting a default quantization params because quantization data is missing for 
[12/29/2021-03:46:43] [V] [TRT] Tactic: 1002 Time: 0.008308
[12/29/2021-03:46:43] [V] [TRT] Setting a default quantization params because quantization data is missing for 
[12/29/2021-03:46:43] [V] [TRT] Tactic: 0 Time: 0.005972
[12/29/2021-03:46:43] [V] [TRT] Fastest Tactic: 0 Time: 0.005972
[12/29/2021-03:46:43] [V] [TRT] *************** Autotuning Reformat:Float(4096,64,8,1) -> Float(1024,1:4,128,16) ***************
[12/29/2021-03:46:43] [V] [TRT] --------------- Timing Runner: Optimizer Reformat (Reformat)
[12/29/2021-03:46:43] [V] [TRT] Setting a default quantization params because quantization data is missing for 
[12/29/2021-03:46:43] [V] [TRT] Tactic: 1002 Time: 0.008336
[12/29/2021-03:46:43] [V] [TRT] Setting a default quantization params because quantization data is missing for 
[12/29/2021-03:46:43] [V] [TRT] Tactic: 0 Time: 0.006088
[12/29/2021-03:46:43] [V] [TRT] Fastest Tactic: 0 Time: 0.006088
[12/29/2021-03:46:43] [V] [TRT] *************** Autotuning Reformat:Float(4096,64,8,1) -> Int8(1024,64:4,8,1) ***************
[12/29/2021-03:46:43] [V] [TRT] --------------- Timing Runner: Optimizer Reformat (Reformat)
[12/29/2021-03:46:43] [V] [TRT] Setting a default quantization params because quantization data is missing for 
[12/29/2021-03:46:43] [V] [TRT] Tactic: 1002 Time: 0.007064
[12/29/2021-03:46:43] [V] [TRT] Setting a default quantization params because quantization data is missing for 
[12/29/2021-03:46:43] [V] [TRT] Tactic: 0 Time: 0.004744
[12/29/2021-03:46:43] [V] [TRT] Fastest Tactic: 0 Time: 0.004744
[12/29/2021-03:46:43] [V] [TRT] *************** Autotuning Reformat:Float(4096,64,8,1) -> Int8(128,64:32,8,1) ***************
[12/29/2021-03:46:43] [V] [TRT] --------------- Timing Runner: Optimizer Reformat (Reformat)
[12/29/2021-03:46:43] [V] [TRT] Setting a default quantization params because quantization data is missing for 
[12/29/2021-03:46:43] [V] [TRT] Tactic: 1002 Time: 0.007188
[12/29/2021-03:46:43] [V] [TRT] Setting a default quantization params because quantization data is missing for 
[12/29/2021-03:46:43] [V] [TRT] Tactic: 0 Time: 0.00744
[12/29/2021-03:46:43] [V] [TRT] Fastest Tactic: 1002 Time: 0.007188
[12/29/2021-03:46:43] [V] [TRT] *************** Autotuning Reformat:Float(4096,1,512,64) -> Float(4096,64,8,1) ***************
[12/29/2021-03:46:43] [V] [TRT] --------------- Timing Runner: Optimizer Reformat (Reformat)
[12/29/2021-03:46:43] [V] [TRT] Setting a default quantization params because quantization data is missing for 
[12/29/2021-03:46:43] [V] [TRT] Tactic: 1002 Time: 0.008524
[12/29/2021-03:46:43] [V] [TRT] Setting a default quantization params because quantization data is missing for 
[12/29/2021-03:46:43] [V] [TRT] Tactic: 0 Time: 0.005992
[12/29/2021-03:46:43] [V] [TRT] Fastest Tactic: 0 Time: 0.005992
[12/29/2021-03:46:43] [V] [TRT] *************** Autotuning Reformat:Float(4096,1,512,64) -> Float(1024,1:4,128,16) ***************
[12/29/2021-03:46:43] [V] [TRT] --------------- Timing Runner: Optimizer Reformat (Reformat)
[12/29/2021-03:46:43] [V] [TRT] Setting a default quantization params because quantization data is missing for 
[12/29/2021-03:46:43] [V] [TRT] Tactic: 1002 Time: 0.007132
[12/29/2021-03:46:43] [V] [TRT] Setting a default quantization params because quantization data is missing for 
[12/29/2021-03:46:43] [V] [TRT] Tactic: 0 Time: 0.005676
[12/29/2021-03:46:43] [V] [TRT] Fastest Tactic: 0 Time: 0.005676
[12/29/2021-03:46:43] [V] [TRT] *************** Autotuning Reformat:Float(4096,1,512,64) -> Int8(1024,64:4,8,1) ***************
[12/29/2021-03:46:43] [V] [TRT] --------------- Timing Runner: Optimizer Reformat (Reformat)
[12/29/2021-03:46:43] [V] [TRT] Setting a default quantization params because quantization data is missing for 
[12/29/2021-03:46:43] [V] [TRT] Tactic: 1002 Time: 0.00744
[12/29/2021-03:46:43] [V] [TRT] Setting a default quantization params because quantization data is missing for 
[12/29/2021-03:46:43] [V] [TRT] Tactic: 0 Time: 0.00628
[12/29/2021-03:46:43] [V] [TRT] Fastest Tactic: 0 Time: 0.00628
[12/29/2021-03:46:43] [V] [TRT] *************** Autotuning Reformat:Float(4096,1,512,64) -> Int8(128,64:32,8,1) ***************
[12/29/2021-03:46:43] [V] [TRT] --------------- Timing Runner: Optimizer Reformat (Reformat)
[12/29/2021-03:46:43] [V] [TRT] Setting a default quantization params because quantization data is missing for 
[12/29/2021-03:46:43] [V] [TRT] Tactic: 1002 Time: 0.007456
[12/29/2021-03:46:43] [V] [TRT] Setting a default quantization params because quantization data is missing for 
[12/29/2021-03:46:43] [V] [TRT] Tactic: 0 Time: 0.008164
[12/29/2021-03:46:43] [V] [TRT] Fastest Tactic: 1002 Time: 0.007456
[12/29/2021-03:46:43] [V] [TRT] *************** Autotuning Reformat:Float(1024,1:4,128,16) -> Float(4096,64,8,1) ***************
[12/29/2021-03:46:43] [V] [TRT] --------------- Timing Runner: Optimizer Reformat (Reformat)
[12/29/2021-03:46:43] [V] [TRT] Setting a default quantization params because quantization data is missing for 
[12/29/2021-03:46:43] [V] [TRT] Tactic: 1002 Time: 0.008528
[12/29/2021-03:46:43] [V] [TRT] Setting a default quantization params because quantization data is missing for 
[12/29/2021-03:46:43] [V] [TRT] Tactic: 0 Time: 0.006072
[12/29/2021-03:46:43] [V] [TRT] Fastest Tactic: 0 Time: 0.006072
[12/29/2021-03:46:43] [V] [TRT] *************** Autotuning Reformat:Float(1024,1:4,128,16) -> Float(4096,1,512,64) ***************
[12/29/2021-03:46:43] [V] [TRT] --------------- Timing Runner: Optimizer Reformat (Reformat)
[12/29/2021-03:46:43] [V] [TRT] Setting a default quantization params because quantization data is missing for 
[12/29/2021-03:46:43] [V] [TRT] Tactic: 1002 Time: 0.007144
[12/29/2021-03:46:43] [V] [TRT] Setting a default quantization params because quantization data is missing for 
[12/29/2021-03:46:43] [V] [TRT] Tactic: 0 Time: 0.005676
[12/29/2021-03:46:43] [V] [TRT] Fastest Tactic: 0 Time: 0.005676
[12/29/2021-03:46:43] [V] [TRT] *************** Autotuning Reformat:Float(1024,1:4,128,16) -> Int8(1024,64:4,8,1) ***************
[12/29/2021-03:46:43] [V] [TRT] --------------- Timing Runner: Optimizer Reformat (Reformat)
[12/29/2021-03:46:43] [V] [TRT] Setting a default quantization params because quantization data is missing for 
[12/29/2021-03:46:43] [V] [TRT] Tactic: 1002 Time: 0.008416
[12/29/2021-03:46:43] [V] [TRT] Setting a default quantization params because quantization data is missing for 
[12/29/2021-03:46:43] [V] [TRT] Tactic: 0 Time: 0.00632
[12/29/2021-03:46:43] [V] [TRT] Fastest Tactic: 0 Time: 0.00632
[12/29/2021-03:46:43] [V] [TRT] *************** Autotuning Reformat:Float(1024,1:4,128,16) -> Int8(128,64:32,8,1) ***************
[12/29/2021-03:46:43] [V] [TRT] --------------- Timing Runner: Optimizer Reformat (Reformat)
[12/29/2021-03:46:43] [V] [TRT] Setting a default quantization params because quantization data is missing for 
[12/29/2021-03:46:43] [V] [TRT] Tactic: 1002 Time: 0.008404
[12/29/2021-03:46:43] [V] [TRT] Setting a default quantization params because quantization data is missing for 
[12/29/2021-03:46:43] [V] [TRT] Tactic: 0 Time: 0.008012
[12/29/2021-03:46:43] [V] [TRT] Fastest Tactic: 0 Time: 0.008012
[12/29/2021-03:46:43] [V] [TRT] *************** Autotuning Reformat:Float(128,64:32,8,1) -> Float(4096,64,8,1) ***************
[12/29/2021-03:46:43] [V] [TRT] --------------- Timing Runner: Optimizer Reformat (Reformat)
[12/29/2021-03:46:43] [V] [TRT] Setting a default quantization params because quantization data is missing for 
[12/29/2021-03:46:43] [V] [TRT] Tactic: 1002 Time: 0.008572
[12/29/2021-03:46:43] [V] [TRT] Setting a default quantization params because quantization data is missing for 
[12/29/2021-03:46:43] [V] [TRT] Tactic: 0 Time: 0.006116
[12/29/2021-03:46:43] [V] [TRT] Fastest Tactic: 0 Time: 0.006116
[12/29/2021-03:46:43] [V] [TRT] *************** Autotuning Reformat:Float(128,64:32,8,1) -> Float(4096,1,512,64) ***************
[12/29/2021-03:46:43] [V] [TRT] --------------- Timing Runner: Optimizer Reformat (Reformat)
[12/29/2021-03:46:43] [V] [TRT] Setting a default quantization params because quantization data is missing for 
[12/29/2021-03:46:43] [V] [TRT] Tactic: 1002 Time: 0.008192
[12/29/2021-03:46:43] [V] [TRT] Setting a default quantization params because quantization data is missing for 
[12/29/2021-03:46:43] [V] [TRT] Tactic: 0 Time: 0.005772
[12/29/2021-03:46:43] [V] [TRT] Fastest Tactic: 0 Time: 0.005772
[12/29/2021-03:46:43] [V] [TRT] *************** Autotuning Reformat:Float(128,64:32,8,1) -> Float(1024,1:4,128,16) ***************
[12/29/2021-03:46:43] [V] [TRT] --------------- Timing Runner: Optimizer Reformat (Reformat)
[12/29/2021-03:46:43] [V] [TRT] Setting a default quantization params because quantization data is missing for 
[12/29/2021-03:46:43] [V] [TRT] Tactic: 1002 Time: 0.007128
[12/29/2021-03:46:43] [V] [TRT] Setting a default quantization params because quantization data is missing for 
[12/29/2021-03:46:43] [V] [TRT] Tactic: 0 Time: 0.005964
[12/29/2021-03:46:43] [V] [TRT] Fastest Tactic: 0 Time: 0.005964
[12/29/2021-03:46:43] [V] [TRT] *************** Autotuning Reformat:Float(128,64:32,8,1) -> Int8(1024,64:4,8,1) ***************
[12/29/2021-03:46:43] [V] [TRT] --------------- Timing Runner: Optimizer Reformat (Reformat)
[12/29/2021-03:46:43] [V] [TRT] Setting a default quantization params because quantization data is missing for 
[12/29/2021-03:46:43] [V] [TRT] Tactic: 1002 Time: 0.007728
[12/29/2021-03:46:43] [V] [TRT] Setting a default quantization params because quantization data is missing for 
[12/29/2021-03:46:43] [V] [TRT] Tactic: 0 Time: 0.006436
[12/29/2021-03:46:43] [V] [TRT] Fastest Tactic: 0 Time: 0.006436
[12/29/2021-03:46:43] [V] [TRT] *************** Autotuning Reformat:Float(128,64:32,8,1) -> Int8(128,64:32,8,1) ***************
[12/29/2021-03:46:43] [V] [TRT] --------------- Timing Runner: Optimizer Reformat (Reformat)
[12/29/2021-03:46:43] [V] [TRT] Setting a default quantization params because quantization data is missing for 
[12/29/2021-03:46:43] [V] [TRT] Tactic: 1002 Time: 0.00776
[12/29/2021-03:46:43] [V] [TRT] Setting a default quantization params because quantization data is missing for 
[12/29/2021-03:46:43] [V] [TRT] Tactic: 0 Time: 0.0081
[12/29/2021-03:46:43] [V] [TRT] Fastest Tactic: 1002 Time: 0.00776
[12/29/2021-03:46:43] [V] [TRT] *************** Autotuning Reformat:Int8(1024,64:4,8,1) -> Float(4096,64,8,1) ***************
[12/29/2021-03:46:43] [V] [TRT] --------------- Timing Runner: Optimizer Reformat (Reformat)
[12/29/2021-03:46:43] [V] [TRT] Setting a default quantization params because quantization data is missing for 
[12/29/2021-03:46:43] [V] [TRT] Tactic: 1002 Time: 0.007776
[12/29/2021-03:46:43] [V] [TRT] Setting a default quantization params because quantization data is missing for 
[12/29/2021-03:46:43] [V] [TRT] Tactic: 0 Time: 0.005128
[12/29/2021-03:46:43] [V] [TRT] Fastest Tactic: 0 Time: 0.005128
[12/29/2021-03:46:43] [V] [TRT] *************** Autotuning Reformat:Int8(1024,64:4,8,1) -> Float(4096,1,512,64) ***************
[12/29/2021-03:46:43] [V] [TRT] --------------- Timing Runner: Optimizer Reformat (Reformat)
[12/29/2021-03:46:43] [V] [TRT] Setting a default quantization params because quantization data is missing for 
[12/29/2021-03:46:43] [V] [TRT] Tactic: 1002 Time: 0.00788
[12/29/2021-03:46:43] [V] [TRT] Setting a default quantization params because quantization data is missing for 
[12/29/2021-03:46:43] [V] [TRT] Tactic: 0 Time: 0.006132
[12/29/2021-03:46:43] [V] [TRT] Fastest Tactic: 0 Time: 0.006132
[12/29/2021-03:46:43] [V] [TRT] *************** Autotuning Reformat:Int8(1024,64:4,8,1) -> Float(1024,1:4,128,16) ***************
[12/29/2021-03:46:43] [V] [TRT] --------------- Timing Runner: Optimizer Reformat (Reformat)
[12/29/2021-03:46:43] [V] [TRT] Setting a default quantization params because quantization data is missing for 
[12/29/2021-03:46:43] [V] [TRT] Tactic: 1002 Time: 0.008728
[12/29/2021-03:46:43] [V] [TRT] Setting a default quantization params because quantization data is missing for 
[12/29/2021-03:46:43] [V] [TRT] Tactic: 0 Time: 0.006536
[12/29/2021-03:46:43] [V] [TRT] Fastest Tactic: 0 Time: 0.006536
[12/29/2021-03:46:43] [V] [TRT] *************** Autotuning Reformat:Int8(1024,64:4,8,1) -> Int8(128,64:32,8,1) ***************
[12/29/2021-03:46:43] [V] [TRT] --------------- Timing Runner: Optimizer Reformat (Reformat)
[12/29/2021-03:46:43] [V] [TRT] Setting a default quantization params because quantization data is missing for 
[12/29/2021-03:46:43] [V] [TRT] Tactic: 1002 Time: 0.007116
[12/29/2021-03:46:43] [V] [TRT] Setting a default quantization params because quantization data is missing for 
[12/29/2021-03:46:43] [V] [TRT] Tactic: 0 Time: 0.0052
[12/29/2021-03:46:43] [V] [TRT] Fastest Tactic: 0 Time: 0.0052
[12/29/2021-03:46:43] [V] [TRT] *************** Autotuning Reformat:Int8(128,64:32,8,1) -> Float(4096,64,8,1) ***************
[12/29/2021-03:46:43] [V] [TRT] --------------- Timing Runner: Optimizer Reformat (Reformat)
[12/29/2021-03:46:43] [V] [TRT] Setting a default quantization params because quantization data is missing for 
[12/29/2021-03:46:43] [V] [TRT] Tactic: 1002 Time: 0.00772
[12/29/2021-03:46:43] [V] [TRT] Setting a default quantization params because quantization data is missing for 
[12/29/2021-03:46:43] [V] [TRT] Tactic: 0 Time: 0.006184
[12/29/2021-03:46:43] [V] [TRT] Fastest Tactic: 0 Time: 0.006184
[12/29/2021-03:46:43] [V] [TRT] *************** Autotuning Reformat:Int8(128,64:32,8,1) -> Float(4096,1,512,64) ***************
[12/29/2021-03:46:43] [V] [TRT] --------------- Timing Runner: Optimizer Reformat (Reformat)
[12/29/2021-03:46:43] [V] [TRT] Setting a default quantization params because quantization data is missing for 
[12/29/2021-03:46:43] [V] [TRT] Tactic: 1002 Time: 0.0076
[12/29/2021-03:46:43] [V] [TRT] Setting a default quantization params because quantization data is missing for 
[12/29/2021-03:46:43] [V] [TRT] Tactic: 0 Time: 0.006156
[12/29/2021-03:46:43] [V] [TRT] Fastest Tactic: 0 Time: 0.006156
[12/29/2021-03:46:43] [V] [TRT] *************** Autotuning Reformat:Int8(128,64:32,8,1) -> Float(1024,1:4,128,16) ***************
[12/29/2021-03:46:43] [V] [TRT] --------------- Timing Runner: Optimizer Reformat (Reformat)
[12/29/2021-03:46:43] [V] [TRT] Setting a default quantization params because quantization data is missing for 
[12/29/2021-03:46:43] [V] [TRT] Tactic: 1002 Time: 0.008632
[12/29/2021-03:46:43] [V] [TRT] Setting a default quantization params because quantization data is missing for 
[12/29/2021-03:46:43] [V] [TRT] Tactic: 0 Time: 0.006512
[12/29/2021-03:46:43] [V] [TRT] Fastest Tactic: 0 Time: 0.006512
[12/29/2021-03:46:43] [V] [TRT] *************** Autotuning Reformat:Int8(128,64:32,8,1) -> Int8(1024,64:4,8,1) ***************
[12/29/2021-03:46:43] [V] [TRT] --------------- Timing Runner: Optimizer Reformat (Reformat)
[12/29/2021-03:46:43] [V] [TRT] Setting a default quantization params because quantization data is missing for 
[12/29/2021-03:46:43] [V] [TRT] Tactic: 1002 Time: 0.006996
[12/29/2021-03:46:43] [V] [TRT] Setting a default quantization params because quantization data is missing for 
[12/29/2021-03:46:43] [V] [TRT] Tactic: 0 Time: 0.004736
[12/29/2021-03:46:43] [V] [TRT] Setting a default quantization params because quantization data is missing for 
[12/29/2021-03:46:43] [V] [TRT] Tactic: 1 Time: 0.005272
[12/29/2021-03:46:43] [V] [TRT] Fastest Tactic: 0 Time: 0.004736
[12/29/2021-03:46:43] [V] [TRT] *************** Autotuning format combination: Float(4096,64,8,1) -> Float(4096,64,8,1) ***************
[12/29/2021-03:46:43] [V] [TRT] --------------- Timing Runner: Conv_11 + Relu_14 (CudaDepthwiseConvolution)
[12/29/2021-03:46:43] [V] [TRT] CudaDepthwiseConvolution has no valid tactics for this config, skipping
[12/29/2021-03:46:43] [V] [TRT] --------------- Timing Runner: Conv_11 + Relu_14 (FusedConvActConvolution)
[12/29/2021-03:46:43] [V] [TRT] FusedConvActConvolution has no valid tactics for this config, skipping
[12/29/2021-03:46:44] [V] [TRT] --------------- Timing Runner: Conv_11 + Relu_14 (CudnnConvolution)
[12/29/2021-03:46:44] [V] [TRT] Tactic: 0 Time: 0.035632
[12/29/2021-03:46:44] [V] [TRT] Tactic: 1 Time: 0.052124
[12/29/2021-03:46:44] [V] [TRT] Tactic: 2 Time: 0.067792
[12/29/2021-03:46:44] [V] [TRT] Tactic: 4 Time: 0.047576
[12/29/2021-03:46:44] [V] [TRT] Tactic: 5 skipped. Scratch requested: 35651584, available: 16777216
[12/29/2021-03:46:44] [V] [TRT] Tactic: 6 Time: 0.027348
[12/29/2021-03:46:44] [V] [TRT] Tactic: 56 Time: 0.035832
[12/29/2021-03:46:44] [V] [TRT] Tactic: 57 Time: 0.032872
[12/29/2021-03:46:44] [V] [TRT] Tactic: 58 Time: 0.067804
[12/29/2021-03:46:44] [V] [TRT] Tactic: 60 Time: 0.047796
[12/29/2021-03:46:44] [V] [TRT] Tactic: 61 skipped. Scratch requested: 35651584, available: 16777216
[12/29/2021-03:46:44] [V] [TRT] Tactic: 62 Time: 0.027368
[12/29/2021-03:46:44] [V] [TRT] Tactic: 112 Time: 0.035988
[12/29/2021-03:46:44] [V] [TRT] Tactic: 113 Time: 0.091552
[12/29/2021-03:46:44] [V] [TRT] Tactic: 114 Time: 0.06788
[12/29/2021-03:46:44] [V] [TRT] Tactic: 116 Time: 0.047576
[12/29/2021-03:46:44] [V] [TRT] Tactic: 117 skipped. Scratch requested: 35651584, available: 16777216
[12/29/2021-03:46:44] [V] [TRT] Tactic: 118 Time: 0.027348
[12/29/2021-03:46:44] [I] [TRT] Some tactics do not have sufficient workspace memory to run. Increasing workspace size may increase performance, please check verbose output.
[12/29/2021-03:46:44] [V] [TRT] Fastest Tactic: 118 Time: 0.027348
[12/29/2021-03:46:44] [V] [TRT] --------------- Timing Runner: Conv_11 + Relu_14 (CaskConvolution)
[12/29/2021-03:46:44] [V] [TRT] Conv_11 + Relu_14 Set Tactic Name: ampere_scudnn_128x64_relu_small_nn_v1 Tactic: 4549827808004681195
[12/29/2021-03:46:44] [V] [TRT] Tactic: 4549827808004681195 Time: 0.062884
[12/29/2021-03:46:44] [V] [TRT] Conv_11 + Relu_14 Set Tactic Name: ampere_scudnn_128x128_relu_small_nn_v1 Tactic: 5779835512569528575
[12/29/2021-03:46:44] [V] [TRT] Tactic: 5779835512569528575 Time: 0.079968
[12/29/2021-03:46:44] [V] [TRT] Conv_11 + Relu_14 Set Tactic Name: ampere_scudnn_128x128_relu_xregs_large_nn_v1 Tactic: 6053873026024413720
[12/29/2021-03:46:44] [V] [TRT] Tactic: 6053873026024413720 Time: 0.089268
[12/29/2021-03:46:44] [V] [TRT] Conv_11 + Relu_14 Set Tactic Name: ampere_scudnn_128x64_relu_xregs_large_nn_v1 Tactic: 6767548733843469815
[12/29/2021-03:46:44] [V] [TRT] Tactic: 6767548733843469815 Time: 0.068568
[12/29/2021-03:46:44] [V] [TRT] Conv_11 + Relu_14 Set Tactic Name: ampere_scudnn_128x32_relu_small_nn_v1 Tactic: -6313876406580483184
[12/29/2021-03:46:44] [V] [TRT] Tactic: -6313876406580483184 Time: 0.075428
[12/29/2021-03:46:44] [V] [TRT] Conv_11 + Relu_14 Set Tactic Name: ampere_scudnn_128x128_relu_medium_nn_v1 Tactic: -1123676555321336786
[12/29/2021-03:46:44] [V] [TRT] Tactic: -1123676555321336786 Time: 0.087588
[12/29/2021-03:46:44] [V] [TRT] Conv_11 + Relu_14 Set Tactic Name: ampere_scudnn_128x64_relu_medium_nn_v1 Tactic: -701551393537224327
[12/29/2021-03:46:44] [V] [TRT] Tactic: -701551393537224327 Time: 0.076932
[12/29/2021-03:46:44] [V] [TRT] Fastest Tactic: 4549827808004681195 Time: 0.062884
[12/29/2021-03:46:44] [V] [TRT] >>>>>>>>>>>>>>> Chose Runner Type: CudnnConvolution Tactic: 118
[12/29/2021-03:46:44] [V] [TRT] *************** Autotuning format combination: Float(4096,1,512,64) -> Float(4096,1,512,64) ***************
[12/29/2021-03:46:44] [V] [TRT] --------------- Timing Runner: Conv_11 + Relu_14 (CudnnConvolution)
[12/29/2021-03:46:44] [V] [TRT] CudnnConvolution has no valid tactics for this config, skipping
[12/29/2021-03:46:44] [V] [TRT] --------------- Timing Runner: Conv_11 + Relu_14 (CaskConvolution)
[12/29/2021-03:46:44] [V] [TRT] Conv_11 + Relu_14 Set Tactic Name: ampere_scudnn_128x64_sliced1x2_ldg4_relu_exp_small_nhwc_tn_v1 Tactic: 2860655430572478466
[12/29/2021-03:46:44] [V] [TRT] Tactic: 2860655430572478466 Time: 0.0489
[12/29/2021-03:46:44] [V] [TRT] Conv_11 + Relu_14 Set Tactic Name: ampere_scudnn_128x32_sliced1x4_ldg4_relu_exp_medium_nhwc_tn_v1 Tactic: 4474630279712975759
[12/29/2021-03:46:44] [V] [TRT] Tactic: 4474630279712975759 Time: 0.03038
[12/29/2021-03:46:44] [V] [TRT] Conv_11 + Relu_14 Set Tactic Name: ampere_scudnn_128x32_sliced1x4_ldg4_relu_exp_small_nhwc_tn_v1 Tactic: 4479823862704990365
[12/29/2021-03:46:44] [V] [TRT] Tactic: 4479823862704990365 Time: 0.029736
[12/29/2021-03:46:44] [V] [TRT] Conv_11 + Relu_14 Set Tactic Name: ampere_scudnn_128x64_sliced1x2_ldg4_relu_exp_medium_nhwc_tn_v1 Tactic: 4696204239951173149
[12/29/2021-03:46:44] [V] [TRT] Tactic: 4696204239951173149 Time: 0.049764
[12/29/2021-03:46:44] [V] [TRT] Conv_11 + Relu_14 Set Tactic Name: ampere_scudnn_128x128_relu_exp_small_nhwc_tn_v1 Tactic: 5778138195697110003
[12/29/2021-03:46:44] [V] [TRT] Tactic: 5778138195697110003 Time: 0.078912
[12/29/2021-03:46:44] [V] [TRT] Conv_11 + Relu_14 Set Tactic Name: ampere_scudnn_128x128_ldg4_relu_exp_large_nhwc_tn_v1 Tactic: 7155825427510256858
[12/29/2021-03:46:44] [V] [TRT] Tactic: 7155825427510256858 Time: 0.079376
[12/29/2021-03:46:44] [V] [TRT] Conv_11 + Relu_14 Set Tactic Name: ampere_scudnn_128x128_ldg4_relu_exp_medium_nhwc_tn_v1 Tactic: 8918020581761223752
[12/29/2021-03:46:44] [V] [TRT] Tactic: 8918020581761223752 Time: 0.077604
[12/29/2021-03:46:44] [V] [TRT] Conv_11 + Relu_14 Set Tactic Name: ampere_scudnn_128x64_sliced1x2_ldg4_relu_exp_large_nhwc_tn_v1 Tactic: -4756382386362004279
[12/29/2021-03:46:44] [V] [TRT] Tactic: -4756382386362004279 Time: 0.04896
[12/29/2021-03:46:44] [V] [TRT] Conv_11 + Relu_14 Set Tactic Name: ampere_scudnn_128x128_relu_exp_large_nhwc_tn_v1 Tactic: -3855385237722507464
[12/29/2021-03:46:44] [V] [TRT] Tactic: -3855385237722507464 Time: 0.08044
[12/29/2021-03:46:44] [V] [TRT] Conv_11 + Relu_14 Set Tactic Name: ampere_scudnn_128x128_relu_exp_medium_nhwc_tn_v1 Tactic: -2809379259463049391
[12/29/2021-03:46:44] [V] [TRT] Tactic: -2809379259463049391 Time: 0.07914
[12/29/2021-03:46:44] [V] [TRT] Conv_11 + Relu_14 Set Tactic Name: ampere_scudnn_128x128_ldg4_relu_exp_small_nhwc_tn_v1 Tactic: -504296718212024303
[12/29/2021-03:46:44] [V] [TRT] Tactic: -504296718212024303 Time: 0.076652
[12/29/2021-03:46:44] [V] [TRT] Fastest Tactic: 4479823862704990365 Time: 0.029736
[12/29/2021-03:46:44] [V] [TRT] >>>>>>>>>>>>>>> Chose Runner Type: CaskConvolution Tactic: 4479823862704990365
[12/29/2021-03:46:44] [V] [TRT] *************** Autotuning format combination: Float(1024,1:4,128,16) -> Float(1024,1:4,128,16) ***************
[12/29/2021-03:46:44] [V] [TRT] --------------- Timing Runner: Conv_11 + Relu_14 (CudnnConvolution)
[12/29/2021-03:46:44] [V] [TRT] CudnnConvolution has no valid tactics for this config, skipping
[12/29/2021-03:46:44] [V] [TRT] --------------- Timing Runner: Conv_11 + Relu_14 (CaskConvolution)
[12/29/2021-03:46:44] [V] [TRT] Conv_11 + Relu_14 Set Tactic Name: ampere_scudnn_128x64_sliced1x2_ldg4_relu_exp_small_nhwc_tn_v1 Tactic: 2860655430572478466
[12/29/2021-03:46:44] [V] [TRT] Tactic: 2860655430572478466 Time: 0.04896
[12/29/2021-03:46:44] [V] [TRT] Conv_11 + Relu_14 Set Tactic Name: ampere_scudnn_128x32_sliced1x4_ldg4_relu_exp_medium_nhwc_tn_v1 Tactic: 4474630279712975759
[12/29/2021-03:46:44] [V] [TRT] Tactic: 4474630279712975759 Time: 0.03036
[12/29/2021-03:46:44] [V] [TRT] Conv_11 + Relu_14 Set Tactic Name: ampere_scudnn_128x32_sliced1x4_ldg4_relu_exp_small_nhwc_tn_v1 Tactic: 4479823862704990365
[12/29/2021-03:46:44] [V] [TRT] Tactic: 4479823862704990365 Time: 0.029652
[12/29/2021-03:46:44] [V] [TRT] Conv_11 + Relu_14 Set Tactic Name: ampere_scudnn_128x64_sliced1x2_ldg4_relu_exp_medium_nhwc_tn_v1 Tactic: 4696204239951173149
[12/29/2021-03:46:44] [V] [TRT] Tactic: 4696204239951173149 Time: 0.049784
[12/29/2021-03:46:44] [V] [TRT] Conv_11 + Relu_14 Set Tactic Name: ampere_scudnn_128x128_relu_exp_small_nhwc_tn_v1 Tactic: 5778138195697110003
[12/29/2021-03:46:44] [V] [TRT] Tactic: 5778138195697110003 Time: 0.078924
[12/29/2021-03:46:44] [V] [TRT] Conv_11 + Relu_14 Set Tactic Name: ampere_scudnn_128x128_ldg4_relu_exp_large_nhwc_tn_v1 Tactic: 7155825427510256858
[12/29/2021-03:46:44] [V] [TRT] Tactic: 7155825427510256858 Time: 0.0793
[12/29/2021-03:46:44] [V] [TRT] Conv_11 + Relu_14 Set Tactic Name: sm80_xmma_fprop_implicit_gemm_indexed_f32f32_tf32f32_f32_nhwckrsc_nhwc_tilesize128x128x16_stage4_warpsize2x2x1_g1_tensor16x8x8 Tactic: 7342025736444949634
[12/29/2021-03:46:44] [V] [TRT] Tactic: 7342025736444949634 Time: 0.054392
[12/29/2021-03:46:44] [V] [TRT] Conv_11 + Relu_14 Set Tactic Name: ampere_scudnn_128x128_ldg4_relu_exp_medium_nhwc_tn_v1 Tactic: 8918020581761223752
[12/29/2021-03:46:44] [V] [TRT] Tactic: 8918020581761223752 Time: 0.07778
[12/29/2021-03:46:44] [V] [TRT] Conv_11 + Relu_14 Set Tactic Name: sm80_xmma_fprop_implicit_gemm_f32f32_tf32f32_f32_nhwckrsc_nhwc_tilesize128x128x16_stage4_warpsize2x2x1_g1_tensor16x8x8_t1r3s3 Tactic: -7377458734869418330
[12/29/2021-03:46:44] [V] [TRT] Tactic: -7377458734869418330 Time: 0.05376
[12/29/2021-03:46:44] [V] [TRT] Conv_11 + Relu_14 Set Tactic Name: sm80_xmma_fprop_implicit_gemm_f32f32_tf32f32_f32_nhwckrsc_nhwc_tilesize128x128x16_stage4_warpsize2x2x1_g1_tensor16x8x8 Tactic: -5457304872213719461
[12/29/2021-03:46:45] [V] [TRT] Tactic: -5457304872213719461 Time: 0.054492
[12/29/2021-03:46:45] [V] [TRT] Conv_11 + Relu_14 Set Tactic Name: ampere_scudnn_128x64_sliced1x2_ldg4_relu_exp_large_nhwc_tn_v1 Tactic: -4756382386362004279
[12/29/2021-03:46:45] [V] [TRT] Tactic: -4756382386362004279 Time: 0.048812
[12/29/2021-03:46:45] [V] [TRT] Conv_11 + Relu_14 Set Tactic Name: ampere_scudnn_128x128_relu_exp_large_nhwc_tn_v1 Tactic: -3855385237722507464
[12/29/2021-03:46:45] [V] [TRT] Tactic: -3855385237722507464 Time: 0.080288
[12/29/2021-03:46:45] [V] [TRT] Conv_11 + Relu_14 Set Tactic Name: ampere_scudnn_128x128_relu_exp_medium_nhwc_tn_v1 Tactic: -2809379259463049391
[12/29/2021-03:46:45] [V] [TRT] Tactic: -2809379259463049391 Time: 0.078956
[12/29/2021-03:46:45] [V] [TRT] Conv_11 + Relu_14 Set Tactic Name: ampere_scudnn_128x128_ldg4_relu_exp_small_nhwc_tn_v1 Tactic: -504296718212024303
[12/29/2021-03:46:45] [V] [TRT] Tactic: -504296718212024303 Time: 0.076584
[12/29/2021-03:46:45] [V] [TRT] Fastest Tactic: 4479823862704990365 Time: 0.029652
[12/29/2021-03:46:45] [V] [TRT] >>>>>>>>>>>>>>> Chose Runner Type: CaskConvolution Tactic: 4479823862704990365
[12/29/2021-03:46:45] [V] [TRT] *************** Autotuning format combination: Int8(1024,64:4,8,1) -> Float(4096,64,8,1) ***************
[12/29/2021-03:46:45] [V] [TRT] --------------- Timing Runner: Conv_11 + Relu_14 (CudaDepthwiseConvolution)
[12/29/2021-03:46:45] [V] [TRT] CudaDepthwiseConvolution has no valid tactics for this config, skipping
[12/29/2021-03:46:45] [V] [TRT] --------------- Timing Runner: Conv_11 + Relu_14 (CaskConvolution)
[12/29/2021-03:46:45] [V] [TRT] Conv_11 + Relu_14 Set Tactic Name: ampere_fp32_icudnn_int8x4_128x128_relu_xregs_large_nn_v1 Tactic: 1332468635798226953
[12/29/2021-03:46:45] [V] [TRT] Tactic: 1332468635798226953 Time: 0.034992
[12/29/2021-03:46:45] [V] [TRT] Conv_11 + Relu_14 Set Tactic Name: ampere_fp32_icudnn_int8x4_128x128_relu_small_nn_v1 Tactic: 1508480131241957639
[12/29/2021-03:46:45] [V] [TRT] Tactic: 1508480131241957639 Time: 0.033164
[12/29/2021-03:46:45] [V] [TRT] Conv_11 + Relu_14 Set Tactic Name: ampere_fp32_icudnn_int8x4_128x64_relu_xregs_large_nn_v1 Tactic: 1947019689364377201
[12/29/2021-03:46:45] [V] [TRT] Tactic: 1947019689364377201 Time: 0.025096
[12/29/2021-03:46:45] [V] [TRT] Conv_11 + Relu_14 Set Tactic Name: ampere_fp32_icudnn_int8x4_128x128_relu_medium_nn_v1 Tactic: 3239257003214966313
[12/29/2021-03:46:45] [V] [TRT] Tactic: 3239257003214966313 Time: 0.03478
[12/29/2021-03:46:45] [V] [TRT] Conv_11 + Relu_14 Set Tactic Name: ampere_fp32_icudnn_int8x4_128x32_relu_xregs_small_nn_v1 Tactic: 5592640619112287921
[12/29/2021-03:46:45] [V] [TRT] Tactic: 5592640619112287921 Time: 0.022268
[12/29/2021-03:46:45] [V] [TRT] Conv_11 + Relu_14 Set Tactic Name: ampere_fp32_icudnn_int8x4_128x64_relu_small_nn_v1 Tactic: 7621465827583909090
[12/29/2021-03:46:45] [V] [TRT] Tactic: 7621465827583909090 Time: 0.02324
[12/29/2021-03:46:45] [V] [TRT] Conv_11 + Relu_14 Set Tactic Name: ampere_fp32_icudnn_int8x4_128x64_relu_medium_nn_v1 Tactic: -5576936487443445631
[12/29/2021-03:46:45] [V] [TRT] Tactic: -5576936487443445631 Time: 0.026952
[12/29/2021-03:46:45] [V] [TRT] Conv_11 + Relu_14 Set Tactic Name: ampere_fp32_icudnn_int8x4_128x32_relu_medium_nn_v1 Tactic: -2297737319934264721
[12/29/2021-03:46:45] [V] [TRT] Tactic: -2297737319934264721 Time: 0.030608
[12/29/2021-03:46:45] [V] [TRT] Conv_11 + Relu_14 Set Tactic Name: ampere_fp32_icudnn_int8x4_128x32_relu_xregs_medium_nn_v1 Tactic: -1425085658556684465
[12/29/2021-03:46:45] [V] [TRT] Tactic: -1425085658556684465 Time: 0.028872
[12/29/2021-03:46:45] [V] [TRT] Conv_11 + Relu_14 Set Tactic Name: ampere_fp32_icudnn_int8x4_128x32_relu_small_nn_v1 Tactic: -108011214168778087
[12/29/2021-03:46:45] [V] [TRT] Tactic: -108011214168778087 Time: 0.0257
[12/29/2021-03:46:45] [V] [TRT] Fastest Tactic: 5592640619112287921 Time: 0.022268
[12/29/2021-03:46:45] [V] [TRT] >>>>>>>>>>>>>>> Chose Runner Type: CaskConvolution Tactic: 5592640619112287921
[12/29/2021-03:46:45] [V] [TRT] *************** Autotuning format combination: Int8(1024,64:4,8,1) -> Int8(1024,64:4,8,1) ***************
[12/29/2021-03:46:45] [V] [TRT] --------------- Timing Runner: Conv_11 + Relu_14 (CudaDepthwiseConvolution)
[12/29/2021-03:46:45] [V] [TRT] CudaDepthwiseConvolution has no valid tactics for this config, skipping
[12/29/2021-03:46:45] [V] [TRT] --------------- Timing Runner: Conv_11 + Relu_14 (FusedConvActConvolution)
[12/29/2021-03:46:45] [V] [TRT] FusedConvActConvolution has no valid tactics for this config, skipping
[12/29/2021-03:46:45] [V] [TRT] --------------- Timing Runner: Conv_11 + Relu_14 (CaskConvolution)
[12/29/2021-03:46:45] [V] [TRT] Conv_11 + Relu_14 Set Tactic Name: ampere_int8x4_icudnn_int8x4_128x32_relu_medium_nn_v1 Tactic: 175853789719975416
[12/29/2021-03:46:45] [V] [TRT] Tactic: 175853789719975416 Time: 0.028476
[12/29/2021-03:46:45] [V] [TRT] Conv_11 + Relu_14 Set Tactic Name: ampere_int8x4_icudnn_int8x4_128x32_relu_xregs_medium_nn_v1 Tactic: 2171150287007712632
[12/29/2021-03:46:45] [V] [TRT] Tactic: 2171150287007712632 Time: 0.026688
[12/29/2021-03:46:45] [V] [TRT] Conv_11 + Relu_14 Set Tactic Name: ampere_int8x4_icudnn_int8x4_128x64_relu_small_nn_v1 Tactic: 2234457234705232274
[12/29/2021-03:46:45] [V] [TRT] Tactic: 2234457234705232274 Time: 0.020864
[12/29/2021-03:46:45] [V] [TRT] Conv_11 + Relu_14 Set Tactic Name: ampere_int8x4_icudnn_int8x4_128x64_relu_medium_nn_v1 Tactic: 5834048089706882838
[12/29/2021-03:46:45] [V] [TRT] Tactic: 5834048089706882838 Time: 0.024608
[12/29/2021-03:46:45] [V] [TRT] Conv_11 + Relu_14 Set Tactic Name: ampere_int8x4_icudnn_int8x4_128x32_relu_small_nn_v1 Tactic: -8626990807754934295
[12/29/2021-03:46:45] [V] [TRT] Tactic: -8626990807754934295 Time: 0.023812
[12/29/2021-03:46:45] [V] [TRT] Conv_11 + Relu_14 Set Tactic Name: ampere_int8x4_icudnn_int8x4_128x32_relu_xregs_small_nn_v1 Tactic: -7303593854972602201
[12/29/2021-03:46:45] [V] [TRT] Tactic: -7303593854972602201 Time: 0.0202
[12/29/2021-03:46:45] [V] [TRT] Conv_11 + Relu_14 Set Tactic Name: ampere_int8x4_icudnn_int8x4_128x128_relu_medium_nn_v1 Tactic: -6585664687867083638
[12/29/2021-03:46:45] [V] [TRT] Tactic: -6585664687867083638 Time: 0.031992
[12/29/2021-03:46:45] [V] [TRT] Conv_11 + Relu_14 Set Tactic Name: ampere_int8x4_icudnn_int8x4_128x64_relu_xregs_large_nn_v1 Tactic: -3730012925709297561
[12/29/2021-03:46:45] [V] [TRT] Tactic: -3730012925709297561 Time: 0.02286
[12/29/2021-03:46:45] [V] [TRT] Conv_11 + Relu_14 Set Tactic Name: ampere_int8x4_icudnn_int8x4_128x128_relu_xregs_large_nn_v1 Tactic: -2277259417488004546
[12/29/2021-03:46:45] [V] [TRT] Tactic: -2277259417488004546 Time: 0.032252
[12/29/2021-03:46:45] [V] [TRT] Conv_11 + Relu_14 Set Tactic Name: ampere_int8x4_icudnn_int8x4_128x128_relu_small_nn_v1 Tactic: -683636008127039856
[12/29/2021-03:46:45] [V] [TRT] Tactic: -683636008127039856 Time: 0.030368
[12/29/2021-03:46:45] [V] [TRT] Fastest Tactic: -7303593854972602201 Time: 0.0202
[12/29/2021-03:46:45] [V] [TRT] >>>>>>>>>>>>>>> Chose Runner Type: CaskConvolution Tactic: -7303593854972602201
[12/29/2021-03:46:45] [V] [TRT] *************** Autotuning format combination: Int8(1024,64:4,8,1) -> Int8(128,64:32,8,1) ***************
[12/29/2021-03:46:45] [V] [TRT] --------------- Timing Runner: Conv_11 + Relu_14 (CaskConvolution)
[12/29/2021-03:46:45] [V] [TRT] Conv_11 + Relu_14 Set Tactic Name: ampere_int8x4_icudnn_int8x4_128x64_relu_xregs_large_c32_nn_v1 Tactic: 984309058095623735
[12/29/2021-03:46:45] [V] [TRT] Tactic: 984309058095623735 Time: 0.022648
[12/29/2021-03:46:45] [V] [TRT] Conv_11 + Relu_14 Set Tactic Name: ampere_int8x4_icudnn_int8x4_128x32_relu_small_c32_nn_v1 Tactic: 1100922622480907544
[12/29/2021-03:46:45] [V] [TRT] Tactic: 1100922622480907544 Time: 0.02352
[12/29/2021-03:46:45] [V] [TRT] Conv_11 + Relu_14 Set Tactic Name: ampere_int8x4_icudnn_int8x4_128x128_relu_xregs_large_c32_nn_v1 Tactic: 3238312825609165543
[12/29/2021-03:46:45] [V] [TRT] Tactic: 3238312825609165543 Time: 0.032132
[12/29/2021-03:46:45] [V] [TRT] Conv_11 + Relu_14 Set Tactic Name: ampere_int8x4_icudnn_int8x4_128x64_relu_medium_c32_nn_v1 Tactic: 3606311198834416176
[12/29/2021-03:46:45] [V] [TRT] Tactic: 3606311198834416176 Time: 0.02444
[12/29/2021-03:46:45] [V] [TRT] Conv_11 + Relu_14 Set Tactic Name: ampere_int8x4_icudnn_int8x4_128x128_relu_small_c32_nn_v1 Tactic: 4325765560739862899
[12/29/2021-03:46:45] [V] [TRT] Tactic: 4325765560739862899 Time: 0.03036
[12/29/2021-03:46:45] [V] [TRT] Conv_11 + Relu_14 Set Tactic Name: ampere_int8x4_icudnn_int8x4_128x128_relu_medium_c32_nn_v1 Tactic: -4255737803793506479
[12/29/2021-03:46:45] [V] [TRT] Tactic: -4255737803793506479 Time: 0.031756
[12/29/2021-03:46:45] [V] [TRT] Conv_11 + Relu_14 Set Tactic Name: ampere_int8x4_icudnn_int8x4_128x32_relu_xregs_small_c32_nn_v1 Tactic: -3958182351168863467
[12/29/2021-03:46:45] [V] [TRT] Tactic: -3958182351168863467 Time: 0.020016
[12/29/2021-03:46:45] [V] [TRT] Conv_11 + Relu_14 Set Tactic Name: ampere_int8x4_icudnn_int8x4_128x32_relu_xregs_medium_c32_nn_v1 Tactic: -3111968753064955248
[12/29/2021-03:46:45] [V] [TRT] Tactic: -3111968753064955248 Time: 0.026456
[12/29/2021-03:46:45] [V] [TRT] Conv_11 + Relu_14 Set Tactic Name: ampere_int8x4_icudnn_int8x4_128x32_relu_medium_c32_nn_v1 Tactic: -1492575840277333548
[12/29/2021-03:46:45] [V] [TRT] Tactic: -1492575840277333548 Time: 0.02834
[12/29/2021-03:46:45] [V] [TRT] Conv_11 + Relu_14 Set Tactic Name: ampere_int8x4_icudnn_int8x4_128x64_relu_small_c32_nn_v1 Tactic: -868495160148524802
[12/29/2021-03:46:45] [V] [TRT] Tactic: -868495160148524802 Time: 0.02074
[12/29/2021-03:46:45] [V] [TRT] Fastest Tactic: -3958182351168863467 Time: 0.020016
[12/29/2021-03:46:45] [V] [TRT] >>>>>>>>>>>>>>> Chose Runner Type: CaskConvolution Tactic: -3958182351168863467
[12/29/2021-03:46:45] [V] [TRT] *************** Autotuning format combination: Int8(128,64:32,8,1) -> Float(128,64:32,8,1) ***************
[12/29/2021-03:46:45] [V] [TRT] --------------- Timing Runner: Conv_11 + Relu_14 (CaskConvolution)
[12/29/2021-03:46:45] [V] [TRT] Conv_11 + Relu_14 Set Tactic Name: sm80_xmma_fprop_implicit_gemm_interleaved_i8f32_i8i32_f32_nchw_vect_c_32kcrs_vect_c_32_nchw_vect_c_32_tilesize256x64x64_stage4_warpsize4x1x1_g1_tensor16x8x32_t1r3s3 Tactic: 1011019097971850911
[12/29/2021-03:46:45] [V] [TRT] Tactic: 1011019097971850911 Time: 0.0149
[12/29/2021-03:46:45] [V] [TRT] Conv_11 + Relu_14 Set Tactic Name: sm80_xmma_fprop_implicit_gemm_interleaved_i8f32_i8i32_f32_nchw_vect_c_32kcrs_vect_c_32_nchw_vect_c_32_tilesize64x128x64_stage6_warpsize2x2x1_g1_tensor16x8x32_t1r3s3 Tactic: 1071114551801767124
[12/29/2021-03:46:45] [V] [TRT] Tactic: 1071114551801767124 Time: 0.009632
[12/29/2021-03:46:45] [V] [TRT] Conv_11 + Relu_14 Set Tactic Name: sm80_xmma_fprop_implicit_gemm_interleaved_i8f32_i8i32_f32_nchw_vect_c_32kcrs_vect_c_32_nchw_vect_c_32_tilesize32x64x64_stage6_warpsize2x2x1_g1_tensor16x8x32 Tactic: 2623576043214044314
[12/29/2021-03:46:45] [V] [TRT] Tactic: 2623576043214044314 Time: 0.008932
[12/29/2021-03:46:45] [V] [TRT] Conv_11 + Relu_14 Set Tactic Name: sm80_xmma_fprop_implicit_gemm_interleaved_i8f32_i8i32_f32_nchw_vect_c_32kcrs_vect_c_32_nchw_vect_c_32_tilesize64x64x64_stage6_warpsize2x2x1_g1_tensor16x8x32_t1r3s3 Tactic: 3281631721811475881
[12/29/2021-03:46:45] [V] [TRT] Tactic: 3281631721811475881 Time: 0.008824
[12/29/2021-03:46:45] [V] [TRT] Conv_11 + Relu_14 Set Tactic Name: sm80_xmma_fprop_implicit_gemm_interleaved_i8f32_i8i32_f32_nchw_vect_c_32kcrs_vect_c_32_nchw_vect_c_32_tilesize64x32x64_stage6_warpsize2x1x1_g1_tensor16x8x32 Tactic: 4551754795416974366
[12/29/2021-03:46:45] [V] [TRT] Tactic: 4551754795416974366 Time: 0.008612
[12/29/2021-03:46:45] [V] [TRT] Conv_11 + Relu_14 Set Tactic Name: sm80_xmma_fprop_implicit_gemm_interleaved_i8f32_i8i32_f32_nchw_vect_c_32kcrs_vect_c_32_nchw_vect_c_32_tilesize32x32x64_stage6_warpsize2x1x1_g1_tensor16x8x32 Tactic: 4925112190271421402
[12/29/2021-03:46:45] [V] [TRT] Tactic: 4925112190271421402 Time: 0.009136
[12/29/2021-03:46:45] [V] [TRT] Conv_11 + Relu_14 Set Tactic Name: ampere_fp32_i8816cudnn_int8_256x128_ldg16_relu_medium_nt_v1 Tactic: 5012796702462679112
[12/29/2021-03:46:45] [V] [TRT] Tactic: 5012796702462679112 Time: 0.020356
[12/29/2021-03:46:45] [V] [TRT] Conv_11 + Relu_14 Set Tactic Name: sm80_xmma_fprop_implicit_gemm_interleaved_i8f32_i8i32_f32_nchw_vect_c_32kcrs_vect_c_32_nchw_vect_c_32_tilesize32x64x64_stage6_warpsize2x2x1_g1_tensor16x8x32_t1r3s3 Tactic: 5041593333398049019
[12/29/2021-03:46:45] [V] [TRT] Tactic: 5041593333398049019 Time: 0.008548
[12/29/2021-03:46:45] [V] [TRT] Conv_11 + Relu_14 Set Tactic Name: sm80_xmma_fprop_implicit_gemm_interleaved_i8f32_i8i32_f32_nchw_vect_c_32kcrs_vect_c_32_nchw_vect_c_32_tilesize256x128x64_stage4_warpsize4x2x1_g1_tensor16x8x32_t1r3s3 Tactic: 5166018662410176512
[12/29/2021-03:46:45] [V] [TRT] Tactic: 5166018662410176512 Time: 0.020776
[12/29/2021-03:46:45] [V] [TRT] Conv_11 + Relu_14 Set Tactic Name: sm80_xmma_fprop_implicit_gemm_interleaved_i8f32_i8i32_f32_nchw_vect_c_32kcrs_vect_c_32_nchw_vect_c_32_tilesize128x128x64_stage4_warpsize2x2x1_g1_tensor16x8x32_t1r3s3 Tactic: 6191867932654611882
[12/29/2021-03:46:45] [V] [TRT] Tactic: 6191867932654611882 Time: 0.0127
[12/29/2021-03:46:45] [V] [TRT] Conv_11 + Relu_14 Set Tactic Name: ampere_fp32_i8816cudnn_int8_128x128_ldg16_relu_medium_nt_v1 Tactic: 6556170942941957134
[12/29/2021-03:46:45] [V] [TRT] Tactic: 6556170942941957134 Time: 0.015104
[12/29/2021-03:46:45] [V] [TRT] Conv_11 + Relu_14 Set Tactic Name: sm80_xmma_fprop_implicit_gemm_interleaved_i8f32_i8i32_f32_nchw_vect_c_32kcrs_vect_c_32_nchw_vect_c_32_tilesize64x64x64_stage6_warpsize2x2x1_g1_tensor16x8x32 Tactic: 6852868042694587230
[12/29/2021-03:46:45] [V] [TRT] Tactic: 6852868042694587230 Time: 0.008924
[12/29/2021-03:46:45] [V] [TRT] Conv_11 + Relu_14 Set Tactic Name: sm80_xmma_fprop_implicit_gemm_interleaved_i8f32_i8i32_f32_nchw_vect_c_32kcrs_vect_c_32_nchw_vect_c_32_tilesize128x256x64_stage4_warpsize2x4x1_g1_tensor16x8x32 Tactic: 8399092794516815300
[12/29/2021-03:46:45] [V] [TRT] Tactic: 8399092794516815300 Time: 0.019324
[12/29/2021-03:46:45] [V] [TRT] Conv_11 + Relu_14 Set Tactic Name: sm80_xmma_fprop_implicit_gemm_interleaved_i8f32_i8i32_f32_nchw_vect_c_32kcrs_vect_c_32_nchw_vect_c_32_tilesize64x128x64_stage6_warpsize2x2x1_g1_tensor16x8x32 Tactic: -9132922677633967263
[12/29/2021-03:46:45] [V] [TRT] Tactic: -9132922677633967263 Time: 0.010044
[12/29/2021-03:46:45] [V] [TRT] Conv_11 + Relu_14 Set Tactic Name: ampere_fp32_i8816cudnn_int8_128x128_ldg16_relu_small_nt_v1 Tactic: -7988637803896331454
[12/29/2021-03:46:45] [V] [TRT] Tactic: -7988637803896331454 Time: 0.014228
[12/29/2021-03:46:45] [V] [TRT] Conv_11 + Relu_14 Set Tactic Name: ampere_fp32_i8816cudnn_int8_256x64_ldg16_relu_large_nt_v1 Tactic: -7865001268126363229
[12/29/2021-03:46:45] [V] [TRT] Tactic: -7865001268126363229 Time: 0.017008
[12/29/2021-03:46:45] [V] [TRT] Conv_11 + Relu_14 Set Tactic Name: ampere_fp32_i8816cudnn_int8_256x64_ldg16_relu_singleBuffer_small_nt_v1 Tactic: -7606074703023778034
[12/29/2021-03:46:45] [V] [TRT] Tactic: -7606074703023778034 Time: 0.014548
[12/29/2021-03:46:45] [V] [TRT] Conv_11 + Relu_14 Set Tactic Name: sm80_xmma_fprop_implicit_gemm_interleaved_i8f32_i8i32_f32_nchw_vect_c_32kcrs_vect_c_32_nchw_vect_c_32_tilesize256x64x64_stage4_warpsize4x1x1_g1_tensor16x8x32 Tactic: -7413564913826321357
[12/29/2021-03:46:45] [V] [TRT] Tactic: -7413564913826321357 Time: 0.015276
[12/29/2021-03:46:45] [V] [TRT] Conv_11 + Relu_14 Set Tactic Name: ampere_fp32_i8816cudnn_int8_256x128_ldg16_relu_small_nt_v1 Tactic: -7282232519526877434
[12/29/2021-03:46:45] [V] [TRT] Tactic: -7282232519526877434 Time: 0.01992
[12/29/2021-03:46:45] [V] [TRT] Conv_11 + Relu_14 Set Tactic Name: sm80_xmma_fprop_implicit_gemm_interleaved_i8f32_i8i32_f32_nchw_vect_c_32kcrs_vect_c_32_nchw_vect_c_32_tilesize128x64x64_stage6_warpsize2x2x1_g1_tensor16x8x32_t1r3s3 Tactic: -5942379529065248478
[12/29/2021-03:46:45] [V] [TRT] Tactic: -5942379529065248478 Time: 0.010392
[12/29/2021-03:46:45] [V] [TRT] Conv_11 + Relu_14 Set Tactic Name: ampere_fp32_i8816cudnn_int8_256x64_ldg16_relu_singleBuffer_medium_nt_v1 Tactic: -5603587790314027122
[12/29/2021-03:46:45] [V] [TRT] Tactic: -5603587790314027122 Time: 0.016268
[12/29/2021-03:46:45] [V] [TRT] Conv_11 + Relu_14 Set Tactic Name: sm80_xmma_fprop_implicit_gemm_interleaved_i8f32_i8i32_f32_nchw_vect_c_32kcrs_vect_c_32_nchw_vect_c_32_tilesize256x128x64_stage4_warpsize4x2x1_g1_tensor16x8x32 Tactic: -5334776871777565833
[12/29/2021-03:46:45] [V] [TRT] Tactic: -5334776871777565833 Time: 0.021348
[12/29/2021-03:46:45] [V] [TRT] Conv_11 + Relu_14 Set Tactic Name: sm80_xmma_fprop_implicit_gemm_interleaved_i8f32_i8i32_f32_nchw_vect_c_32kcrs_vect_c_32_nchw_vect_c_32_tilesize128x128x64_stage4_warpsize2x2x1_g1_tensor16x8x32 Tactic: -5157868397078537095
[12/29/2021-03:46:45] [V] [TRT] Tactic: -5157868397078537095 Time: 0.013308
[12/29/2021-03:46:45] [V] [TRT] Conv_11 + Relu_14 Set Tactic Name: sm80_xmma_fprop_implicit_gemm_interleaved_i8f32_i8i32_f32_nchw_vect_c_32kcrs_vect_c_32_nchw_vect_c_32_tilesize64x32x64_stage6_warpsize2x1x1_g1_tensor16x8x32_t1r3s3 Tactic: -5100834417027499764
[12/29/2021-03:46:45] [V] [TRT] Tactic: -5100834417027499764 Time: 0.008076
[12/29/2021-03:46:45] [V] [TRT] Conv_11 + Relu_14 Set Tactic Name: sm80_xmma_fprop_implicit_gemm_interleaved_i8f32_i8i32_f32_nchw_vect_c_32kcrs_vect_c_32_nchw_vect_c_32_tilesize32x32x64_stage6_warpsize2x1x1_g1_tensor16x8x32_t1r3s3 Tactic: -3365360067423513506
[12/29/2021-03:46:45] [V] [TRT] Tactic: -3365360067423513506 Time: 0.008444
[12/29/2021-03:46:45] [V] [TRT] Conv_11 + Relu_14 Set Tactic Name: ampere_fp32_i8816cudnn_int8_256x128_ldg16_relu_large_nt_v1 Tactic: -2194148180068068313
[12/29/2021-03:46:45] [V] [TRT] Tactic: -2194148180068068313 Time: 0.020432
[12/29/2021-03:46:45] [V] [TRT] Conv_11 + Relu_14 Set Tactic Name: sm80_xmma_fprop_implicit_gemm_interleaved_i8f32_i8i32_f32_nchw_vect_c_32kcrs_vect_c_32_nchw_vect_c_32_tilesize128x64x64_stage6_warpsize2x2x1_g1_tensor16x8x32 Tactic: -1782593837177056527
[12/29/2021-03:46:45] [V] [TRT] Tactic: -1782593837177056527 Time: 0.010752
[12/29/2021-03:46:45] [V] [TRT] Conv_11 + Relu_14 Set Tactic Name: ampere_fp32_i8816cudnn_int8_256x64_ldg16_relu_small_nt_v1 Tactic: -1610768292520086910
[12/29/2021-03:46:45] [V] [TRT] Tactic: -1610768292520086910 Time: 0.0153
[12/29/2021-03:46:45] [V] [TRT] Conv_11 + Relu_14 Set Tactic Name: sm80_xmma_fprop_implicit_gemm_interleaved_i8f32_i8i32_f32_nchw_vect_c_32kcrs_vect_c_32_nchw_vect_c_32_tilesize128x256x64_stage4_warpsize2x4x1_g1_tensor16x8x32_t1r3s3 Tactic: -1573035963956198975
[12/29/2021-03:46:45] [V] [TRT] Tactic: -1573035963956198975 Time: 0.018824
[12/29/2021-03:46:45] [V] [TRT] Conv_11 + Relu_14 Set Tactic Name: ampere_fp32_i8816cudnn_int8_128x128_ldg16_relu_large_nt_v1 Tactic: -1558762241666006941
[12/29/2021-03:46:45] [V] [TRT] Tactic: -1558762241666006941 Time: 0.015532
[12/29/2021-03:46:45] [V] [TRT] Conv_11 + Relu_14 Set Tactic Name: ampere_fp32_i8816cudnn_int8_256x64_ldg16_relu_singleBuffer_large_nt_v1 Tactic: -1365353082499976145
[12/29/2021-03:46:45] [V] [TRT] Tactic: -1365353082499976145 Time: 0.016732
[12/29/2021-03:46:45] [V] [TRT] Conv_11 + Relu_14 Set Tactic Name: ampere_fp32_i8816cudnn_int8_256x64_ldg16_relu_medium_nt_v1 Tactic: -621838502160440068
[12/29/2021-03:46:45] [V] [TRT] Tactic: -621838502160440068 Time: 0.016448
[12/29/2021-03:46:45] [V] [TRT] Fastest Tactic: -5100834417027499764 Time: 0.008076
[12/29/2021-03:46:45] [V] [TRT] >>>>>>>>>>>>>>> Chose Runner Type: CaskConvolution Tactic: -5100834417027499764
[12/29/2021-03:46:45] [V] [TRT] *************** Autotuning format combination: Int8(128,64:32,8,1) -> Int8(128,64:32,8,1) ***************
[12/29/2021-03:46:45] [V] [TRT] --------------- Timing Runner: Conv_11 + Relu_14 (CudaGroupConvolution)
[12/29/2021-03:46:45] [V] [TRT] CudaGroupConvolution has no valid tactics for this config, skipping
[12/29/2021-03:46:45] [V] [TRT] --------------- Timing Runner: Conv_11 + Relu_14 (CudaDepthwiseConvolution)
[12/29/2021-03:46:45] [V] [TRT] CudaDepthwiseConvolution has no valid tactics for this config, skipping
[12/29/2021-03:46:45] [V] [TRT] --------------- Timing Runner: Conv_11 + Relu_14 (FusedConvActConvolution)
[12/29/2021-03:46:45] [V] [TRT] FusedConvActConvolution has no valid tactics for this config, skipping
[12/29/2021-03:46:45] [V] [TRT] --------------- Timing Runner: Conv_11 + Relu_14 (CaskConvolution)
[12/29/2021-03:46:45] [V] [TRT] Conv_11 + Relu_14 Set Tactic Name: sm80_xmma_fprop_implicit_gemm_interleaved_i8i8_i8i32_f32_nchw_vect_c_32kcrs_vect_c_32_nchw_vect_c_32_tilesize64x32x64_stage6_warpsize2x1x1_g1_tensor16x8x32_epifadd Tactic: 177040020707947851
[12/29/2021-03:46:45] [V] [TRT] Tactic: 177040020707947851 Time: 0.008332
[12/29/2021-03:46:45] [V] [TRT] Conv_11 + Relu_14 Set Tactic Name: sm80_xmma_fprop_implicit_gemm_interleaved_i8i8_i8i32_f32_nchw_vect_c_32kcrs_vect_c_32_nchw_vect_c_32_tilesize32x64x64_stage6_warpsize2x2x1_g1_tensor16x8x32_epifadd Tactic: 1550399266192842845
[12/29/2021-03:46:45] [V] [TRT] Tactic: 1550399266192842845 Time: 0.008592
[12/29/2021-03:46:45] [V] [TRT] Conv_11 + Relu_14 Set Tactic Name: sm80_xmma_fprop_implicit_gemm_interleaved_i8i8_i8i32_f32_nchw_vect_c_32kcrs_vect_c_32_nchw_vect_c_32_tilesize256x32x64_stage4_warpsize4x1x1_g1_tensor16x8x32_t1r3s3_epifadd Tactic: 1572887561103143487
[12/29/2021-03:46:45] [V] [TRT] Tactic: 1572887561103143487 Time: 0.00966
[12/29/2021-03:46:45] [V] [TRT] Conv_11 + Relu_14 Set Tactic Name: sm80_xmma_fprop_implicit_gemm_interleaved_i8i8_i8i32_f32_nchw_vect_c_32kcrs_vect_c_32_nchw_vect_c_32_tilesize256x64x64_stage4_warpsize4x1x1_g1_tensor16x8x32 Tactic: 2325023763229477890
[12/29/2021-03:46:45] [V] [TRT] Tactic: 2325023763229477890 Time: 0.01298
[12/29/2021-03:46:45] [V] [TRT] Conv_11 + Relu_14 Set Tactic Name: ampere_int8_i8816cudnn_int8_128x128_ldg16_relu_medium_nt_v1 Tactic: 2985940154541537814
[12/29/2021-03:46:45] [V] [TRT] Tactic: 2985940154541537814 Time: 0.015164
[12/29/2021-03:46:45] [V] [TRT] Conv_11 + Relu_14 Set Tactic Name: sm80_xmma_fprop_implicit_gemm_interleaved_i8i8_i8i32_f32_nchw_vect_c_32kcrs_vect_c_32_nchw_vect_c_32_tilesize32x32x64_stage6_warpsize2x1x1_g1_tensor16x8x32_t1r3s3_epifadd Tactic: 3284282970967328046
[12/29/2021-03:46:45] [V] [TRT] Tactic: 3284282970967328046 Time: 0.00806
[12/29/2021-03:46:45] [V] [TRT] Conv_11 + Relu_14 Set Tactic Name: sm80_xmma_fprop_implicit_gemm_interleaved_i8i8_i8i32_f32_nchw_vect_c_32kcrs_vect_c_32_nchw_vect_c_32_tilesize64x32x64_stage6_warpsize2x1x1_g1_tensor16x8x32_t1r3s3 Tactic: 3401614690060226673
[12/29/2021-03:46:45] [V] [TRT] Tactic: 3401614690060226673 Time: 0.007876
[12/29/2021-03:46:45] [V] [TRT] Conv_11 + Relu_14 Set Tactic Name: sm80_xmma_fprop_implicit_gemm_interleaved_i8i8_i8i32_f32_nchw_vect_c_32kcrs_vect_c_32_nchw_vect_c_32_tilesize64x64x64_stage6_warpsize2x2x1_g1_tensor16x8x32_t1r3s3_epifadd Tactic: 3512426920013359699
[12/29/2021-03:46:45] [V] [TRT] Tactic: 3512426920013359699 Time: 0.007972
[12/29/2021-03:46:45] [V] [TRT] Conv_11 + Relu_14 Set Tactic Name: ampere_int8_i8816cudnn_int8_256x128_ldg16_relu_medium_nt_v1 Tactic: 3899284354987683408
[12/29/2021-03:46:45] [V] [TRT] Tactic: 3899284354987683408 Time: 0.020872
[12/29/2021-03:46:45] [V] [TRT] Conv_11 + Relu_14 Set Tactic Name: sm80_xmma_fprop_implicit_gemm_interleaved_i8i8_i8i32_f32_nchw_vect_c_32kcrs_vect_c_32_nchw_vect_c_32_tilesize64x128x64_stage6_warpsize2x2x1_g1_tensor16x8x32 Tactic: 4042202769383439184
[12/29/2021-03:46:45] [V] [TRT] Tactic: 4042202769383439184 Time: 0.009708
[12/29/2021-03:46:45] [V] [TRT] Conv_11 + Relu_14 Set Tactic Name: ampere_int8_i8816cudnn_int8_256x64_ldg16_relu_large_nt_v1 Tactic: 4182625619810185112
[12/29/2021-03:46:45] [V] [TRT] Tactic: 4182625619810185112 Time: 0.016916
[12/29/2021-03:46:45] [V] [TRT] Conv_11 + Relu_14 Set Tactic Name: sm80_xmma_fprop_implicit_gemm_interleaved_i8i8_i8i32_f32_nchw_vect_c_32kcrs_vect_c_32_nchw_vect_c_32_tilesize256x32x64_stage4_warpsize4x1x1_g1_tensor16x8x32_epifadd Tactic: 4259547356717612415
[12/29/2021-03:46:45] [V] [TRT] Tactic: 4259547356717612415 Time: 0.01016
[12/29/2021-03:46:45] [V] [TRT] Conv_11 + Relu_14 Set Tactic Name: ampere_int8_i8816cudnn_int8_256x64_ldg16_relu_small_nt_v1 Tactic: 4717285412741024953
[12/29/2021-03:46:45] [V] [TRT] Tactic: 4717285412741024953 Time: 0.015244
[12/29/2021-03:46:45] [V] [TRT] Conv_11 + Relu_14 Set Tactic Name: sm80_xmma_fprop_implicit_gemm_interleaved_i8i8_i8i32_f32_nchw_vect_c_32kcrs_vect_c_32_nchw_vect_c_32_tilesize128x256x64_stage4_warpsize2x4x1_g1_tensor16x8x32 Tactic: 4734519122557206480
[12/29/2021-03:46:45] [V] [TRT] Tactic: 4734519122557206480 Time: 0.018952
[12/29/2021-03:46:45] [V] [TRT] Conv_11 + Relu_14 Set Tactic Name: sm80_xmma_fprop_implicit_gemm_interleaved_i8i8_i8i32_f32_nchw_vect_c_32kcrs_vect_c_32_nchw_vect_c_32_tilesize128x256x64_stage4_warpsize2x4x1_g1_tensor16x8x32_epifadd Tactic: 5121596860264626879
[12/29/2021-03:46:45] [V] [TRT] Tactic: 5121596860264626879 Time: 0.019108
[12/29/2021-03:46:45] [V] [TRT] Conv_11 + Relu_14 Set Tactic Name: sm80_xmma_fprop_implicit_gemm_interleaved_i8i8_i8i32_f32_nchw_vect_c_32kcrs_vect_c_32_nchw_vect_c_32_tilesize32x32x64_stage6_warpsize2x1x1_g1_tensor16x8x32_t1r3s3 Tactic: 5136656982162849059
[12/29/2021-03:46:45] [V] [TRT] Tactic: 5136656982162849059 Time: 0.007988
[12/29/2021-03:46:45] [V] [TRT] Conv_11 + Relu_14 Set Tactic Name: sm80_xmma_fprop_implicit_gemm_interleaved_i8i8_i8i32_f32_nchw_vect_c_32kcrs_vect_c_32_nchw_vect_c_32_tilesize64x128x64_stage6_warpsize2x2x1_g1_tensor16x8x32_epifadd Tactic: 5158259316594207439
[12/29/2021-03:46:45] [V] [TRT] Tactic: 5158259316594207439 Time: 0.00972
[12/29/2021-03:46:45] [V] [TRT] Conv_11 + Relu_14 Set Tactic Name: sm80_xmma_fprop_implicit_gemm_interleaved_i8i8_i8i32_f32_nchw_vect_c_32kcrs_vect_c_32_nchw_vect_c_32_tilesize256x64x64_stage4_warpsize4x1x1_g1_tensor16x8x32_t1r3s3_epifadd Tactic: 5966973378912044513
[12/29/2021-03:46:45] [V] [TRT] Tactic: 5966973378912044513 Time: 0.012592
[12/29/2021-03:46:45] [V] [TRT] Conv_11 + Relu_14 Set Tactic Name: sm80_xmma_fprop_implicit_gemm_interleaved_i8i8_i8i32_f32_nchw_vect_c_32kcrs_vect_c_32_nchw_vect_c_32_tilesize256x32x64_stage4_warpsize4x1x1_g1_tensor16x8x32_t1r3s3 Tactic: 6004789655466615912
[12/29/2021-03:46:45] [V] [TRT] Tactic: 6004789655466615912 Time: 0.009684
[12/29/2021-03:46:45] [V] [TRT] Conv_11 + Relu_14 Set Tactic Name: sm80_xmma_fprop_implicit_gemm_interleaved_i8i8_i8i32_f32_nchw_vect_c_32kcrs_vect_c_32_nchw_vect_c_32_tilesize128x256x64_stage4_warpsize2x4x1_g1_tensor16x8x32_t1r3s3 Tactic: 6146901278630392829
[12/29/2021-03:46:45] [V] [TRT] Tactic: 6146901278630392829 Time: 0.018528
[12/29/2021-03:46:45] [V] [TRT] Conv_11 + Relu_14 Set Tactic Name: sm80_xmma_fprop_implicit_gemm_interleaved_i8i8_i8i32_f32_nchw_vect_c_32kcrs_vect_c_32_nchw_vect_c_32_tilesize256x128x64_stage4_warpsize4x2x1_g1_tensor16x8x32_epifadd Tactic: 6434020722187266170
[12/29/2021-03:46:45] [V] [TRT] Tactic: 6434020722187266170 Time: 0.019228
[12/29/2021-03:46:45] [V] [TRT] Conv_11 + Relu_14 Set Tactic Name: sm80_xmma_fprop_implicit_gemm_interleaved_i8i8_i8i32_f32_nchw_vect_c_32kcrs_vect_c_32_nchw_vect_c_32_tilesize128x64x64_stage6_warpsize2x2x1_g1_tensor16x8x32 Tactic: 6781129591847482048
[12/29/2021-03:46:45] [V] [TRT] Tactic: 6781129591847482048 Time: 0.009856
[12/29/2021-03:46:45] [V] [TRT] Conv_11 + Relu_14 Set Tactic Name: sm80_xmma_fprop_implicit_gemm_interleaved_i8i8_i8i32_f32_nchw_vect_c_32kcrs_vect_c_32_nchw_vect_c_32_tilesize32x64x64_stage6_warpsize2x2x1_g1_tensor16x8x32_t1r3s3_epifadd Tactic: 7191893591576074000
[12/29/2021-03:46:45] [V] [TRT] Tactic: 7191893591576074000 Time: 0.008292
[12/29/2021-03:46:45] [V] [TRT] Conv_11 + Relu_14 Set Tactic Name: sm80_xmma_fprop_implicit_gemm_interleaved_i8i8_i8i32_f32_nchw_vect_c_32kcrs_vect_c_32_nchw_vect_c_32_tilesize64x128x64_stage6_warpsize2x2x1_g1_tensor16x8x32_t1r3s3_epifadd Tactic: 7438984192263206338
[12/29/2021-03:46:45] [V] [TRT] Tactic: 7438984192263206338 Time: 0.009156
[12/29/2021-03:46:45] [V] [TRT] Conv_11 + Relu_14 Set Tactic Name: sm80_xmma_fprop_implicit_gemm_interleaved_i8i8_i8i32_f32_nchw_vect_c_32kcrs_vect_c_32_nchw_vect_c_32_tilesize128x128x64_stage4_warpsize2x2x1_g1_tensor16x8x32_epifadd Tactic: 7504901284678552178
[12/29/2021-03:46:45] [V] [TRT] Tactic: 7504901284678552178 Time: 0.0126
[12/29/2021-03:46:45] [V] [TRT] Conv_11 + Relu_14 Set Tactic Name: sm80_xmma_fprop_implicit_gemm_interleaved_i8i8_i8i32_f32_nchw_vect_c_32kcrs_vect_c_32_nchw_vect_c_32_tilesize128x64x64_stage6_warpsize2x2x1_g1_tensor16x8x32_t1r3s3 Tactic: 8096257414008860171
[12/29/2021-03:46:45] [V] [TRT] Tactic: 8096257414008860171 Time: 0.009428
[12/29/2021-03:46:45] [V] [TRT] Conv_11 + Relu_14 Set Tactic Name: sm80_xmma_fprop_implicit_gemm_interleaved_i8i8_i8i32_f32_nchw_vect_c_32kcrs_vect_c_32_nchw_vect_c_32_tilesize64x32x64_stage6_warpsize2x1x1_g1_tensor16x8x32_t1r3s3_epifadd Tactic: 9143438935315839085
[12/29/2021-03:46:45] [V] [TRT] Tactic: 9143438935315839085 Time: 0.007872
[12/29/2021-03:46:45] [V] [TRT] Conv_11 + Relu_14 Set Tactic Name: sm80_xmma_fprop_implicit_gemm_interleaved_i8i8_i8i32_f32_nchw_vect_c_32kcrs_vect_c_32_nchw_vect_c_32_tilesize256x128x64_stage4_warpsize4x2x1_g1_tensor16x8x32 Tactic: -9165697322068360861
[12/29/2021-03:46:45] [V] [TRT] Tactic: -9165697322068360861 Time: 0.01934
[12/29/2021-03:46:45] [V] [TRT] Conv_11 + Relu_14 Set Tactic Name: ampere_int8_i8816cudnn_int8_256x64_ldg16_relu_singleBuffer_small_nt_v1 Tactic: -9118785798277698619
[12/29/2021-03:46:45] [V] [TRT] Tactic: -9118785798277698619 Time: 0.014528
[12/29/2021-03:46:45] [V] [TRT] Conv_11 + Relu_14 Set Tactic Name: sm80_xmma_fprop_implicit_gemm_interleaved_i8i8_i8i32_f32_nchw_vect_c_32kcrs_vect_c_32_nchw_vect_c_32_tilesize128x128x64_stage4_warpsize2x2x1_g1_tensor16x8x32 Tactic: -8263994888336646547
[12/29/2021-03:46:45] [V] [TRT] Tactic: -8263994888336646547 Time: 0.012492
[12/29/2021-03:46:45] [V] [TRT] Conv_11 + Relu_14 Set Tactic Name: sm80_xmma_fprop_implicit_gemm_interleaved_i8i8_i8i32_f32_nchw_vect_c_32kcrs_vect_c_32_nchw_vect_c_32_tilesize32x64x64_stage6_warpsize2x2x1_g1_tensor16x8x32 Tactic: -8205948405243401049
[12/29/2021-03:46:45] [V] [TRT] Tactic: -8205948405243401049 Time: 0.008416
[12/29/2021-03:46:45] [V] [TRT] Conv_11 + Relu_14 Set Tactic Name: sm80_xmma_fprop_implicit_gemm_interleaved_i8i8_i8i32_f32_nchw_vect_c_32kcrs_vect_c_32_nchw_vect_c_32_tilesize128x64x64_stage6_warpsize2x2x1_g1_tensor16x8x32_t1r3s3_epifadd Tactic: -7992068592656168418
[12/29/2021-03:46:45] [V] [TRT] Tactic: -7992068592656168418 Time: 0.009248
[12/29/2021-03:46:45] [V] [TRT] Conv_11 + Relu_14 Set Tactic Name: sm80_xmma_fprop_implicit_gemm_interleaved_i8i8_i8i32_f32_nchw_vect_c_32kcrs_vect_c_32_nchw_vect_c_32_tilesize256x64x64_stage4_warpsize4x1x1_g1_tensor16x8x32_epifadd Tactic: -7842775553137511386
[12/29/2021-03:46:45] [V] [TRT] Tactic: -7842775553137511386 Time: 0.01296
[12/29/2021-03:46:45] [V] [TRT] Conv_11 + Relu_14 Set Tactic Name: sm80_xmma_fprop_implicit_gemm_interleaved_i8i8_i8i32_f32_nchw_vect_c_32kcrs_vect_c_32_nchw_vect_c_32_tilesize64x32x64_stage6_warpsize2x1x1_g1_tensor16x8x32 Tactic: -7683887278997527517
[12/29/2021-03:46:45] [V] [TRT] Tactic: -7683887278997527517 Time: 0.00846
[12/29/2021-03:46:45] [V] [TRT] Conv_11 + Relu_14 Set Tactic Name: ampere_int8_i8816cudnn_int8_128x128_ldg16_relu_small_nt_v1 Tactic: -6400348606759295499
[12/29/2021-03:46:45] [V] [TRT] Tactic: -6400348606759295499 Time: 0.014264
[12/29/2021-03:46:45] [V] [TRT] Conv_11 + Relu_14 Set Tactic Name: ampere_int8_i8816cudnn_int8_256x128_ldg16_relu_small_nt_v1 Tactic: -5980889159865208399
[12/29/2021-03:46:45] [V] [TRT] Tactic: -5980889159865208399 Time: 0.020552
[12/29/2021-03:46:45] [V] [TRT] Conv_11 + Relu_14 Set Tactic Name: ampere_int8_i8816cudnn_int8_256x64_ldg16_relu_singleBuffer_medium_nt_v1 Tactic: -5766140806760372989
[12/29/2021-03:46:45] [V] [TRT] Tactic: -5766140806760372989 Time: 0.01604
[12/29/2021-03:46:45] [V] [TRT] Conv_11 + Relu_14 Set Tactic Name: sm80_xmma_fprop_implicit_gemm_interleaved_i8i8_i8i32_f32_nchw_vect_c_32kcrs_vect_c_32_nchw_vect_c_32_tilesize128x128x64_stage4_warpsize2x2x1_g1_tensor16x8x32_t1r3s3_epifadd Tactic: -5709079507616090666
[12/29/2021-03:46:45] [V] [TRT] Tactic: -5709079507616090666 Time: 0.012276
[12/29/2021-03:46:45] [V] [TRT] Conv_11 + Relu_14 Set Tactic Name: sm80_xmma_fprop_implicit_gemm_interleaved_i8i8_i8i32_f32_nchw_vect_c_32kcrs_vect_c_32_nchw_vect_c_32_tilesize128x256x64_stage4_warpsize2x4x1_g1_tensor16x8x32_t1r3s3_epifadd Tactic: -5698636014239116282
[12/29/2021-03:46:45] [V] [TRT] Tactic: -5698636014239116282 Time: 0.018568
[12/29/2021-03:46:45] [V] [TRT] Conv_11 + Relu_14 Set Tactic Name: sm80_xmma_fprop_implicit_gemm_interleaved_i8i8_i8i32_f32_nchw_vect_c_32kcrs_vect_c_32_nchw_vect_c_32_tilesize64x64x64_stage6_warpsize2x2x1_g1_tensor16x8x32_t1r3s3 Tactic: -4933563390723451692
[12/29/2021-03:46:45] [V] [TRT] Tactic: -4933563390723451692 Time: 0.008064
