logs/standard.txt
[12/29/2021-03:40:11] [V] [TRT] *************** Autotuning Reformat:Float(3072,1024,32,1) -> Int8(3072,1024,32,1) ***************
[12/29/2021-03:40:11] [V] [TRT] --------------- Timing Runner: Optimizer Reformat (Reformat)
[12/29/2021-03:40:11] [V] [TRT] Setting a default quantization params because quantization data is missing for 
[12/29/2021-03:40:11] [V] [TRT] Tactic: 1002 Time: 0.039976
[12/29/2021-03:40:11] [V] [TRT] Setting a default quantization params because quantization data is missing for 
[12/29/2021-03:40:11] [V] [TRT] Tactic: 0 Time: 0.005552
[12/29/2021-03:40:11] [V] [TRT] Fastest Tactic: 0 Time: 0.005552
[12/29/2021-03:40:11] [V] [TRT] *************** Autotuning format combination: Int8(3072,1024,32,1) -> Int8(128,64:32,8,1) ***************
[12/29/2021-03:40:11] [V] [TRT] --------------- Timing Runner: Conv_2 + Relu_5 + MaxPool_8 (ConvActPool)
[12/29/2021-03:40:11] [V] [TRT] Tactic: 1000 Time: 0.014848
[12/29/2021-03:40:11] [V] [TRT] Tactic: 1100 Time: 0.01472
[12/29/2021-03:40:11] [V] [TRT] Tactic: 1110 Time: 0.015916
[12/29/2021-03:40:11] [V] [TRT] Tactic: 1111 Time: 0.014628
[12/29/2021-03:40:11] [V] [TRT] Tactic: 1112 Time: 0.018012
[12/29/2021-03:40:11] [V] [TRT] Tactic: 1120 Time: 0.016044
[12/29/2021-03:40:11] [V] [TRT] Tactic: 1121 Time: 0.014932
[12/29/2021-03:40:11] [V] [TRT] Tactic: 1122 Time: 0.01824
[12/29/2021-03:40:11] [V] [TRT] Tactic: 1130 Time: 0.015868
[12/29/2021-03:40:11] [V] [TRT] Tactic: 1131 Time: 0.014656
[12/29/2021-03:40:11] [V] [TRT] Tactic: 1132 Time: 0.018168
[12/29/2021-03:40:11] [V] [TRT] Tactic: 1140 Time: 0.016176
[12/29/2021-03:40:11] [V] [TRT] Tactic: 1141 Time: 0.014816
[12/29/2021-03:40:11] [V] [TRT] Tactic: 1142 Time: 0.018248
[12/29/2021-03:40:11] [V] [TRT] Fastest Tactic: 1111 Time: 0.014628
[12/29/2021-03:40:11] [V] [TRT] >>>>>>>>>>>>>>> Chose Runner Type: ConvActPool Tactic: 1111
[12/29/2021-03:40:11] [V] [TRT] *************** Autotuning Reformat:Int8(128,64:32,8,1) -> Float(4096,64,8,1) ***************
[12/29/2021-03:40:11] [V] [TRT] --------------- Timing Runner: Optimizer Reformat (Reformat)
[12/29/2021-03:40:11] [V] [TRT] Setting a default quantization params because quantization data is missing for 
[12/29/2021-03:40:11] [V] [TRT] Tactic: 1002 Time: 0.007824
[12/29/2021-03:40:11] [V] [TRT] Setting a default quantization params because quantization data is missing for 
[12/29/2021-03:40:11] [V] [TRT] Tactic: 0 Time: 0.00622
[12/29/2021-03:40:11] [V] [TRT] Fastest Tactic: 0 Time: 0.00622
[12/29/2021-03:40:11] [V] [TRT] *************** Autotuning Reformat:Int8(128,64:32,8,1) -> Float(4096,1,512,64) ***************
[12/29/2021-03:40:11] [V] [TRT] --------------- Timing Runner: Optimizer Reformat (Reformat)
[12/29/2021-03:40:11] [V] [TRT] Setting a default quantization params because quantization data is missing for 
[12/29/2021-03:40:11] [V] [TRT] Tactic: 1002 Time: 0.0077
[12/29/2021-03:40:11] [V] [TRT] Setting a default quantization params because quantization data is missing for 
[12/29/2021-03:40:11] [V] [TRT] Tactic: 0 Time: 0.00624
[12/29/2021-03:40:11] [V] [TRT] Fastest Tactic: 0 Time: 0.00624
[12/29/2021-03:40:11] [V] [TRT] *************** Autotuning Reformat:Int8(128,64:32,8,1) -> Float(1024,1:4,128,16) ***************
[12/29/2021-03:40:11] [V] [TRT] --------------- Timing Runner: Optimizer Reformat (Reformat)
[12/29/2021-03:40:11] [V] [TRT] Setting a default quantization params because quantization data is missing for 
[12/29/2021-03:40:11] [V] [TRT] Tactic: 1002 Time: 0.008676
[12/29/2021-03:40:11] [V] [TRT] Setting a default quantization params because quantization data is missing for 
[12/29/2021-03:40:11] [V] [TRT] Tactic: 0 Time: 0.006552
[12/29/2021-03:40:11] [V] [TRT] Fastest Tactic: 0 Time: 0.006552
[12/29/2021-03:40:11] [V] [TRT] *************** Autotuning Reformat:Int8(128,64:32,8,1) -> Float(128,64:32,8,1) ***************
[12/29/2021-03:40:11] [V] [TRT] --------------- Timing Runner: Optimizer Reformat (Reformat)
[12/29/2021-03:40:11] [V] [TRT] Setting a default quantization params because quantization data is missing for 
[12/29/2021-03:40:11] [V] [TRT] Tactic: 1002 Time: 0.008096
[12/29/2021-03:40:11] [V] [TRT] Setting a default quantization params because quantization data is missing for 
[12/29/2021-03:40:11] [V] [TRT] Tactic: 0 Time: 0.009852
[12/29/2021-03:40:11] [V] [TRT] Fastest Tactic: 1002 Time: 0.008096
[12/29/2021-03:40:11] [V] [TRT] *************** Autotuning Reformat:Int8(128,64:32,8,1) -> Int8(1024,64:4,8,1) ***************
[12/29/2021-03:40:11] [V] [TRT] --------------- Timing Runner: Optimizer Reformat (Reformat)
[12/29/2021-03:40:11] [V] [TRT] Setting a default quantization params because quantization data is missing for 
[12/29/2021-03:40:11] [V] [TRT] Tactic: 1002 Time: 0.00742
[12/29/2021-03:40:11] [V] [TRT] Setting a default quantization params because quantization data is missing for 
[12/29/2021-03:40:11] [V] [TRT] Tactic: 0 Time: 0.004968
[12/29/2021-03:40:11] [V] [TRT] Setting a default quantization params because quantization data is missing for 
[12/29/2021-03:40:11] [V] [TRT] Tactic: 1 Time: 0.0056
[12/29/2021-03:40:11] [V] [TRT] Fastest Tactic: 0 Time: 0.004968
[12/29/2021-03:40:11] [V] [TRT] *************** Autotuning Reformat:Float(4096,64,8,1) -> Float(4096,1,512,64) ***************
[12/29/2021-03:40:11] [V] [TRT] --------------- Timing Runner: Optimizer Reformat (Reformat)
[12/29/2021-03:40:11] [V] [TRT] Setting a default quantization params because quantization data is missing for 
[12/29/2021-03:40:11] [V] [TRT] Tactic: 1002 Time: 0.008564
[12/29/2021-03:40:11] [V] [TRT] Setting a default quantization params because quantization data is missing for 
[12/29/2021-03:40:11] [V] [TRT] Tactic: 0 Time: 0.006408
[12/29/2021-03:40:11] [V] [TRT] Fastest Tactic: 0 Time: 0.006408
[12/29/2021-03:40:11] [V] [TRT] *************** Autotuning Reformat:Float(4096,64,8,1) -> Float(1024,1:4,128,16) ***************
[12/29/2021-03:40:11] [V] [TRT] --------------- Timing Runner: Optimizer Reformat (Reformat)
[12/29/2021-03:40:11] [V] [TRT] Setting a default quantization params because quantization data is missing for 
[12/29/2021-03:40:11] [V] [TRT] Tactic: 1002 Time: 0.008532
[12/29/2021-03:40:11] [V] [TRT] Setting a default quantization params because quantization data is missing for 
[12/29/2021-03:40:11] [V] [TRT] Tactic: 0 Time: 0.00636
[12/29/2021-03:40:11] [V] [TRT] Fastest Tactic: 0 Time: 0.00636
[12/29/2021-03:40:11] [V] [TRT] *************** Autotuning Reformat:Float(4096,64,8,1) -> Int8(1024,64:4,8,1) ***************
[12/29/2021-03:40:11] [V] [TRT] --------------- Timing Runner: Optimizer Reformat (Reformat)
[12/29/2021-03:40:11] [V] [TRT] Setting a default quantization params because quantization data is missing for 
[12/29/2021-03:40:11] [V] [TRT] Tactic: 1002 Time: 0.007608
[12/29/2021-03:40:11] [V] [TRT] Setting a default quantization params because quantization data is missing for 
[12/29/2021-03:40:11] [V] [TRT] Tactic: 0 Time: 0.005104
[12/29/2021-03:40:11] [V] [TRT] Fastest Tactic: 0 Time: 0.005104
[12/29/2021-03:40:11] [V] [TRT] *************** Autotuning Reformat:Float(4096,64,8,1) -> Int8(128,64:32,8,1) ***************
[12/29/2021-03:40:11] [V] [TRT] --------------- Timing Runner: Optimizer Reformat (Reformat)
[12/29/2021-03:40:11] [V] [TRT] Setting a default quantization params because quantization data is missing for 
[12/29/2021-03:40:11] [V] [TRT] Tactic: 1002 Time: 0.007672
[12/29/2021-03:40:11] [V] [TRT] Setting a default quantization params because quantization data is missing for 
[12/29/2021-03:40:11] [V] [TRT] Tactic: 0 Time: 0.007712
[12/29/2021-03:40:11] [V] [TRT] Fastest Tactic: 1002 Time: 0.007672
[12/29/2021-03:40:11] [V] [TRT] *************** Autotuning Reformat:Float(4096,1,512,64) -> Float(4096,64,8,1) ***************
[12/29/2021-03:40:11] [V] [TRT] --------------- Timing Runner: Optimizer Reformat (Reformat)
[12/29/2021-03:40:11] [V] [TRT] Setting a default quantization params because quantization data is missing for 
[12/29/2021-03:40:11] [V] [TRT] Tactic: 1002 Time: 0.009048
[12/29/2021-03:40:11] [V] [TRT] Setting a default quantization params because quantization data is missing for 
[12/29/2021-03:40:11] [V] [TRT] Tactic: 0 Time: 0.006364
[12/29/2021-03:40:11] [V] [TRT] Fastest Tactic: 0 Time: 0.006364
[12/29/2021-03:40:11] [V] [TRT] *************** Autotuning Reformat:Float(4096,1,512,64) -> Float(1024,1:4,128,16) ***************
[12/29/2021-03:40:11] [V] [TRT] --------------- Timing Runner: Optimizer Reformat (Reformat)
[12/29/2021-03:40:11] [V] [TRT] Setting a default quantization params because quantization data is missing for 
[12/29/2021-03:40:11] [V] [TRT] Tactic: 1002 Time: 0.007632
[12/29/2021-03:40:11] [V] [TRT] Setting a default quantization params because quantization data is missing for 
[12/29/2021-03:40:11] [V] [TRT] Tactic: 0 Time: 0.00598
[12/29/2021-03:40:11] [V] [TRT] Fastest Tactic: 0 Time: 0.00598
[12/29/2021-03:40:11] [V] [TRT] *************** Autotuning Reformat:Float(4096,1,512,64) -> Int8(1024,64:4,8,1) ***************
[12/29/2021-03:40:11] [V] [TRT] --------------- Timing Runner: Optimizer Reformat (Reformat)
[12/29/2021-03:40:11] [V] [TRT] Setting a default quantization params because quantization data is missing for 
[12/29/2021-03:40:11] [V] [TRT] Tactic: 1002 Time: 0.00772
[12/29/2021-03:40:11] [V] [TRT] Setting a default quantization params because quantization data is missing for 
[12/29/2021-03:40:11] [V] [TRT] Tactic: 0 Time: 0.00666
[12/29/2021-03:40:11] [V] [TRT] Fastest Tactic: 0 Time: 0.00666
[12/29/2021-03:40:11] [V] [TRT] *************** Autotuning Reformat:Float(4096,1,512,64) -> Int8(128,64:32,8,1) ***************
[12/29/2021-03:40:11] [V] [TRT] --------------- Timing Runner: Optimizer Reformat (Reformat)
[12/29/2021-03:40:11] [V] [TRT] Setting a default quantization params because quantization data is missing for 
[12/29/2021-03:40:11] [V] [TRT] Tactic: 1002 Time: 0.007724
[12/29/2021-03:40:11] [V] [TRT] Setting a default quantization params because quantization data is missing for 
[12/29/2021-03:40:11] [V] [TRT] Tactic: 0 Time: 0.008404
[12/29/2021-03:40:11] [V] [TRT] Fastest Tactic: 1002 Time: 0.007724
[12/29/2021-03:40:11] [V] [TRT] *************** Autotuning Reformat:Float(1024,1:4,128,16) -> Float(4096,64,8,1) ***************
[12/29/2021-03:40:11] [V] [TRT] --------------- Timing Runner: Optimizer Reformat (Reformat)
[12/29/2021-03:40:11] [V] [TRT] Setting a default quantization params because quantization data is missing for 
[12/29/2021-03:40:11] [V] [TRT] Tactic: 1002 Time: 0.008916
[12/29/2021-03:40:11] [V] [TRT] Setting a default quantization params because quantization data is missing for 
[12/29/2021-03:40:11] [V] [TRT] Tactic: 0 Time: 0.006472
[12/29/2021-03:40:11] [V] [TRT] Fastest Tactic: 0 Time: 0.006472
[12/29/2021-03:40:11] [V] [TRT] *************** Autotuning Reformat:Float(1024,1:4,128,16) -> Float(4096,1,512,64) ***************
[12/29/2021-03:40:11] [V] [TRT] --------------- Timing Runner: Optimizer Reformat (Reformat)
[12/29/2021-03:40:11] [V] [TRT] Setting a default quantization params because quantization data is missing for 
[12/29/2021-03:40:11] [V] [TRT] Tactic: 1002 Time: 0.007604
[12/29/2021-03:40:11] [V] [TRT] Setting a default quantization params because quantization data is missing for 
[12/29/2021-03:40:11] [V] [TRT] Tactic: 0 Time: 0.006028
[12/29/2021-03:40:11] [V] [TRT] Fastest Tactic: 0 Time: 0.006028
[12/29/2021-03:40:11] [V] [TRT] *************** Autotuning Reformat:Float(1024,1:4,128,16) -> Int8(1024,64:4,8,1) ***************
[12/29/2021-03:40:11] [V] [TRT] --------------- Timing Runner: Optimizer Reformat (Reformat)
[12/29/2021-03:40:11] [V] [TRT] Setting a default quantization params because quantization data is missing for 
[12/29/2021-03:40:11] [V] [TRT] Tactic: 1002 Time: 0.008684
[12/29/2021-03:40:11] [V] [TRT] Setting a default quantization params because quantization data is missing for 
[12/29/2021-03:40:11] [V] [TRT] Tactic: 0 Time: 0.006704
[12/29/2021-03:40:11] [V] [TRT] Fastest Tactic: 0 Time: 0.006704
[12/29/2021-03:40:11] [V] [TRT] *************** Autotuning Reformat:Float(1024,1:4,128,16) -> Int8(128,64:32,8,1) ***************
[12/29/2021-03:40:11] [V] [TRT] --------------- Timing Runner: Optimizer Reformat (Reformat)
[12/29/2021-03:40:11] [V] [TRT] Setting a default quantization params because quantization data is missing for 
[12/29/2021-03:40:11] [V] [TRT] Tactic: 1002 Time: 0.00866
[12/29/2021-03:40:11] [V] [TRT] Setting a default quantization params because quantization data is missing for 
[12/29/2021-03:40:11] [V] [TRT] Tactic: 0 Time: 0.00818
[12/29/2021-03:40:11] [V] [TRT] Fastest Tactic: 0 Time: 0.00818
[12/29/2021-03:40:11] [V] [TRT] *************** Autotuning Reformat:Float(128,64:32,8,1) -> Float(4096,64,8,1) ***************
[12/29/2021-03:40:11] [V] [TRT] --------------- Timing Runner: Optimizer Reformat (Reformat)
[12/29/2021-03:40:11] [V] [TRT] Setting a default quantization params because quantization data is missing for 
[12/29/2021-03:40:11] [V] [TRT] Tactic: 1002 Time: 0.008788
[12/29/2021-03:40:11] [V] [TRT] Setting a default quantization params because quantization data is missing for 
[12/29/2021-03:40:11] [V] [TRT] Tactic: 0 Time: 0.006292
[12/29/2021-03:40:11] [V] [TRT] Fastest Tactic: 0 Time: 0.006292
[12/29/2021-03:40:11] [V] [TRT] *************** Autotuning Reformat:Float(128,64:32,8,1) -> Float(4096,1,512,64) ***************
[12/29/2021-03:40:11] [V] [TRT] --------------- Timing Runner: Optimizer Reformat (Reformat)
[12/29/2021-03:40:11] [V] [TRT] Setting a default quantization params because quantization data is missing for 
[12/29/2021-03:40:11] [V] [TRT] Tactic: 1002 Time: 0.008528
[12/29/2021-03:40:11] [V] [TRT] Setting a default quantization params because quantization data is missing for 
[12/29/2021-03:40:11] [V] [TRT] Tactic: 0 Time: 0.005884
[12/29/2021-03:40:11] [V] [TRT] Fastest Tactic: 0 Time: 0.005884
[12/29/2021-03:40:11] [V] [TRT] *************** Autotuning Reformat:Float(128,64:32,8,1) -> Float(1024,1:4,128,16) ***************
[12/29/2021-03:40:11] [V] [TRT] --------------- Timing Runner: Optimizer Reformat (Reformat)
[12/29/2021-03:40:11] [V] [TRT] Setting a default quantization params because quantization data is missing for 
[12/29/2021-03:40:11] [V] [TRT] Tactic: 1002 Time: 0.007476
[12/29/2021-03:40:11] [V] [TRT] Setting a default quantization params because quantization data is missing for 
[12/29/2021-03:40:11] [V] [TRT] Tactic: 0 Time: 0.006392
[12/29/2021-03:40:11] [V] [TRT] Fastest Tactic: 0 Time: 0.006392
[12/29/2021-03:40:11] [V] [TRT] *************** Autotuning Reformat:Float(128,64:32,8,1) -> Int8(1024,64:4,8,1) ***************
[12/29/2021-03:40:11] [V] [TRT] --------------- Timing Runner: Optimizer Reformat (Reformat)
[12/29/2021-03:40:11] [V] [TRT] Setting a default quantization params because quantization data is missing for 
[12/29/2021-03:40:11] [V] [TRT] Tactic: 1002 Time: 0.008056
[12/29/2021-03:40:11] [V] [TRT] Setting a default quantization params because quantization data is missing for 
[12/29/2021-03:40:11] [V] [TRT] Tactic: 0 Time: 0.006816
[12/29/2021-03:40:11] [V] [TRT] Fastest Tactic: 0 Time: 0.006816
[12/29/2021-03:40:11] [V] [TRT] *************** Autotuning Reformat:Float(128,64:32,8,1) -> Int8(128,64:32,8,1) ***************
[12/29/2021-03:40:11] [V] [TRT] --------------- Timing Runner: Optimizer Reformat (Reformat)
[12/29/2021-03:40:11] [V] [TRT] Setting a default quantization params because quantization data is missing for 
[12/29/2021-03:40:11] [V] [TRT] Tactic: 1002 Time: 0.008
[12/29/2021-03:40:11] [V] [TRT] Setting a default quantization params because quantization data is missing for 
[12/29/2021-03:40:11] [V] [TRT] Tactic: 0 Time: 0.008384
[12/29/2021-03:40:11] [V] [TRT] Fastest Tactic: 1002 Time: 0.008
[12/29/2021-03:40:11] [V] [TRT] *************** Autotuning Reformat:Int8(1024,64:4,8,1) -> Float(4096,64,8,1) ***************
[12/29/2021-03:40:11] [V] [TRT] --------------- Timing Runner: Optimizer Reformat (Reformat)
[12/29/2021-03:40:11] [V] [TRT] Setting a default quantization params because quantization data is missing for 
[12/29/2021-03:40:11] [V] [TRT] Tactic: 1002 Time: 0.008044
[12/29/2021-03:40:11] [V] [TRT] Setting a default quantization params because quantization data is missing for 
[12/29/2021-03:40:11] [V] [TRT] Tactic: 0 Time: 0.005428
[12/29/2021-03:40:11] [V] [TRT] Fastest Tactic: 0 Time: 0.005428
[12/29/2021-03:40:11] [V] [TRT] *************** Autotuning Reformat:Int8(1024,64:4,8,1) -> Float(4096,1,512,64) ***************
[12/29/2021-03:40:11] [V] [TRT] --------------- Timing Runner: Optimizer Reformat (Reformat)
[12/29/2021-03:40:11] [V] [TRT] Setting a default quantization params because quantization data is missing for 
[12/29/2021-03:40:11] [V] [TRT] Tactic: 1002 Time: 0.0084
[12/29/2021-03:40:11] [V] [TRT] Setting a default quantization params because quantization data is missing for 
[12/29/2021-03:40:11] [V] [TRT] Tactic: 0 Time: 0.006524
[12/29/2021-03:40:11] [V] [TRT] Fastest Tactic: 0 Time: 0.006524
[12/29/2021-03:40:11] [V] [TRT] *************** Autotuning Reformat:Int8(1024,64:4,8,1) -> Float(1024,1:4,128,16) ***************
[12/29/2021-03:40:11] [V] [TRT] --------------- Timing Runner: Optimizer Reformat (Reformat)
[12/29/2021-03:40:11] [V] [TRT] Setting a default quantization params because quantization data is missing for 
[12/29/2021-03:40:11] [V] [TRT] Tactic: 1002 Time: 0.00892
[12/29/2021-03:40:11] [V] [TRT] Setting a default quantization params because quantization data is missing for 
[12/29/2021-03:40:11] [V] [TRT] Tactic: 0 Time: 0.006876
[12/29/2021-03:40:11] [V] [TRT] Fastest Tactic: 0 Time: 0.006876
[12/29/2021-03:40:11] [V] [TRT] *************** Autotuning Reformat:Int8(1024,64:4,8,1) -> Int8(128,64:32,8,1) ***************
[12/29/2021-03:40:11] [V] [TRT] --------------- Timing Runner: Optimizer Reformat (Reformat)
[12/29/2021-03:40:11] [V] [TRT] Setting a default quantization params because quantization data is missing for 
[12/29/2021-03:40:11] [V] [TRT] Tactic: 1002 Time: 0.007552
[12/29/2021-03:40:11] [V] [TRT] Setting a default quantization params because quantization data is missing for 
[12/29/2021-03:40:11] [V] [TRT] Tactic: 0 Time: 0.005532
[12/29/2021-03:40:11] [V] [TRT] Fastest Tactic: 0 Time: 0.005532
[12/29/2021-03:40:11] [V] [TRT] *************** Autotuning Reformat:Int8(128,64:32,8,1) -> Float(4096,64,8,1) ***************
[12/29/2021-03:40:11] [V] [TRT] --------------- Timing Runner: Optimizer Reformat (Reformat)
[12/29/2021-03:40:11] [V] [TRT] Setting a default quantization params because quantization data is missing for 
[12/29/2021-03:40:11] [V] [TRT] Tactic: 1002 Time: 0.00798
[12/29/2021-03:40:11] [V] [TRT] Setting a default quantization params because quantization data is missing for 
[12/29/2021-03:40:11] [V] [TRT] Tactic: 0 Time: 0.006472
[12/29/2021-03:40:11] [V] [TRT] Fastest Tactic: 0 Time: 0.006472
[12/29/2021-03:40:11] [V] [TRT] *************** Autotuning Reformat:Int8(128,64:32,8,1) -> Float(4096,1,512,64) ***************
[12/29/2021-03:40:11] [V] [TRT] --------------- Timing Runner: Optimizer Reformat (Reformat)
[12/29/2021-03:40:11] [V] [TRT] Setting a default quantization params because quantization data is missing for 
[12/29/2021-03:40:11] [V] [TRT] Tactic: 1002 Time: 0.007848
[12/29/2021-03:40:11] [V] [TRT] Setting a default quantization params because quantization data is missing for 
[12/29/2021-03:40:11] [V] [TRT] Tactic: 0 Time: 0.006496
[12/29/2021-03:40:11] [V] [TRT] Fastest Tactic: 0 Time: 0.006496
[12/29/2021-03:40:11] [V] [TRT] *************** Autotuning Reformat:Int8(128,64:32,8,1) -> Float(1024,1:4,128,16) ***************
[12/29/2021-03:40:11] [V] [TRT] --------------- Timing Runner: Optimizer Reformat (Reformat)
[12/29/2021-03:40:11] [V] [TRT] Setting a default quantization params because quantization data is missing for 
[12/29/2021-03:40:11] [V] [TRT] Tactic: 1002 Time: 0.00906
[12/29/2021-03:40:11] [V] [TRT] Setting a default quantization params because quantization data is missing for 
[12/29/2021-03:40:11] [V] [TRT] Tactic: 0 Time: 0.006676
[12/29/2021-03:40:11] [V] [TRT] Fastest Tactic: 0 Time: 0.006676
[12/29/2021-03:40:11] [V] [TRT] *************** Autotuning Reformat:Int8(128,64:32,8,1) -> Int8(1024,64:4,8,1) ***************
[12/29/2021-03:40:11] [V] [TRT] --------------- Timing Runner: Optimizer Reformat (Reformat)
[12/29/2021-03:40:11] [V] [TRT] Setting a default quantization params because quantization data is missing for 
[12/29/2021-03:40:11] [V] [TRT] Tactic: 1002 Time: 0.007324
[12/29/2021-03:40:11] [V] [TRT] Setting a default quantization params because quantization data is missing for 
[12/29/2021-03:40:11] [V] [TRT] Tactic: 0 Time: 0.00506
[12/29/2021-03:40:11] [V] [TRT] Setting a default quantization params because quantization data is missing for 
[12/29/2021-03:40:11] [V] [TRT] Tactic: 1 Time: 0.005532
[12/29/2021-03:40:11] [V] [TRT] Fastest Tactic: 0 Time: 0.00506
[12/29/2021-03:40:11] [V] [TRT] *************** Autotuning format combination: Float(4096,64,8,1) -> Float(4096,64,8,1) ***************
[12/29/2021-03:40:11] [V] [TRT] --------------- Timing Runner: Conv_11 + Relu_14 (CudaDepthwiseConvolution)
[12/29/2021-03:40:11] [V] [TRT] CudaDepthwiseConvolution has no valid tactics for this config, skipping
[12/29/2021-03:40:11] [V] [TRT] --------------- Timing Runner: Conv_11 + Relu_14 (FusedConvActConvolution)
[12/29/2021-03:40:11] [V] [TRT] FusedConvActConvolution has no valid tactics for this config, skipping
[12/29/2021-03:40:12] [V] [TRT] --------------- Timing Runner: Conv_11 + Relu_14 (CudnnConvolution)
[12/29/2021-03:40:12] [V] [TRT] Tactic: 0 Time: 0.035868
[12/29/2021-03:40:12] [V] [TRT] Tactic: 1 Time: 0.085108
[12/29/2021-03:40:12] [V] [TRT] Tactic: 2 Time: 0.067956
[12/29/2021-03:40:12] [V] [TRT] Tactic: 4 Time: 0.047696
[12/29/2021-03:40:12] [V] [TRT] Tactic: 5 skipped. Scratch requested: 35651584, available: 16777216
[12/29/2021-03:40:12] [V] [TRT] Tactic: 6 Time: 0.0274
[12/29/2021-03:40:12] [V] [TRT] Tactic: 56 Time: 0.035764
[12/29/2021-03:40:12] [V] [TRT] Tactic: 57 Time: 0.086912
[12/29/2021-03:40:12] [V] [TRT] Tactic: 58 Time: 0.0681
[12/29/2021-03:40:12] [V] [TRT] Tactic: 60 Time: 0.048012
[12/29/2021-03:40:12] [V] [TRT] Tactic: 61 skipped. Scratch requested: 35651584, available: 16777216
[12/29/2021-03:40:12] [V] [TRT] Tactic: 62 Time: 0.027392
[12/29/2021-03:40:12] [V] [TRT] Tactic: 112 Time: 0.035876
[12/29/2021-03:40:12] [V] [TRT] Tactic: 113 Time: 0.247448
[12/29/2021-03:40:12] [V] [TRT] Tactic: 114 Time: 0.067976
[12/29/2021-03:40:12] [V] [TRT] Tactic: 116 Time: 0.047792
[12/29/2021-03:40:12] [V] [TRT] Tactic: 117 skipped. Scratch requested: 35651584, available: 16777216
[12/29/2021-03:40:12] [V] [TRT] Tactic: 118 Time: 0.027416
[12/29/2021-03:40:12] [I] [TRT] Some tactics do not have sufficient workspace memory to run. Increasing workspace size may increase performance, please check verbose output.
[12/29/2021-03:40:12] [V] [TRT] Fastest Tactic: 62 Time: 0.027392
[12/29/2021-03:40:12] [V] [TRT] --------------- Timing Runner: Conv_11 + Relu_14 (CaskConvolution)
[12/29/2021-03:40:12] [V] [TRT] Conv_11 + Relu_14 Set Tactic Name: ampere_scudnn_128x64_relu_small_nn_v1 Tactic: 4549827808004681195
[12/29/2021-03:40:12] [V] [TRT] Tactic: 4549827808004681195 Time: 0.063016
[12/29/2021-03:40:12] [V] [TRT] Conv_11 + Relu_14 Set Tactic Name: ampere_scudnn_128x128_relu_small_nn_v1 Tactic: 5779835512569528575
[12/29/2021-03:40:12] [V] [TRT] Tactic: 5779835512569528575 Time: 0.079764
[12/29/2021-03:40:12] [V] [TRT] Conv_11 + Relu_14 Set Tactic Name: ampere_scudnn_128x128_relu_xregs_large_nn_v1 Tactic: 6053873026024413720
[12/29/2021-03:40:12] [V] [TRT] Tactic: 6053873026024413720 Time: 0.089516
[12/29/2021-03:40:12] [V] [TRT] Conv_11 + Relu_14 Set Tactic Name: ampere_scudnn_128x64_relu_xregs_large_nn_v1 Tactic: 6767548733843469815
[12/29/2021-03:40:12] [V] [TRT] Tactic: 6767548733843469815 Time: 0.068348
[12/29/2021-03:40:12] [V] [TRT] Conv_11 + Relu_14 Set Tactic Name: ampere_scudnn_128x32_relu_small_nn_v1 Tactic: -6313876406580483184
[12/29/2021-03:40:12] [V] [TRT] Tactic: -6313876406580483184 Time: 0.075564
[12/29/2021-03:40:12] [V] [TRT] Conv_11 + Relu_14 Set Tactic Name: ampere_scudnn_128x128_relu_medium_nn_v1 Tactic: -1123676555321336786
[12/29/2021-03:40:12] [V] [TRT] Tactic: -1123676555321336786 Time: 0.087764
[12/29/2021-03:40:12] [V] [TRT] Conv_11 + Relu_14 Set Tactic Name: ampere_scudnn_128x64_relu_medium_nn_v1 Tactic: -701551393537224327
[12/29/2021-03:40:12] [V] [TRT] Tactic: -701551393537224327 Time: 0.07692
[12/29/2021-03:40:12] [V] [TRT] Fastest Tactic: 4549827808004681195 Time: 0.063016
[12/29/2021-03:40:12] [V] [TRT] >>>>>>>>>>>>>>> Chose Runner Type: CudnnConvolution Tactic: 62
[12/29/2021-03:40:12] [V] [TRT] *************** Autotuning format combination: Float(4096,1,512,64) -> Float(4096,1,512,64) ***************
[12/29/2021-03:40:12] [V] [TRT] --------------- Timing Runner: Conv_11 + Relu_14 (CudnnConvolution)
[12/29/2021-03:40:12] [V] [TRT] CudnnConvolution has no valid tactics for this config, skipping
[12/29/2021-03:40:12] [V] [TRT] --------------- Timing Runner: Conv_11 + Relu_14 (CaskConvolution)
[12/29/2021-03:40:12] [V] [TRT] Conv_11 + Relu_14 Set Tactic Name: ampere_scudnn_128x64_sliced1x2_ldg4_relu_exp_small_nhwc_tn_v1 Tactic: 2860655430572478466
[12/29/2021-03:40:12] [V] [TRT] Tactic: 2860655430572478466 Time: 0.04902
[12/29/2021-03:40:12] [V] [TRT] Conv_11 + Relu_14 Set Tactic Name: ampere_scudnn_128x32_sliced1x4_ldg4_relu_exp_medium_nhwc_tn_v1 Tactic: 4474630279712975759
[12/29/2021-03:40:12] [V] [TRT] Tactic: 4474630279712975759 Time: 0.030424
[12/29/2021-03:40:12] [V] [TRT] Conv_11 + Relu_14 Set Tactic Name: ampere_scudnn_128x32_sliced1x4_ldg4_relu_exp_small_nhwc_tn_v1 Tactic: 4479823862704990365
[12/29/2021-03:40:12] [V] [TRT] Tactic: 4479823862704990365 Time: 0.029668
[12/29/2021-03:40:12] [V] [TRT] Conv_11 + Relu_14 Set Tactic Name: ampere_scudnn_128x64_sliced1x2_ldg4_relu_exp_medium_nhwc_tn_v1 Tactic: 4696204239951173149
[12/29/2021-03:40:12] [V] [TRT] Tactic: 4696204239951173149 Time: 0.049668
[12/29/2021-03:40:12] [V] [TRT] Conv_11 + Relu_14 Set Tactic Name: ampere_scudnn_128x128_relu_exp_small_nhwc_tn_v1 Tactic: 5778138195697110003
[12/29/2021-03:40:12] [V] [TRT] Tactic: 5778138195697110003 Time: 0.078924
[12/29/2021-03:40:12] [V] [TRT] Conv_11 + Relu_14 Set Tactic Name: ampere_scudnn_128x128_ldg4_relu_exp_large_nhwc_tn_v1 Tactic: 7155825427510256858
[12/29/2021-03:40:12] [V] [TRT] Tactic: 7155825427510256858 Time: 0.079356
[12/29/2021-03:40:12] [V] [TRT] Conv_11 + Relu_14 Set Tactic Name: ampere_scudnn_128x128_ldg4_relu_exp_medium_nhwc_tn_v1 Tactic: 8918020581761223752
[12/29/2021-03:40:12] [V] [TRT] Tactic: 8918020581761223752 Time: 0.077804
[12/29/2021-03:40:12] [V] [TRT] Conv_11 + Relu_14 Set Tactic Name: ampere_scudnn_128x64_sliced1x2_ldg4_relu_exp_large_nhwc_tn_v1 Tactic: -4756382386362004279
[12/29/2021-03:40:12] [V] [TRT] Tactic: -4756382386362004279 Time: 0.049036
[12/29/2021-03:40:12] [V] [TRT] Conv_11 + Relu_14 Set Tactic Name: ampere_scudnn_128x128_relu_exp_large_nhwc_tn_v1 Tactic: -3855385237722507464
[12/29/2021-03:40:12] [V] [TRT] Tactic: -3855385237722507464 Time: 0.080508
[12/29/2021-03:40:12] [V] [TRT] Conv_11 + Relu_14 Set Tactic Name: ampere_scudnn_128x128_relu_exp_medium_nhwc_tn_v1 Tactic: -2809379259463049391
[12/29/2021-03:40:12] [V] [TRT] Tactic: -2809379259463049391 Time: 0.07904
[12/29/2021-03:40:12] [V] [TRT] Conv_11 + Relu_14 Set Tactic Name: ampere_scudnn_128x128_ldg4_relu_exp_small_nhwc_tn_v1 Tactic: -504296718212024303
[12/29/2021-03:40:12] [V] [TRT] Tactic: -504296718212024303 Time: 0.07678
[12/29/2021-03:40:12] [V] [TRT] Fastest Tactic: 4479823862704990365 Time: 0.029668
[12/29/2021-03:40:12] [V] [TRT] >>>>>>>>>>>>>>> Chose Runner Type: CaskConvolution Tactic: 4479823862704990365
[12/29/2021-03:40:12] [V] [TRT] *************** Autotuning format combination: Float(1024,1:4,128,16) -> Float(1024,1:4,128,16) ***************
[12/29/2021-03:40:12] [V] [TRT] --------------- Timing Runner: Conv_11 + Relu_14 (CudnnConvolution)
[12/29/2021-03:40:12] [V] [TRT] CudnnConvolution has no valid tactics for this config, skipping
[12/29/2021-03:40:12] [V] [TRT] --------------- Timing Runner: Conv_11 + Relu_14 (CaskConvolution)
[12/29/2021-03:40:12] [V] [TRT] Conv_11 + Relu_14 Set Tactic Name: ampere_scudnn_128x64_sliced1x2_ldg4_relu_exp_small_nhwc_tn_v1 Tactic: 2860655430572478466
[12/29/2021-03:40:12] [V] [TRT] Tactic: 2860655430572478466 Time: 0.049052
[12/29/2021-03:40:12] [V] [TRT] Conv_11 + Relu_14 Set Tactic Name: ampere_scudnn_128x32_sliced1x4_ldg4_relu_exp_medium_nhwc_tn_v1 Tactic: 4474630279712975759
[12/29/2021-03:40:12] [V] [TRT] Tactic: 4474630279712975759 Time: 0.030552
[12/29/2021-03:40:12] [V] [TRT] Conv_11 + Relu_14 Set Tactic Name: ampere_scudnn_128x32_sliced1x4_ldg4_relu_exp_small_nhwc_tn_v1 Tactic: 4479823862704990365
[12/29/2021-03:40:12] [V] [TRT] Tactic: 4479823862704990365 Time: 0.02974
[12/29/2021-03:40:12] [V] [TRT] Conv_11 + Relu_14 Set Tactic Name: ampere_scudnn_128x64_sliced1x2_ldg4_relu_exp_medium_nhwc_tn_v1 Tactic: 4696204239951173149
[12/29/2021-03:40:12] [V] [TRT] Tactic: 4696204239951173149 Time: 0.049784
[12/29/2021-03:40:12] [V] [TRT] Conv_11 + Relu_14 Set Tactic Name: ampere_scudnn_128x128_relu_exp_small_nhwc_tn_v1 Tactic: 5778138195697110003
[12/29/2021-03:40:12] [V] [TRT] Tactic: 5778138195697110003 Time: 0.079052
[12/29/2021-03:40:12] [V] [TRT] Conv_11 + Relu_14 Set Tactic Name: ampere_scudnn_128x128_ldg4_relu_exp_large_nhwc_tn_v1 Tactic: 7155825427510256858
[12/29/2021-03:40:12] [V] [TRT] Tactic: 7155825427510256858 Time: 0.079492
[12/29/2021-03:40:12] [V] [TRT] Conv_11 + Relu_14 Set Tactic Name: sm80_xmma_fprop_implicit_gemm_indexed_f32f32_tf32f32_f32_nhwckrsc_nhwc_tilesize128x128x16_stage4_warpsize2x2x1_g1_tensor16x8x8 Tactic: 7342025736444949634
[12/29/2021-03:40:12] [V] [TRT] Tactic: 7342025736444949634 Time: 0.054564
[12/29/2021-03:40:12] [V] [TRT] Conv_11 + Relu_14 Set Tactic Name: ampere_scudnn_128x128_ldg4_relu_exp_medium_nhwc_tn_v1 Tactic: 8918020581761223752
[12/29/2021-03:40:12] [V] [TRT] Tactic: 8918020581761223752 Time: 0.07786
[12/29/2021-03:40:12] [V] [TRT] Conv_11 + Relu_14 Set Tactic Name: sm80_xmma_fprop_implicit_gemm_f32f32_tf32f32_f32_nhwckrsc_nhwc_tilesize128x128x16_stage4_warpsize2x2x1_g1_tensor16x8x8_t1r3s3 Tactic: -7377458734869418330
[12/29/2021-03:40:12] [V] [TRT] Tactic: -7377458734869418330 Time: 0.053876
[12/29/2021-03:40:12] [V] [TRT] Conv_11 + Relu_14 Set Tactic Name: sm80_xmma_fprop_implicit_gemm_f32f32_tf32f32_f32_nhwckrsc_nhwc_tilesize128x128x16_stage4_warpsize2x2x1_g1_tensor16x8x8 Tactic: -5457304872213719461
[12/29/2021-03:40:12] [V] [TRT] Tactic: -5457304872213719461 Time: 0.054588
[12/29/2021-03:40:12] [V] [TRT] Conv_11 + Relu_14 Set Tactic Name: ampere_scudnn_128x64_sliced1x2_ldg4_relu_exp_large_nhwc_tn_v1 Tactic: -4756382386362004279
[12/29/2021-03:40:12] [V] [TRT] Tactic: -4756382386362004279 Time: 0.049212
[12/29/2021-03:40:12] [V] [TRT] Conv_11 + Relu_14 Set Tactic Name: ampere_scudnn_128x128_relu_exp_large_nhwc_tn_v1 Tactic: -3855385237722507464
[12/29/2021-03:40:12] [V] [TRT] Tactic: -3855385237722507464 Time: 0.080528
[12/29/2021-03:40:12] [V] [TRT] Conv_11 + Relu_14 Set Tactic Name: ampere_scudnn_128x128_relu_exp_medium_nhwc_tn_v1 Tactic: -2809379259463049391
[12/29/2021-03:40:12] [V] [TRT] Tactic: -2809379259463049391 Time: 0.079268
[12/29/2021-03:40:12] [V] [TRT] Conv_11 + Relu_14 Set Tactic Name: ampere_scudnn_128x128_ldg4_relu_exp_small_nhwc_tn_v1 Tactic: -504296718212024303
[12/29/2021-03:40:12] [V] [TRT] Tactic: -504296718212024303 Time: 0.076972
[12/29/2021-03:40:12] [V] [TRT] Fastest Tactic: 4479823862704990365 Time: 0.02974
[12/29/2021-03:40:12] [V] [TRT] >>>>>>>>>>>>>>> Chose Runner Type: CaskConvolution Tactic: 4479823862704990365
[12/29/2021-03:40:12] [V] [TRT] *************** Autotuning format combination: Int8(1024,64:4,8,1) -> Float(4096,64,8,1) ***************
[12/29/2021-03:40:12] [V] [TRT] --------------- Timing Runner: Conv_11 + Relu_14 (CudaDepthwiseConvolution)
[12/29/2021-03:40:12] [V] [TRT] CudaDepthwiseConvolution has no valid tactics for this config, skipping
[12/29/2021-03:40:12] [V] [TRT] --------------- Timing Runner: Conv_11 + Relu_14 (CaskConvolution)
[12/29/2021-03:40:12] [V] [TRT] Conv_11 + Relu_14 Set Tactic Name: ampere_fp32_icudnn_int8x4_128x128_relu_xregs_large_nn_v1 Tactic: 1332468635798226953
[12/29/2021-03:40:12] [V] [TRT] Tactic: 1332468635798226953 Time: 0.035148
[12/29/2021-03:40:12] [V] [TRT] Conv_11 + Relu_14 Set Tactic Name: ampere_fp32_icudnn_int8x4_128x128_relu_small_nn_v1 Tactic: 1508480131241957639
[12/29/2021-03:40:12] [V] [TRT] Tactic: 1508480131241957639 Time: 0.033272
[12/29/2021-03:40:12] [V] [TRT] Conv_11 + Relu_14 Set Tactic Name: ampere_fp32_icudnn_int8x4_128x64_relu_xregs_large_nn_v1 Tactic: 1947019689364377201
[12/29/2021-03:40:12] [V] [TRT] Tactic: 1947019689364377201 Time: 0.025264
[12/29/2021-03:40:12] [V] [TRT] Conv_11 + Relu_14 Set Tactic Name: ampere_fp32_icudnn_int8x4_128x128_relu_medium_nn_v1 Tactic: 3239257003214966313
[12/29/2021-03:40:12] [V] [TRT] Tactic: 3239257003214966313 Time: 0.034804
[12/29/2021-03:40:12] [V] [TRT] Conv_11 + Relu_14 Set Tactic Name: ampere_fp32_icudnn_int8x4_128x32_relu_xregs_small_nn_v1 Tactic: 5592640619112287921
[12/29/2021-03:40:12] [V] [TRT] Tactic: 5592640619112287921 Time: 0.022272
[12/29/2021-03:40:12] [V] [TRT] Conv_11 + Relu_14 Set Tactic Name: ampere_fp32_icudnn_int8x4_128x64_relu_small_nn_v1 Tactic: 7621465827583909090
[12/29/2021-03:40:12] [V] [TRT] Tactic: 7621465827583909090 Time: 0.023336
[12/29/2021-03:40:12] [V] [TRT] Conv_11 + Relu_14 Set Tactic Name: ampere_fp32_icudnn_int8x4_128x64_relu_medium_nn_v1 Tactic: -5576936487443445631
[12/29/2021-03:40:12] [V] [TRT] Tactic: -5576936487443445631 Time: 0.02698
[12/29/2021-03:40:12] [V] [TRT] Conv_11 + Relu_14 Set Tactic Name: ampere_fp32_icudnn_int8x4_128x32_relu_medium_nn_v1 Tactic: -2297737319934264721
[12/29/2021-03:40:12] [V] [TRT] Tactic: -2297737319934264721 Time: 0.03074
[12/29/2021-03:40:12] [V] [TRT] Conv_11 + Relu_14 Set Tactic Name: ampere_fp32_icudnn_int8x4_128x32_relu_xregs_medium_nn_v1 Tactic: -1425085658556684465
[12/29/2021-03:40:12] [V] [TRT] Tactic: -1425085658556684465 Time: 0.02902
[12/29/2021-03:40:12] [V] [TRT] Conv_11 + Relu_14 Set Tactic Name: ampere_fp32_icudnn_int8x4_128x32_relu_small_nn_v1 Tactic: -108011214168778087
[12/29/2021-03:40:12] [V] [TRT] Tactic: -108011214168778087 Time: 0.02608
[12/29/2021-03:40:12] [V] [TRT] Fastest Tactic: 5592640619112287921 Time: 0.022272
[12/29/2021-03:40:12] [V] [TRT] >>>>>>>>>>>>>>> Chose Runner Type: CaskConvolution Tactic: 5592640619112287921
[12/29/2021-03:40:12] [V] [TRT] *************** Autotuning format combination: Int8(1024,64:4,8,1) -> Int8(1024,64:4,8,1) ***************
[12/29/2021-03:40:12] [V] [TRT] --------------- Timing Runner: Conv_11 + Relu_14 (CudaDepthwiseConvolution)
[12/29/2021-03:40:12] [V] [TRT] CudaDepthwiseConvolution has no valid tactics for this config, skipping
[12/29/2021-03:40:12] [V] [TRT] --------------- Timing Runner: Conv_11 + Relu_14 (FusedConvActConvolution)
[12/29/2021-03:40:12] [V] [TRT] FusedConvActConvolution has no valid tactics for this config, skipping
[12/29/2021-03:40:12] [V] [TRT] --------------- Timing Runner: Conv_11 + Relu_14 (CaskConvolution)
[12/29/2021-03:40:12] [V] [TRT] Conv_11 + Relu_14 Set Tactic Name: ampere_int8x4_icudnn_int8x4_128x32_relu_medium_nn_v1 Tactic: 175853789719975416
[12/29/2021-03:40:12] [V] [TRT] Tactic: 175853789719975416 Time: 0.028812
[12/29/2021-03:40:12] [V] [TRT] Conv_11 + Relu_14 Set Tactic Name: ampere_int8x4_icudnn_int8x4_128x32_relu_xregs_medium_nn_v1 Tactic: 2171150287007712632
[12/29/2021-03:40:12] [V] [TRT] Tactic: 2171150287007712632 Time: 0.027084
[12/29/2021-03:40:12] [V] [TRT] Conv_11 + Relu_14 Set Tactic Name: ampere_int8x4_icudnn_int8x4_128x64_relu_small_nn_v1 Tactic: 2234457234705232274
[12/29/2021-03:40:12] [V] [TRT] Tactic: 2234457234705232274 Time: 0.021156
[12/29/2021-03:40:12] [V] [TRT] Conv_11 + Relu_14 Set Tactic Name: ampere_int8x4_icudnn_int8x4_128x64_relu_medium_nn_v1 Tactic: 5834048089706882838
[12/29/2021-03:40:12] [V] [TRT] Tactic: 5834048089706882838 Time: 0.024976
[12/29/2021-03:40:12] [V] [TRT] Conv_11 + Relu_14 Set Tactic Name: ampere_int8x4_icudnn_int8x4_128x32_relu_small_nn_v1 Tactic: -8626990807754934295
[12/29/2021-03:40:12] [V] [TRT] Tactic: -8626990807754934295 Time: 0.024148
[12/29/2021-03:40:12] [V] [TRT] Conv_11 + Relu_14 Set Tactic Name: ampere_int8x4_icudnn_int8x4_128x32_relu_xregs_small_nn_v1 Tactic: -7303593854972602201
[12/29/2021-03:40:12] [V] [TRT] Tactic: -7303593854972602201 Time: 0.02044
[12/29/2021-03:40:12] [V] [TRT] Conv_11 + Relu_14 Set Tactic Name: ampere_int8x4_icudnn_int8x4_128x128_relu_medium_nn_v1 Tactic: -6585664687867083638
[12/29/2021-03:40:12] [V] [TRT] Tactic: -6585664687867083638 Time: 0.03232
[12/29/2021-03:40:12] [V] [TRT] Conv_11 + Relu_14 Set Tactic Name: ampere_int8x4_icudnn_int8x4_128x64_relu_xregs_large_nn_v1 Tactic: -3730012925709297561
[12/29/2021-03:40:12] [V] [TRT] Tactic: -3730012925709297561 Time: 0.022932
[12/29/2021-03:40:12] [V] [TRT] Conv_11 + Relu_14 Set Tactic Name: ampere_int8x4_icudnn_int8x4_128x128_relu_xregs_large_nn_v1 Tactic: -2277259417488004546
[12/29/2021-03:40:12] [V] [TRT] Tactic: -2277259417488004546 Time: 0.032556
[12/29/2021-03:40:12] [V] [TRT] Conv_11 + Relu_14 Set Tactic Name: ampere_int8x4_icudnn_int8x4_128x128_relu_small_nn_v1 Tactic: -683636008127039856
[12/29/2021-03:40:12] [V] [TRT] Tactic: -683636008127039856 Time: 0.030524
[12/29/2021-03:40:12] [V] [TRT] Fastest Tactic: -7303593854972602201 Time: 0.02044
[12/29/2021-03:40:12] [V] [TRT] >>>>>>>>>>>>>>> Chose Runner Type: CaskConvolution Tactic: -7303593854972602201
[12/29/2021-03:40:12] [V] [TRT] *************** Autotuning format combination: Int8(1024,64:4,8,1) -> Int8(128,64:32,8,1) ***************
[12/29/2021-03:40:12] [V] [TRT] --------------- Timing Runner: Conv_11 + Relu_14 (CaskConvolution)
[12/29/2021-03:40:12] [V] [TRT] Conv_11 + Relu_14 Set Tactic Name: ampere_int8x4_icudnn_int8x4_128x64_relu_xregs_large_c32_nn_v1 Tactic: 984309058095623735
[12/29/2021-03:40:12] [V] [TRT] Tactic: 984309058095623735 Time: 0.02274
[12/29/2021-03:40:12] [V] [TRT] Conv_11 + Relu_14 Set Tactic Name: ampere_int8x4_icudnn_int8x4_128x32_relu_small_c32_nn_v1 Tactic: 1100922622480907544
[12/29/2021-03:40:12] [V] [TRT] Tactic: 1100922622480907544 Time: 0.023592
[12/29/2021-03:40:12] [V] [TRT] Conv_11 + Relu_14 Set Tactic Name: ampere_int8x4_icudnn_int8x4_128x128_relu_xregs_large_c32_nn_v1 Tactic: 3238312825609165543
[12/29/2021-03:40:12] [V] [TRT] Tactic: 3238312825609165543 Time: 0.03212
[12/29/2021-03:40:12] [V] [TRT] Conv_11 + Relu_14 Set Tactic Name: ampere_int8x4_icudnn_int8x4_128x64_relu_medium_c32_nn_v1 Tactic: 3606311198834416176
[12/29/2021-03:40:12] [V] [TRT] Tactic: 3606311198834416176 Time: 0.024516
[12/29/2021-03:40:12] [V] [TRT] Conv_11 + Relu_14 Set Tactic Name: ampere_int8x4_icudnn_int8x4_128x128_relu_small_c32_nn_v1 Tactic: 4325765560739862899
[12/29/2021-03:40:12] [V] [TRT] Tactic: 4325765560739862899 Time: 0.030344
[12/29/2021-03:40:12] [V] [TRT] Conv_11 + Relu_14 Set Tactic Name: ampere_int8x4_icudnn_int8x4_128x128_relu_medium_c32_nn_v1 Tactic: -4255737803793506479
[12/29/2021-03:40:12] [V] [TRT] Tactic: -4255737803793506479 Time: 0.031904
[12/29/2021-03:40:12] [V] [TRT] Conv_11 + Relu_14 Set Tactic Name: ampere_int8x4_icudnn_int8x4_128x32_relu_xregs_small_c32_nn_v1 Tactic: -3958182351168863467
[12/29/2021-03:40:12] [V] [TRT] Tactic: -3958182351168863467 Time: 0.020088
[12/29/2021-03:40:12] [V] [TRT] Conv_11 + Relu_14 Set Tactic Name: ampere_int8x4_icudnn_int8x4_128x32_relu_xregs_medium_c32_nn_v1 Tactic: -3111968753064955248
[12/29/2021-03:40:12] [V] [TRT] Tactic: -3111968753064955248 Time: 0.02654
[12/29/2021-03:40:12] [V] [TRT] Conv_11 + Relu_14 Set Tactic Name: ampere_int8x4_icudnn_int8x4_128x32_relu_medium_c32_nn_v1 Tactic: -1492575840277333548
[12/29/2021-03:40:12] [V] [TRT] Tactic: -1492575840277333548 Time: 0.02832
[12/29/2021-03:40:12] [V] [TRT] Conv_11 + Relu_14 Set Tactic Name: ampere_int8x4_icudnn_int8x4_128x64_relu_small_c32_nn_v1 Tactic: -868495160148524802
[12/29/2021-03:40:12] [V] [TRT] Tactic: -868495160148524802 Time: 0.020816
[12/29/2021-03:40:12] [V] [TRT] Fastest Tactic: -3958182351168863467 Time: 0.020088
[12/29/2021-03:40:12] [V] [TRT] >>>>>>>>>>>>>>> Chose Runner Type: CaskConvolution Tactic: -3958182351168863467
[12/29/2021-03:40:12] [V] [TRT] *************** Autotuning format combination: Int8(128,64:32,8,1) -> Float(128,64:32,8,1) ***************
[12/29/2021-03:40:12] [V] [TRT] --------------- Timing Runner: Conv_11 + Relu_14 (CaskConvolution)
[12/29/2021-03:40:12] [V] [TRT] Conv_11 + Relu_14 Set Tactic Name: sm80_xmma_fprop_implicit_gemm_interleaved_i8f32_i8i32_f32_nchw_vect_c_32kcrs_vect_c_32_nchw_vect_c_32_tilesize256x64x64_stage4_warpsize4x1x1_g1_tensor16x8x32_t1r3s3 Tactic: 1011019097971850911
[12/29/2021-03:40:12] [V] [TRT] Tactic: 1011019097971850911 Time: 0.015024
[12/29/2021-03:40:12] [V] [TRT] Conv_11 + Relu_14 Set Tactic Name: sm80_xmma_fprop_implicit_gemm_interleaved_i8f32_i8i32_f32_nchw_vect_c_32kcrs_vect_c_32_nchw_vect_c_32_tilesize64x128x64_stage6_warpsize2x2x1_g1_tensor16x8x32_t1r3s3 Tactic: 1071114551801767124
[12/29/2021-03:40:12] [V] [TRT] Tactic: 1071114551801767124 Time: 0.00984
[12/29/2021-03:40:12] [V] [TRT] Conv_11 + Relu_14 Set Tactic Name: sm80_xmma_fprop_implicit_gemm_interleaved_i8f32_i8i32_f32_nchw_vect_c_32kcrs_vect_c_32_nchw_vect_c_32_tilesize32x64x64_stage6_warpsize2x2x1_g1_tensor16x8x32 Tactic: 2623576043214044314
[12/29/2021-03:40:12] [V] [TRT] Tactic: 2623576043214044314 Time: 0.009068
[12/29/2021-03:40:12] [V] [TRT] Conv_11 + Relu_14 Set Tactic Name: sm80_xmma_fprop_implicit_gemm_interleaved_i8f32_i8i32_f32_nchw_vect_c_32kcrs_vect_c_32_nchw_vect_c_32_tilesize64x64x64_stage6_warpsize2x2x1_g1_tensor16x8x32_t1r3s3 Tactic: 3281631721811475881
[12/29/2021-03:40:12] [V] [TRT] Tactic: 3281631721811475881 Time: 0.008796
[12/29/2021-03:40:12] [V] [TRT] Conv_11 + Relu_14 Set Tactic Name: sm80_xmma_fprop_implicit_gemm_interleaved_i8f32_i8i32_f32_nchw_vect_c_32kcrs_vect_c_32_nchw_vect_c_32_tilesize64x32x64_stage6_warpsize2x1x1_g1_tensor16x8x32 Tactic: 4551754795416974366
[12/29/2021-03:40:12] [V] [TRT] Tactic: 4551754795416974366 Time: 0.008624
[12/29/2021-03:40:12] [V] [TRT] Conv_11 + Relu_14 Set Tactic Name: sm80_xmma_fprop_implicit_gemm_interleaved_i8f32_i8i32_f32_nchw_vect_c_32kcrs_vect_c_32_nchw_vect_c_32_tilesize32x32x64_stage6_warpsize2x1x1_g1_tensor16x8x32 Tactic: 4925112190271421402
[12/29/2021-03:40:12] [V] [TRT] Tactic: 4925112190271421402 Time: 0.00916
[12/29/2021-03:40:12] [V] [TRT] Conv_11 + Relu_14 Set Tactic Name: ampere_fp32_i8816cudnn_int8_256x128_ldg16_relu_medium_nt_v1 Tactic: 5012796702462679112
[12/29/2021-03:40:12] [V] [TRT] Tactic: 5012796702462679112 Time: 0.02044
[12/29/2021-03:40:12] [V] [TRT] Conv_11 + Relu_14 Set Tactic Name: sm80_xmma_fprop_implicit_gemm_interleaved_i8f32_i8i32_f32_nchw_vect_c_32kcrs_vect_c_32_nchw_vect_c_32_tilesize32x64x64_stage6_warpsize2x2x1_g1_tensor16x8x32_t1r3s3 Tactic: 5041593333398049019
[12/29/2021-03:40:12] [V] [TRT] Tactic: 5041593333398049019 Time: 0.008524
[12/29/2021-03:40:12] [V] [TRT] Conv_11 + Relu_14 Set Tactic Name: sm80_xmma_fprop_implicit_gemm_interleaved_i8f32_i8i32_f32_nchw_vect_c_32kcrs_vect_c_32_nchw_vect_c_32_tilesize256x128x64_stage4_warpsize4x2x1_g1_tensor16x8x32_t1r3s3 Tactic: 5166018662410176512
[12/29/2021-03:40:12] [V] [TRT] Tactic: 5166018662410176512 Time: 0.02084
[12/29/2021-03:40:12] [V] [TRT] Conv_11 + Relu_14 Set Tactic Name: sm80_xmma_fprop_implicit_gemm_interleaved_i8f32_i8i32_f32_nchw_vect_c_32kcrs_vect_c_32_nchw_vect_c_32_tilesize128x128x64_stage4_warpsize2x2x1_g1_tensor16x8x32_t1r3s3 Tactic: 6191867932654611882
[12/29/2021-03:40:12] [V] [TRT] Tactic: 6191867932654611882 Time: 0.012752
[12/29/2021-03:40:12] [V] [TRT] Conv_11 + Relu_14 Set Tactic Name: ampere_fp32_i8816cudnn_int8_128x128_ldg16_relu_medium_nt_v1 Tactic: 6556170942941957134
[12/29/2021-03:40:13] [V] [TRT] Tactic: 6556170942941957134 Time: 0.015068
[12/29/2021-03:40:13] [V] [TRT] Conv_11 + Relu_14 Set Tactic Name: sm80_xmma_fprop_implicit_gemm_interleaved_i8f32_i8i32_f32_nchw_vect_c_32kcrs_vect_c_32_nchw_vect_c_32_tilesize64x64x64_stage6_warpsize2x2x1_g1_tensor16x8x32 Tactic: 6852868042694587230
[12/29/2021-03:40:13] [V] [TRT] Tactic: 6852868042694587230 Time: 0.008848
[12/29/2021-03:40:13] [V] [TRT] Conv_11 + Relu_14 Set Tactic Name: sm80_xmma_fprop_implicit_gemm_interleaved_i8f32_i8i32_f32_nchw_vect_c_32kcrs_vect_c_32_nchw_vect_c_32_tilesize128x256x64_stage4_warpsize2x4x1_g1_tensor16x8x32 Tactic: 8399092794516815300
[12/29/2021-03:40:13] [V] [TRT] Tactic: 8399092794516815300 Time: 0.019156
[12/29/2021-03:40:13] [V] [TRT] Conv_11 + Relu_14 Set Tactic Name: sm80_xmma_fprop_implicit_gemm_interleaved_i8f32_i8i32_f32_nchw_vect_c_32kcrs_vect_c_32_nchw_vect_c_32_tilesize64x128x64_stage6_warpsize2x2x1_g1_tensor16x8x32 Tactic: -9132922677633967263
[12/29/2021-03:40:13] [V] [TRT] Tactic: -9132922677633967263 Time: 0.010036
[12/29/2021-03:40:13] [V] [TRT] Conv_11 + Relu_14 Set Tactic Name: ampere_fp32_i8816cudnn_int8_128x128_ldg16_relu_small_nt_v1 Tactic: -7988637803896331454
[12/29/2021-03:40:13] [V] [TRT] Tactic: -7988637803896331454 Time: 0.014308
[12/29/2021-03:40:13] [V] [TRT] Conv_11 + Relu_14 Set Tactic Name: ampere_fp32_i8816cudnn_int8_256x64_ldg16_relu_large_nt_v1 Tactic: -7865001268126363229
[12/29/2021-03:40:13] [V] [TRT] Tactic: -7865001268126363229 Time: 0.017036
[12/29/2021-03:40:13] [V] [TRT] Conv_11 + Relu_14 Set Tactic Name: ampere_fp32_i8816cudnn_int8_256x64_ldg16_relu_singleBuffer_small_nt_v1 Tactic: -7606074703023778034
[12/29/2021-03:40:13] [V] [TRT] Tactic: -7606074703023778034 Time: 0.01466
[12/29/2021-03:40:13] [V] [TRT] Conv_11 + Relu_14 Set Tactic Name: sm80_xmma_fprop_implicit_gemm_interleaved_i8f32_i8i32_f32_nchw_vect_c_32kcrs_vect_c_32_nchw_vect_c_32_tilesize256x64x64_stage4_warpsize4x1x1_g1_tensor16x8x32 Tactic: -7413564913826321357
[12/29/2021-03:40:13] [V] [TRT] Tactic: -7413564913826321357 Time: 0.015248
[12/29/2021-03:40:13] [V] [TRT] Conv_11 + Relu_14 Set Tactic Name: ampere_fp32_i8816cudnn_int8_256x128_ldg16_relu_small_nt_v1 Tactic: -7282232519526877434
[12/29/2021-03:40:13] [V] [TRT] Tactic: -7282232519526877434 Time: 0.020116
[12/29/2021-03:40:13] [V] [TRT] Conv_11 + Relu_14 Set Tactic Name: sm80_xmma_fprop_implicit_gemm_interleaved_i8f32_i8i32_f32_nchw_vect_c_32kcrs_vect_c_32_nchw_vect_c_32_tilesize128x64x64_stage6_warpsize2x2x1_g1_tensor16x8x32_t1r3s3 Tactic: -5942379529065248478
[12/29/2021-03:40:13] [V] [TRT] Tactic: -5942379529065248478 Time: 0.01042
[12/29/2021-03:40:13] [V] [TRT] Conv_11 + Relu_14 Set Tactic Name: ampere_fp32_i8816cudnn_int8_256x64_ldg16_relu_singleBuffer_medium_nt_v1 Tactic: -5603587790314027122
[12/29/2021-03:40:13] [V] [TRT] Tactic: -5603587790314027122 Time: 0.016196
[12/29/2021-03:40:13] [V] [TRT] Conv_11 + Relu_14 Set Tactic Name: sm80_xmma_fprop_implicit_gemm_interleaved_i8f32_i8i32_f32_nchw_vect_c_32kcrs_vect_c_32_nchw_vect_c_32_tilesize256x128x64_stage4_warpsize4x2x1_g1_tensor16x8x32 Tactic: -5334776871777565833
[12/29/2021-03:40:13] [V] [TRT] Tactic: -5334776871777565833 Time: 0.021312
[12/29/2021-03:40:13] [V] [TRT] Conv_11 + Relu_14 Set Tactic Name: sm80_xmma_fprop_implicit_gemm_interleaved_i8f32_i8i32_f32_nchw_vect_c_32kcrs_vect_c_32_nchw_vect_c_32_tilesize128x128x64_stage4_warpsize2x2x1_g1_tensor16x8x32 Tactic: -5157868397078537095
[12/29/2021-03:40:13] [V] [TRT] Tactic: -5157868397078537095 Time: 0.013204
[12/29/2021-03:40:13] [V] [TRT] Conv_11 + Relu_14 Set Tactic Name: sm80_xmma_fprop_implicit_gemm_interleaved_i8f32_i8i32_f32_nchw_vect_c_32kcrs_vect_c_32_nchw_vect_c_32_tilesize64x32x64_stage6_warpsize2x1x1_g1_tensor16x8x32_t1r3s3 Tactic: -5100834417027499764
[12/29/2021-03:40:13] [V] [TRT] Tactic: -5100834417027499764 Time: 0.008228
[12/29/2021-03:40:13] [V] [TRT] Conv_11 + Relu_14 Set Tactic Name: sm80_xmma_fprop_implicit_gemm_interleaved_i8f32_i8i32_f32_nchw_vect_c_32kcrs_vect_c_32_nchw_vect_c_32_tilesize32x32x64_stage6_warpsize2x1x1_g1_tensor16x8x32_t1r3s3 Tactic: -3365360067423513506
[12/29/2021-03:40:13] [V] [TRT] Tactic: -3365360067423513506 Time: 0.0086
[12/29/2021-03:40:13] [V] [TRT] Conv_11 + Relu_14 Set Tactic Name: ampere_fp32_i8816cudnn_int8_256x128_ldg16_relu_large_nt_v1 Tactic: -2194148180068068313
[12/29/2021-03:40:13] [V] [TRT] Tactic: -2194148180068068313 Time: 0.020388
[12/29/2021-03:40:13] [V] [TRT] Conv_11 + Relu_14 Set Tactic Name: sm80_xmma_fprop_implicit_gemm_interleaved_i8f32_i8i32_f32_nchw_vect_c_32kcrs_vect_c_32_nchw_vect_c_32_tilesize128x64x64_stage6_warpsize2x2x1_g1_tensor16x8x32 Tactic: -1782593837177056527
[12/29/2021-03:40:13] [V] [TRT] Tactic: -1782593837177056527 Time: 0.010848
[12/29/2021-03:40:13] [V] [TRT] Conv_11 + Relu_14 Set Tactic Name: ampere_fp32_i8816cudnn_int8_256x64_ldg16_relu_small_nt_v1 Tactic: -1610768292520086910
[12/29/2021-03:40:13] [V] [TRT] Tactic: -1610768292520086910 Time: 0.015372
[12/29/2021-03:40:13] [V] [TRT] Conv_11 + Relu_14 Set Tactic Name: sm80_xmma_fprop_implicit_gemm_interleaved_i8f32_i8i32_f32_nchw_vect_c_32kcrs_vect_c_32_nchw_vect_c_32_tilesize128x256x64_stage4_warpsize2x4x1_g1_tensor16x8x32_t1r3s3 Tactic: -1573035963956198975
[12/29/2021-03:40:13] [V] [TRT] Tactic: -1573035963956198975 Time: 0.018796
[12/29/2021-03:40:13] [V] [TRT] Conv_11 + Relu_14 Set Tactic Name: ampere_fp32_i8816cudnn_int8_128x128_ldg16_relu_large_nt_v1 Tactic: -1558762241666006941
[12/29/2021-03:40:13] [V] [TRT] Tactic: -1558762241666006941 Time: 0.015516
[12/29/2021-03:40:13] [V] [TRT] Conv_11 + Relu_14 Set Tactic Name: ampere_fp32_i8816cudnn_int8_256x64_ldg16_relu_singleBuffer_large_nt_v1 Tactic: -1365353082499976145
[12/29/2021-03:40:13] [V] [TRT] Tactic: -1365353082499976145 Time: 0.016704
[12/29/2021-03:40:13] [V] [TRT] Conv_11 + Relu_14 Set Tactic Name: ampere_fp32_i8816cudnn_int8_256x64_ldg16_relu_medium_nt_v1 Tactic: -621838502160440068
[12/29/2021-03:40:13] [V] [TRT] Tactic: -621838502160440068 Time: 0.016584
[12/29/2021-03:40:13] [V] [TRT] Fastest Tactic: -5100834417027499764 Time: 0.008228
[12/29/2021-03:40:13] [V] [TRT] >>>>>>>>>>>>>>> Chose Runner Type: CaskConvolution Tactic: -5100834417027499764
[12/29/2021-03:40:13] [V] [TRT] *************** Autotuning format combination: Int8(128,64:32,8,1) -> Int8(128,64:32,8,1) ***************
[12/29/2021-03:40:13] [V] [TRT] --------------- Timing Runner: Conv_11 + Relu_14 (CudaGroupConvolution)
[12/29/2021-03:40:13] [V] [TRT] CudaGroupConvolution has no valid tactics for this config, skipping
[12/29/2021-03:40:13] [V] [TRT] --------------- Timing Runner: Conv_11 + Relu_14 (CudaDepthwiseConvolution)
[12/29/2021-03:40:13] [V] [TRT] CudaDepthwiseConvolution has no valid tactics for this config, skipping
[12/29/2021-03:40:13] [V] [TRT] --------------- Timing Runner: Conv_11 + Relu_14 (FusedConvActConvolution)
[12/29/2021-03:40:13] [V] [TRT] FusedConvActConvolution has no valid tactics for this config, skipping
[12/29/2021-03:40:13] [V] [TRT] --------------- Timing Runner: Conv_11 + Relu_14 (CaskConvolution)
[12/29/2021-03:40:13] [V] [TRT] Conv_11 + Relu_14 Set Tactic Name: sm80_xmma_fprop_implicit_gemm_interleaved_i8i8_i8i32_f32_nchw_vect_c_32kcrs_vect_c_32_nchw_vect_c_32_tilesize64x32x64_stage6_warpsize2x1x1_g1_tensor16x8x32_epifadd Tactic: 177040020707947851
[12/29/2021-03:40:13] [V] [TRT] Tactic: 177040020707947851 Time: 0.00828
[12/29/2021-03:40:13] [V] [TRT] Conv_11 + Relu_14 Set Tactic Name: sm80_xmma_fprop_implicit_gemm_interleaved_i8i8_i8i32_f32_nchw_vect_c_32kcrs_vect_c_32_nchw_vect_c_32_tilesize32x64x64_stage6_warpsize2x2x1_g1_tensor16x8x32_epifadd Tactic: 1550399266192842845
[12/29/2021-03:40:13] [V] [TRT] Tactic: 1550399266192842845 Time: 0.008648
[12/29/2021-03:40:13] [V] [TRT] Conv_11 + Relu_14 Set Tactic Name: sm80_xmma_fprop_implicit_gemm_interleaved_i8i8_i8i32_f32_nchw_vect_c_32kcrs_vect_c_32_nchw_vect_c_32_tilesize256x32x64_stage4_warpsize4x1x1_g1_tensor16x8x32_t1r3s3_epifadd Tactic: 1572887561103143487
[12/29/2021-03:40:13] [V] [TRT] Tactic: 1572887561103143487 Time: 0.009652
[12/29/2021-03:40:13] [V] [TRT] Conv_11 + Relu_14 Set Tactic Name: sm80_xmma_fprop_implicit_gemm_interleaved_i8i8_i8i32_f32_nchw_vect_c_32kcrs_vect_c_32_nchw_vect_c_32_tilesize256x64x64_stage4_warpsize4x1x1_g1_tensor16x8x32 Tactic: 2325023763229477890
[12/29/2021-03:40:13] [V] [TRT] Tactic: 2325023763229477890 Time: 0.012768
[12/29/2021-03:40:13] [V] [TRT] Conv_11 + Relu_14 Set Tactic Name: ampere_int8_i8816cudnn_int8_128x128_ldg16_relu_medium_nt_v1 Tactic: 2985940154541537814
[12/29/2021-03:40:13] [V] [TRT] Tactic: 2985940154541537814 Time: 0.015052
[12/29/2021-03:40:13] [V] [TRT] Conv_11 + Relu_14 Set Tactic Name: sm80_xmma_fprop_implicit_gemm_interleaved_i8i8_i8i32_f32_nchw_vect_c_32kcrs_vect_c_32_nchw_vect_c_32_tilesize32x32x64_stage6_warpsize2x1x1_g1_tensor16x8x32_t1r3s3_epifadd Tactic: 3284282970967328046
[12/29/2021-03:40:13] [V] [TRT] Tactic: 3284282970967328046 Time: 0.008184
[12/29/2021-03:40:13] [V] [TRT] Conv_11 + Relu_14 Set Tactic Name: sm80_xmma_fprop_implicit_gemm_interleaved_i8i8_i8i32_f32_nchw_vect_c_32kcrs_vect_c_32_nchw_vect_c_32_tilesize64x32x64_stage6_warpsize2x1x1_g1_tensor16x8x32_t1r3s3 Tactic: 3401614690060226673
[12/29/2021-03:40:13] [V] [TRT] Tactic: 3401614690060226673 Time: 0.00786
[12/29/2021-03:40:13] [V] [TRT] Conv_11 + Relu_14 Set Tactic Name: sm80_xmma_fprop_implicit_gemm_interleaved_i8i8_i8i32_f32_nchw_vect_c_32kcrs_vect_c_32_nchw_vect_c_32_tilesize64x64x64_stage6_warpsize2x2x1_g1_tensor16x8x32_t1r3s3_epifadd Tactic: 3512426920013359699
[12/29/2021-03:40:13] [V] [TRT] Tactic: 3512426920013359699 Time: 0.008044
[12/29/2021-03:40:13] [V] [TRT] Conv_11 + Relu_14 Set Tactic Name: ampere_int8_i8816cudnn_int8_256x128_ldg16_relu_medium_nt_v1 Tactic: 3899284354987683408
[12/29/2021-03:40:13] [V] [TRT] Tactic: 3899284354987683408 Time: 0.021248
[12/29/2021-03:40:13] [V] [TRT] Conv_11 + Relu_14 Set Tactic Name: sm80_xmma_fprop_implicit_gemm_interleaved_i8i8_i8i32_f32_nchw_vect_c_32kcrs_vect_c_32_nchw_vect_c_32_tilesize64x128x64_stage6_warpsize2x2x1_g1_tensor16x8x32 Tactic: 4042202769383439184
[12/29/2021-03:40:13] [V] [TRT] Tactic: 4042202769383439184 Time: 0.009712
[12/29/2021-03:40:13] [V] [TRT] Conv_11 + Relu_14 Set Tactic Name: ampere_int8_i8816cudnn_int8_256x64_ldg16_relu_large_nt_v1 Tactic: 4182625619810185112
[12/29/2021-03:40:13] [V] [TRT] Tactic: 4182625619810185112 Time: 0.016912
[12/29/2021-03:40:13] [V] [TRT] Conv_11 + Relu_14 Set Tactic Name: sm80_xmma_fprop_implicit_gemm_interleaved_i8i8_i8i32_f32_nchw_vect_c_32kcrs_vect_c_32_nchw_vect_c_32_tilesize256x32x64_stage4_warpsize4x1x1_g1_tensor16x8x32_epifadd Tactic: 4259547356717612415
[12/29/2021-03:40:13] [V] [TRT] Tactic: 4259547356717612415 Time: 0.010196
[12/29/2021-03:40:13] [V] [TRT] Conv_11 + Relu_14 Set Tactic Name: ampere_int8_i8816cudnn_int8_256x64_ldg16_relu_small_nt_v1 Tactic: 4717285412741024953
[12/29/2021-03:40:13] [V] [TRT] Tactic: 4717285412741024953 Time: 0.01526
[12/29/2021-03:40:13] [V] [TRT] Conv_11 + Relu_14 Set Tactic Name: sm80_xmma_fprop_implicit_gemm_interleaved_i8i8_i8i32_f32_nchw_vect_c_32kcrs_vect_c_32_nchw_vect_c_32_tilesize128x256x64_stage4_warpsize2x4x1_g1_tensor16x8x32 Tactic: 4734519122557206480
[12/29/2021-03:40:13] [V] [TRT] Tactic: 4734519122557206480 Time: 0.01896
[12/29/2021-03:40:13] [V] [TRT] Conv_11 + Relu_14 Set Tactic Name: sm80_xmma_fprop_implicit_gemm_interleaved_i8i8_i8i32_f32_nchw_vect_c_32kcrs_vect_c_32_nchw_vect_c_32_tilesize128x256x64_stage4_warpsize2x4x1_g1_tensor16x8x32_epifadd Tactic: 5121596860264626879
[12/29/2021-03:40:13] [V] [TRT] Tactic: 5121596860264626879 Time: 0.018952
[12/29/2021-03:40:13] [V] [TRT] Conv_11 + Relu_14 Set Tactic Name: sm80_xmma_fprop_implicit_gemm_interleaved_i8i8_i8i32_f32_nchw_vect_c_32kcrs_vect_c_32_nchw_vect_c_32_tilesize32x32x64_stage6_warpsize2x1x1_g1_tensor16x8x32_t1r3s3 Tactic: 5136656982162849059
[12/29/2021-03:40:13] [V] [TRT] Tactic: 5136656982162849059 Time: 0.00822
[12/29/2021-03:40:13] [V] [TRT] Conv_11 + Relu_14 Set Tactic Name: sm80_xmma_fprop_implicit_gemm_interleaved_i8i8_i8i32_f32_nchw_vect_c_32kcrs_vect_c_32_nchw_vect_c_32_tilesize64x128x64_stage6_warpsize2x2x1_g1_tensor16x8x32_epifadd Tactic: 5158259316594207439
[12/29/2021-03:40:13] [V] [TRT] Tactic: 5158259316594207439 Time: 0.009844
[12/29/2021-03:40:13] [V] [TRT] Conv_11 + Relu_14 Set Tactic Name: sm80_xmma_fprop_implicit_gemm_interleaved_i8i8_i8i32_f32_nchw_vect_c_32kcrs_vect_c_32_nchw_vect_c_32_tilesize256x64x64_stage4_warpsize4x1x1_g1_tensor16x8x32_t1r3s3_epifadd Tactic: 5966973378912044513
[12/29/2021-03:40:13] [V] [TRT] Tactic: 5966973378912044513 Time: 0.012732
[12/29/2021-03:40:13] [V] [TRT] Conv_11 + Relu_14 Set Tactic Name: sm80_xmma_fprop_implicit_gemm_interleaved_i8i8_i8i32_f32_nchw_vect_c_32kcrs_vect_c_32_nchw_vect_c_32_tilesize256x32x64_stage4_warpsize4x1x1_g1_tensor16x8x32_t1r3s3 Tactic: 6004789655466615912
[12/29/2021-03:40:13] [V] [TRT] Tactic: 6004789655466615912 Time: 0.009772
[12/29/2021-03:40:13] [V] [TRT] Conv_11 + Relu_14 Set Tactic Name: sm80_xmma_fprop_implicit_gemm_interleaved_i8i8_i8i32_f32_nchw_vect_c_32kcrs_vect_c_32_nchw_vect_c_32_tilesize128x256x64_stage4_warpsize2x4x1_g1_tensor16x8x32_t1r3s3 Tactic: 6146901278630392829
[12/29/2021-03:40:13] [V] [TRT] Tactic: 6146901278630392829 Time: 0.018516
[12/29/2021-03:40:13] [V] [TRT] Conv_11 + Relu_14 Set Tactic Name: sm80_xmma_fprop_implicit_gemm_interleaved_i8i8_i8i32_f32_nchw_vect_c_32kcrs_vect_c_32_nchw_vect_c_32_tilesize256x128x64_stage4_warpsize4x2x1_g1_tensor16x8x32_epifadd Tactic: 6434020722187266170
[12/29/2021-03:40:13] [V] [TRT] Tactic: 6434020722187266170 Time: 0.019212
[12/29/2021-03:40:13] [V] [TRT] Conv_11 + Relu_14 Set Tactic Name: sm80_xmma_fprop_implicit_gemm_interleaved_i8i8_i8i32_f32_nchw_vect_c_32kcrs_vect_c_32_nchw_vect_c_32_tilesize128x64x64_stage6_warpsize2x2x1_g1_tensor16x8x32 Tactic: 6781129591847482048
[12/29/2021-03:40:13] [V] [TRT] Tactic: 6781129591847482048 Time: 0.009876
[12/29/2021-03:40:13] [V] [TRT] Conv_11 + Relu_14 Set Tactic Name: sm80_xmma_fprop_implicit_gemm_interleaved_i8i8_i8i32_f32_nchw_vect_c_32kcrs_vect_c_32_nchw_vect_c_32_tilesize32x64x64_stage6_warpsize2x2x1_g1_tensor16x8x32_t1r3s3_epifadd Tactic: 7191893591576074000
[12/29/2021-03:40:13] [V] [TRT] Tactic: 7191893591576074000 Time: 0.008328
[12/29/2021-03:40:13] [V] [TRT] Conv_11 + Relu_14 Set Tactic Name: sm80_xmma_fprop_implicit_gemm_interleaved_i8i8_i8i32_f32_nchw_vect_c_32kcrs_vect_c_32_nchw_vect_c_32_tilesize64x128x64_stage6_warpsize2x2x1_g1_tensor16x8x32_t1r3s3_epifadd Tactic: 7438984192263206338
[12/29/2021-03:40:13] [V] [TRT] Tactic: 7438984192263206338 Time: 0.00928
[12/29/2021-03:40:13] [V] [TRT] Conv_11 + Relu_14 Set Tactic Name: sm80_xmma_fprop_implicit_gemm_interleaved_i8i8_i8i32_f32_nchw_vect_c_32kcrs_vect_c_32_nchw_vect_c_32_tilesize128x128x64_stage4_warpsize2x2x1_g1_tensor16x8x32_epifadd Tactic: 7504901284678552178
[12/29/2021-03:40:13] [V] [TRT] Tactic: 7504901284678552178 Time: 0.012476
[12/29/2021-03:40:13] [V] [TRT] Conv_11 + Relu_14 Set Tactic Name: sm80_xmma_fprop_implicit_gemm_interleaved_i8i8_i8i32_f32_nchw_vect_c_32kcrs_vect_c_32_nchw_vect_c_32_tilesize128x64x64_stage6_warpsize2x2x1_g1_tensor16x8x32_t1r3s3 Tactic: 8096257414008860171
[12/29/2021-03:40:13] [V] [TRT] Tactic: 8096257414008860171 Time: 0.009424
[12/29/2021-03:40:13] [V] [TRT] Conv_11 + Relu_14 Set Tactic Name: sm80_xmma_fprop_implicit_gemm_interleaved_i8i8_i8i32_f32_nchw_vect_c_32kcrs_vect_c_32_nchw_vect_c_32_tilesize64x32x64_stage6_warpsize2x1x1_g1_tensor16x8x32_t1r3s3_epifadd Tactic: 9143438935315839085
[12/29/2021-03:40:13] [V] [TRT] Tactic: 9143438935315839085 Time: 0.008032
[12/29/2021-03:40:13] [V] [TRT] Conv_11 + Relu_14 Set Tactic Name: sm80_xmma_fprop_implicit_gemm_interleaved_i8i8_i8i32_f32_nchw_vect_c_32kcrs_vect_c_32_nchw_vect_c_32_tilesize256x128x64_stage4_warpsize4x2x1_g1_tensor16x8x32 Tactic: -9165697322068360861
[12/29/2021-03:40:13] [V] [TRT] Tactic: -9165697322068360861 Time: 0.019148
[12/29/2021-03:40:13] [V] [TRT] Conv_11 + Relu_14 Set Tactic Name: ampere_int8_i8816cudnn_int8_256x64_ldg16_relu_singleBuffer_small_nt_v1 Tactic: -9118785798277698619
[12/29/2021-03:40:13] [V] [TRT] Tactic: -9118785798277698619 Time: 0.014464
[12/29/2021-03:40:13] [V] [TRT] Conv_11 + Relu_14 Set Tactic Name: sm80_xmma_fprop_implicit_gemm_interleaved_i8i8_i8i32_f32_nchw_vect_c_32kcrs_vect_c_32_nchw_vect_c_32_tilesize128x128x64_stage4_warpsize2x2x1_g1_tensor16x8x32 Tactic: -8263994888336646547
[12/29/2021-03:40:13] [V] [TRT] Tactic: -8263994888336646547 Time: 0.01256
[12/29/2021-03:40:13] [V] [TRT] Conv_11 + Relu_14 Set Tactic Name: sm80_xmma_fprop_implicit_gemm_interleaved_i8i8_i8i32_f32_nchw_vect_c_32kcrs_vect_c_32_nchw_vect_c_32_tilesize32x64x64_stage6_warpsize2x2x1_g1_tensor16x8x32 Tactic: -8205948405243401049
[12/29/2021-03:40:13] [V] [TRT] Tactic: -8205948405243401049 Time: 0.008584
[12/29/2021-03:40:13] [V] [TRT] Conv_11 + Relu_14 Set Tactic Name: sm80_xmma_fprop_implicit_gemm_interleaved_i8i8_i8i32_f32_nchw_vect_c_32kcrs_vect_c_32_nchw_vect_c_32_tilesize128x64x64_stage6_warpsize2x2x1_g1_tensor16x8x32_t1r3s3_epifadd Tactic: -7992068592656168418
[12/29/2021-03:40:13] [V] [TRT] Tactic: -7992068592656168418 Time: 0.009408
[12/29/2021-03:40:13] [V] [TRT] Conv_11 + Relu_14 Set Tactic Name: sm80_xmma_fprop_implicit_gemm_interleaved_i8i8_i8i32_f32_nchw_vect_c_32kcrs_vect_c_32_nchw_vect_c_32_tilesize256x64x64_stage4_warpsize4x1x1_g1_tensor16x8x32_epifadd Tactic: -7842775553137511386
[12/29/2021-03:40:13] [V] [TRT] Tactic: -7842775553137511386 Time: 0.012844
[12/29/2021-03:40:13] [V] [TRT] Conv_11 + Relu_14 Set Tactic Name: sm80_xmma_fprop_implicit_gemm_interleaved_i8i8_i8i32_f32_nchw_vect_c_32kcrs_vect_c_32_nchw_vect_c_32_tilesize64x32x64_stage6_warpsize2x1x1_g1_tensor16x8x32 Tactic: -7683887278997527517
[12/29/2021-03:40:13] [V] [TRT] Tactic: -7683887278997527517 Time: 0.008464
[12/29/2021-03:40:13] [V] [TRT] Conv_11 + Relu_14 Set Tactic Name: ampere_int8_i8816cudnn_int8_128x128_ldg16_relu_small_nt_v1 Tactic: -6400348606759295499
[12/29/2021-03:40:13] [V] [TRT] Tactic: -6400348606759295499 Time: 0.0144
[12/29/2021-03:40:13] [V] [TRT] Conv_11 + Relu_14 Set Tactic Name: ampere_int8_i8816cudnn_int8_256x128_ldg16_relu_small_nt_v1 Tactic: -5980889159865208399
[12/29/2021-03:40:13] [V] [TRT] Tactic: -5980889159865208399 Time: 0.020532
[12/29/2021-03:40:13] [V] [TRT] Conv_11 + Relu_14 Set Tactic Name: ampere_int8_i8816cudnn_int8_256x64_ldg16_relu_singleBuffer_medium_nt_v1 Tactic: -5766140806760372989
[12/29/2021-03:40:13] [V] [TRT] Tactic: -5766140806760372989 Time: 0.016096
[12/29/2021-03:40:13] [V] [TRT] Conv_11 + Relu_14 Set Tactic Name: sm80_xmma_fprop_implicit_gemm_interleaved_i8i8_i8i32_f32_nchw_vect_c_32kcrs_vect_c_32_nchw_vect_c_32_tilesize128x128x64_stage4_warpsize2x2x1_g1_tensor16x8x32_t1r3s3_epifadd Tactic: -5709079507616090666
[12/29/2021-03:40:13] [V] [TRT] Tactic: -5709079507616090666 Time: 0.012336
[12/29/2021-03:40:13] [V] [TRT] Conv_11 + Relu_14 Set Tactic Name: sm80_xmma_fprop_implicit_gemm_interleaved_i8i8_i8i32_f32_nchw_vect_c_32kcrs_vect_c_32_nchw_vect_c_32_tilesize128x256x64_stage4_warpsize2x4x1_g1_tensor16x8x32_t1r3s3_epifadd Tactic: -5698636014239116282
[12/29/2021-03:40:13] [V] [TRT] Tactic: -5698636014239116282 Time: 0.018532
[12/29/2021-03:40:13] [V] [TRT] Conv_11 + Relu_14 Set Tactic Name: sm80_xmma_fprop_implicit_gemm_interleaved_i8i8_i8i32_f32_nchw_vect_c_32kcrs_vect_c_32_nchw_vect_c_32_tilesize64x64x64_stage6_warpsize2x2x1_g1_tensor16x8x32_t1r3s3 Tactic: -4933563390723451692
[12/29/2021-03:40:13] [V] [TRT] Tactic: -4933563390723451692 Time: 0.008056
